WOS:000528191200036,10.1016/j.psychres.2020.112934,MEDLINE:32229390,The psychological impact of the COVID-19 epidemic on college students in China,"Cao, Wenjun; Fang, Ziwei; Hou, Guoqiang; Han, Mei; Xu, Xinrong; Dong, Jiaxin; Zheng, Jianzhong",PSYCHIATRY RESEARCH,1002 Clinical Medicine,Article,287,n/a,n/a,2020,3223,https://www.webofscience.com/api/gateway?GWVersion=2&SrcAuth=InCites&SrcApp=tsm_test&DestApp=WOS_CPL&DestLinkType=FullRecord&KeyUT=ISI:000528191200036,49.001828,17.226736068725586,15.919159,65.77,187.0929,202.4604,Domestic - Multiple,99.9917,3.222
WOS:000715856000024,10.1016/S0140-6736(21)02143-7,MEDLINE:34634250,Global prevalence and burden of depressive and anxiety disorders in 204 countries and territories in 2020 due to the COVID-19 pandemic,"Santomauro, Damian F.; Herrera, Ana M. Mantilla; Shadid, Jamileh; Zheng, Peng; Ashbaugh, Charlie; Pigott, David M.; Abbafati, Cristiana; Adolph, Christopher; Amlag, Joanne O.; Aravkin, Aleksandr Y.; Bang-Jensen, Bree L.; Bertolacci, Gregory J.; Bloom, Sabina S.; Castellano, Rachel; Castro, Emma; Chakrabarti, Suman; Chattopadhyay, Jhilik; Cogen, Rebecca M.; Collins, James K.; Dai, Xiaochen; Dangel, William James; Dapper, Carolyn; Deen, Amanda; Erickson, Megan; Ewald, Samuel B.; Flaxman, Abraham D.; Frostad, Joseph Jon; Fullman, Nancy; Giles, John R.; Giref, Ababi Zergaw; Guo, Gaorui; He, Jiawei; Helak, Monika; Hulland, Erin N.; Idrisov, Bulat; Lindstrom, Akiaja; Linebarger, Emily; Lotufo, Paulo A.; Lozano, Rafael; Magistro, Beatrice; Malta, Deborah Carvalho; Mansson, Johan C.; Marinho, Fatima; Monasta, Ali H. Mokdad Lorenzo; Naik, Paulami; Nomura, Shuhei; O'Halloran, James Kevin; Ostroff, Samuel M.; Pasovic, Maja; Penberthy, Louise; Reiner, Robert C., Jr.; Reinke, Grace; Ribeiro, Antonio Luiz P.; Sholokhov, Aleksei; Sorensen, Reed J. D.; Varavikova, Elena; Vo, Anh Truc; Walcott, Rebecca; Watson, Stefanie; Wiysonge, Charles Shey; Zigler, Bethany; Hay, Simon I.; Vos, Theo; Murray, Christopher J. L.; Whiteford, Harvey A.; Ferrari, Alize J.",LANCET,1002 Clinical Medicine,Article,398,10312,1700-1712,2021,3172,https://www.webofscience.com/api/gateway?GWVersion=2&SrcAuth=InCites&SrcApp=tsm_test&DestApp=WOS_CPL&DestLinkType=FullRecord&KeyUT=ISI:000715856000024,338.797468,12.310687065124512,41.275246,9.36,257.6623,76.8499,International - Quadrilateral +,99.9968,202.731
WOS:000522760200039,10.1016/S2213-2600(20)30076-X,n/a,Pathological findings of COVID-19 associated with acute respiratory distress syndrome,"Xu, Zhe; Shi, Lei; Wang, Yijin; Zhang, Jiyuan; Huang, Lei; Zhang, Chao; Liu, Shuhong; Zhao, Peng; Liu, Hongxia; Zhu, Li; Tai, Yanhong; Bai, Chongqing; Gao, Tingting; Song, Jinwen; Xia, Peng; Dong, Jinghui; Zhao, Jingmin; Wang, Fu-Sheng",LANCET RESPIRATORY MEDICINE,1002 Clinical Medicine,Article,8,4,420-422,2020,3167,https://www.webofscience.com/api/gateway?GWVersion=2&SrcAuth=InCites&SrcApp=tsm_test&DestApp=WOS_CPL&DestLinkType=FullRecord&KeyUT=ISI:000522760200039,325.626667,17.226736068725586,11.931917,9.73,183.8421,265.4226,Domestic - Single,99.9915,30.7
WOS:000518470100034,10.1016/S1470-2045(20)30096-6,MEDLINE:32066541,Cancer patients in SARS-CoV-2 infection: a nationwide analysis in China,"Liang, Wenhua; Guan, Weijie; Chen, Ruchong; Wang, Wei; Li, Jianfu; Xu, Ke; Li, Caichen; Ai, Qing; Lu, Weixiang; Liang, Hengrui; Li, Shiyue; He, Jianxing",LANCET ONCOLOGY,1002 Clinical Medicine,Editorial Material,21,3,335-337,2020,3126,https://www.webofscience.com/api/gateway?GWVersion=2&SrcAuth=InCites&SrcApp=tsm_test&DestApp=WOS_CPL&DestLinkType=FullRecord&KeyUT=ISI:000518470100034,30.134831,7.287540435791016,4.9022565,103.73,428.9513,637.6655,Domestic - Single,99.9971,41.316
WOS:000529485300005,10.1161/CIR.0000000000000757,MEDLINE:31992061,Heart Disease and Stroke Statistics-2020 Update: A Report From the American Heart Association,"Virani, Salim S.; Alonso, Alvaro; Benjamin, Emelia J.; Bittencourt, Marcio S.; Callaway, Clifton W.; Carson, April P.; Chamberlain, Alanna M.; Chang, Alexander R.; Cheng, Susan; Delling, Francesca N.; Djousse, Luc; Elkind, Mitchell S. V.; Ferguson, Jane F.; Fornage, Myriam; Khan, Sadiya S.; Kissela, Brett M.; Knutson, Kristen L.; Kwan, Tak W.; Lackland, Daniel T.; Lewis, Tene T.; Lichtman, Judith H.; Longenecker, Chris T.; Loop, Matthew Shane; Lutsey, Pamela L.; Martin, Seth S.; Matsushita, Kunihiro; Moran, Andrew E.; Mussolino, Michael E.; Perak, Amanda Marma; Rosamond, Wayne D.; Roth, Gregory A.; Sampson, Uchechukwu K. A.; Satou, Gary M.; Schroeder, Emily B.; Shah, Svati H.; Shay, Christina M.; Spartano, Nicole L.; Stokes, Andrew; Tirschwell, David L.; VanWagner, Lisa B.; Tsao, Connie W.",CIRCULATION,1002 Clinical Medicine,Article,141,9,E139-E596,2020,3091,https://www.webofscience.com/api/gateway?GWVersion=2&SrcAuth=InCites&SrcApp=tsm_test&DestApp=WOS_CPL&DestLinkType=FullRecord&KeyUT=ISI:000529485300005,137.961538,17.226736068725586,0.0,22.4,179.4304,0.0,n/a,99.9912,29.69
WOS:000563494500023,10.1016/j.jhep.2020.03.039,MEDLINE:32278004,A new definition for metabolic dysfunction-associated fatty liver disease: An international expert consensus statement,"Eslam, Mohammed; Newsome, Philip N.; Sarin, Shiv K.; Anstee, Quentin M.; Targher, Giovanni; Romero-Gomez, Manuel; Zelber-Sagi, Shira; Wong, Vincent Wai-Sun; Dufour, Jean-Francois; Schattenberg, Joern M.; Kawaguchi, Takumi; Arrese, Marco; Valenti, Luca; Shiha, Gamal; Tiribelli, Claudio; Yki-Jarvinen, Hannele; Fan, Jian-Gao; Gronbaek, Henning; Yilmaz, Yusuf; Cortez-Pinto, Helena; Oliveira, Claudia P.; Bedossa, Pierre; Adams, Leon A.; Zheng, Ming-Hua; Fouad, Yasser; Chan, Wah-Kheong; Mendez-Sanchez, Nahum; Ahn, Sang Hoon; Castera, Laurent; Bugianesi, Elisabetta; Ratziu, Vlad; George, Jacob",JOURNAL OF HEPATOLOGY,1002 Clinical Medicine,Article,73,1,202-209,2020,3087,https://www.webofscience.com/api/gateway?GWVersion=2&SrcAuth=InCites&SrcApp=tsm_test&DestApp=WOS_CPL&DestLinkType=FullRecord&KeyUT=ISI:000563494500023,115.005988,17.226736068725586,58.21995,26.84,179.1982,53.0231,International - Quadrilateral +,99.9909,25.083
WOS:000704446000008,10.1136/bmj.n2061,MEDLINE:34593508,A new framework for developing and evaluating complex interventions: update of Medical Research Council guidance,"Skivington, Kathryn; Matthews, Lynsay; Simpson, Sharon Anne; Craig, Peter; Baird, Janis; Blazeby, Jane M.; Boyd, Kathleen Anne; Craig, Neil; French, David P.; McIntosh, Emma; Petticrew, Mark; Rycroft-Malone, Jo; White, Martin; Moore, Laurence",BMJ-BRITISH MEDICAL JOURNAL,1002 Clinical Medicine,Article,374,n/a,n/a,2021,3073,https://www.webofscience.com/api/gateway?GWVersion=2&SrcAuth=InCites&SrcApp=tsm_test&DestApp=WOS_CPL&DestLinkType=FullRecord&KeyUT=ISI:000704446000008,132.651163,12.310687065124512,10.9792595,23.17,249.6205,279.8914,Domestic - Multiple,99.9965,96.216
WOS:000609179800027,10.1016/S0140-6736(20)32656-8,n/a,"6-month consequences of COVID-19 in patients discharged from hospital: a cohort study (Publication with Expression of Concern. See vol. 401, pg. 90, 2023) (Retracted Article)","Huang, Chaolin; Huang, Lixue; Wang, Yeming; Li, Xia; Ren, LiLi; Gu, Xiaoying; Kang, Liang; Guo, Li; Liu, Min; Zhou, Xing; Luo, Jianfeng; Huang, Zhenghui; Tu, Shengjin; Zhao, Yue; Chen, Li; Xu, Decui; Li, Yanping; Li, Caihong; Peng, Lu; Li, Yong; Xie, Wuxiang; Cui, Dan; Shang, Lianhan; Fan, Guohui; Xu, Jiuyang; Wang, Geng; Wang, Ying; Zhong, Jingchuan; Wang, Chen; Wang, Jianwei; Zhang, Dingyu; Cao, Bin",LANCET,1002 Clinical Medicine,Retracted Publication,397,10270,220-232,2021,3064,https://www.webofscience.com/api/gateway?GWVersion=2&SrcAuth=InCites&SrcApp=tsm_test&DestApp=WOS_CPL&DestLinkType=FullRecord&KeyUT=ISI:000609179800027,3064.0,13.922329902648926,19.498259,1.0,220.0781,157.1422,Domestic - Multiple,99.8382,202.731
WOS:001310333200001,10.1016/S0140-6736(23)00810-3,n/a,6-month consequences of COVID-19 in patients discharged from hospital: a cohort study,"Huang, Chaolin; Huang, Lixue; Wang, Yeming; Li, Xia; Ren, LiLi; Gu, Xiaoying; Kang, Liang; Guo, Li; Liu, Min; Zhou, Xing; Luo, Jianfeng; Huang, Zhenghui; Tu, Shengjin; Zhao, Yue; Chen, Li; Xu, Decui; Li, Yanping; Li, Caihong; Peng, Lu; Li, Yong; Xie, Wuxiang; Cui, Dan; Shang, Lianhan; Fan, Guohui; Xu, Jiuyang; Wang, Geng; Wang, Ying; Zhong, Jingchuan; Wang, Chen; Wang, Jianwei; Zhang, Dingyu; Cao, Bin",LANCET,1002 Clinical Medicine,Article,401,10393,E21-E33,2023,3064,https://www.webofscience.com/api/gateway?GWVersion=2&SrcAuth=InCites&SrcApp=tsm_test&DestApp=WOS_CPL&DestLinkType=FullRecord&KeyUT=ISI:001310333200001,138.167665,5.106153964996338,4.534348,22.18,600.0602,675.7311,Domestic - Multiple,99.9994,98.4
WOS:000691622000001,10.1056/NEJMoa2107038,MEDLINE:34449189,Empagliflozin in Heart Failure with a Preserved Ejection Fraction,"Anker, Stefan D.; Butler, Javed; Filippatos, Gerasimos; Ferreira, Joao P.; Bocchi, Edimar; Boehm, Michael; Brunner-La Rocca, Hans-Peter; Choi, Dong-Ju; Chopra, Vijay; Chuquiure-Valenzuela, Eduardo; Giannetti, Nadia; Gomez-Mesa, Juan Esteban; Janssens, Stefan; Januzzi, James L.; Gonzalez-Juanatey, Jose R.; Merkely, Bela; Nicholls, Stephen J.; Perrone, Sergio V.; Pina, Ileana L.; Ponikowski, Piotr; Senni, Michele; Sim, David; Spinar, Jindrich; Squire, Iain; Taddei, Stefano; Tsutsui, Hiroyuki; Verma, Subodh; Vinereanu, Dragos; Zhang, Jian; Carson, Peter; Lam, Carolyn Su Ping; Marx, Nikolaus; Zeller, Cordula; Sattar, Naveed; Jamal, Waheed; Schnaidt, Sven; Schnee, Janet M.; Brueckmann, Martina; Pocock, Stuart J.; Zannad, Faiez; Packer, Milton",NEW ENGLAND JOURNAL OF MEDICINE,1002 Clinical Medicine,Article,385,16,1451-1461,2021,2999,https://www.webofscience.com/api/gateway?GWVersion=2&SrcAuth=InCites&SrcApp=tsm_test&DestApp=WOS_CPL&DestLinkType=FullRecord&KeyUT=ISI:000691622000001,419.231788,12.310687065124512,41.275246,7.15,243.6095,72.6586,International - Quadrilateral +,99.9963,176.082
WOS:000767706400001,10.1093/eurjpc/zwab154,n/a,2021 ESC Guidelines on cardiovascular disease prevention in clinical practice,"Visseren, Frank L. J.; Mach, Francois; Smulders, Yvo M.; Carballo, David; Koskinas, Konstantinos C.; Back, Maria; Benetos, Athanase; Biffi, Alessandro; Boavida, Jose-Manuel; Capodanno, Davide; Cosyns, Bernard; Crawford, Carolyn; Davos, Constantinos H.; Desormais, Ileana; Di Angelantonio, Emanuele; Franco, Oscar H.; Halvorsen, Sigrun; Hobbs, F. D. Richard; Hollander, Monika; Jankowska, Ewa A.; Michal, Matthias; Sacco, Simona; Sattar, Naveed; Tokgozoglu, Lale; Tonstad, Serena; Tsioufis, Konstantinos P.; van Dis, Ineke; van Gelder, Isabelle C.; Wanner, Christoph; Williams, Bryan; De Backer, Guy; Regitz-Zagrosek, Vera; Aamodt, Anne Hege; Abdelhamid, Magdy; Aboyans, Victor; Albus, Christian; Asteggiano, Riccardo; Back, Magnus; Borger, Michael A.; Brotons, Carlos; Celutkiene, Jelena; Cifkova, Renata; Cikes, Maja; Cosentino, Francesco; Dagres, Nikolaos; De Backer, Tine; De Bacquer, Dirk; Delgado, Victoria; Den Ruijter, Hester; Dendale, Paul; Drexel, Heinz; Falk, Volkmar; Fauchier, Laurent; Ference, Brian A.; Ferrieres, Jean; Ferrini, Marc; Fisher, Miles; Fliser, Danilo; Fras, Zlatko; Gaita, Dan; Giampaoli, Simona; Gielen, Stephan; Graham, Ian; Jennings, Catriona; Jorgensen, Torben; Kautzky-Willer, Alexandra; Kavousi, Maryam; Koenig, Wolfgang; Konradi, Aleksandra; Kotecha, Dipak; Landmesser, Ulf; Lettino, Madalena; Lewis, Basil S.; Linhart, Ales; Lochen, Maja-Lisa; Makrilakis, Konstantinos; Mancia, Giuseppe; Marques-Vidal, Pedro; McEvoy, John William; McGreavy, Paul; Merkely, Bela; Neubeck, Lis; Nielsen, Jens Cosedis; Perk, Joep; Petersen, Steffen E.; Petronio, Anna Sonia; Piepoli, Massimo; Pogosova, Nana Goar; Prescott, Eva Irene Bossano; Ray, Kausik K.; Reiner, Zeljko; Richter, Dimitrios J.; Ryden, Lars; Shlyakhto, Evgeny; Sitges, Marta; Sousa-Uva, Miguel; Sudano, Isabella; Tiberi, Monica; Touyz, Rhian M.; Ungar, Andrea; Verschuren, W. M. Monique; Wiklund, Olov; Wood, David; Luis Zamorano, Jose",EUROPEAN JOURNAL OF PREVENTIVE CARDIOLOGY,1002 Clinical Medicine,Article,29,1,5-115,2021,2922,https://www.webofscience.com/api/gateway?GWVersion=2&SrcAuth=InCites&SrcApp=tsm_test&DestApp=WOS_CPL&DestLinkType=FullRecord&KeyUT=ISI:000767706400001,54.616,12.310687065124512,41.275246,53.5,237.3547,70.793,International - Quadrilateral +,99.996,8.526
WOS:000553153600012,10.1001/jamacardio.2020.0950,MEDLINE:32211816,"Association of Cardiac Injury With Mortality in Hospitalized Patients With COVID-19 in Wuhan, China","Shi, Shaobo; Qin, Mu; Shen, Bo; Cai, Yuli; Liu, Tao; Yang, Fan; Gong, Wei; Liu, Xu; Liang, Jinjun; Zhao, Qinyan; Huang, He; Yang, Bo; Huang, Congxin",JAMA CARDIOLOGY,1002 Clinical Medicine,Article,5,7,802-810,2020,2862,https://www.webofscience.com/api/gateway?GWVersion=2&SrcAuth=InCites&SrcApp=tsm_test&DestApp=WOS_CPL&DestLinkType=FullRecord&KeyUT=ISI:000553153600012,121.378882,17.226736068725586,15.919159,23.58,166.1371,179.7834,Domestic - Multiple,99.9907,14.676
WOS:000562845100026,10.1001/jama.2020.12603,MEDLINE:32644129,Persistent Symptoms in Patients After Acute COVID-19,"Carfi, Angelo; Bernabei, Roberto; Landi, Francesco",JAMA-JOURNAL OF THE AMERICAN MEDICAL ASSOCIATION,1002 Clinical Medicine,Letter,324,6,603-605,2020,2860,https://www.webofscience.com/api/gateway?GWVersion=2&SrcAuth=InCites&SrcApp=tsm_test&DestApp=WOS_CPL&DestLinkType=FullRecord&KeyUT=ISI:000562845100026,80.984252,9.00502872467041,6.513797,35.32,317.6003,439.068,Domestic - Single,99.9835,56.274
WOS:000654112300011,10.1016/j.rec.2021.05.002,n/a,2020 ESC Guidelines on the Diagnosis and Treatment of Non-ST-Segment Elevation Acute Coronary Syndrome Working Group of the European Society of Cardiology (ESC) for the diagnosis and treatment of acute coronary syndrome (ACS) in patients without persistent ST segment elevation,"Collet, Jean-Philippe; Thiele, Holger; Barbato, Emanuele; Barthelemy, Olivier; Bauersachs, Johann; Bhatt, Deepak L.; Dendale, Paul; Dorobantu, Maria; Edvardsen, Thor; Folliguet, Thierry; Gale, Chris P.; Gilard, Martine; Jobs, Alexander; Juni, Peter; Lambrinou, Ekaterini; Lewis, Basil S.; Mehilli, Julinda; Meliga, Emanuele; Merkely, Bela; Mueller, Christian; Roffi, Marco; Rutten, Frans H.; Sibbing, Dirk; Siontis, George C. M.",REVISTA ESPANOLA DE CARDIOLOGIA,1002 Clinical Medicine,Article,74,6,n/a,2021,2858,https://www.webofscience.com/api/gateway?GWVersion=2&SrcAuth=InCites&SrcApp=tsm_test&DestApp=WOS_CPL&DestLinkType=FullRecord&KeyUT=ISI:000654112300011,52.833333,12.310687065124512,41.275246,54.09,232.156,69.2425,International - Quadrilateral +,99.9958,7.05
WOS:000536221500011,10.1001/jama.2020.4683,MEDLINE:32203977,Case-Fatality Rate and Characteristics of Patients Dying in Relation to COVID-19 in Italy,"Onder, Graziano; Rezza, Giovanni; Brusaferro, Silvio",JAMA-JOURNAL OF THE AMERICAN MEDICAL ASSOCIATION,1002 Clinical Medicine,Editorial Material,323,18,1775-1776,2020,2850,https://www.webofscience.com/api/gateway?GWVersion=2&SrcAuth=InCites&SrcApp=tsm_test&DestApp=WOS_CPL&DestLinkType=FullRecord&KeyUT=ISI:000536221500011,86.842679,7.287540435791016,4.9022565,32.82,391.0784,581.3649,Domestic - Single,99.9957,56.274
WOS:000553153600013,10.1001/jamacardio.2020.1017,MEDLINE:32219356,Cardiovascular Implications of Fatal Outcomes of Patients With Coronavirus Disease 2019 (COVID-19),"Guo, Tao; Fan, Yongzhen; Chen, Ming; Wu, Xiaoyan; Zhang, Lin; He, Tao; Wang, Hairong; Wan, Jing; Wang, Xinghuan; Lu, Zhibing",JAMA CARDIOLOGY,1002 Clinical Medicine,Article,5,7,811-818,2020,2773,https://www.webofscience.com/api/gateway?GWVersion=2&SrcAuth=InCites&SrcApp=tsm_test&DestApp=WOS_CPL&DestLinkType=FullRecord&KeyUT=ISI:000553153600013,121.378882,17.226736068725586,11.931917,22.85,160.9707,232.4019,Domestic - Single,99.9904,14.676
WOS:000528577500010,10.1136/gpsych-2020-100213,MEDLINE:32215365,A nationwide survey of psychological distress among Chinese people in the COVID-19 epidemic: implications and policy recommendations,"Qiu, Jianyin; Shen, Bin; Zhao, Min; Wang, Zhen; Xie, Bin; Xu, Yifeng",GENERAL PSYCHIATRY,1002 Clinical Medicine,Editorial Material,33,2,n/a,2020,2739,https://www.webofscience.com/api/gateway?GWVersion=2&SrcAuth=InCites&SrcApp=tsm_test&DestApp=WOS_CPL&DestLinkType=FullRecord&KeyUT=ISI:000528577500010,287.0,7.287540435791016,8.73287,9.54,375.847,313.6426,Domestic - Multiple,99.9943,n/a
WOS:000892348700001,10.1056/NEJMoa2212948,n/a,Lecanemab in Early Alzheimer's Disease,"van Dyck, Christopher H.; Swanson, Chad J.; Aisen, Paul; Bateman, Randall J.; Chen, Christopher; Gee, Michelle; Kanekiyo, Michio; Li, David; Reyderman, Larisa; Cohen, Sharon; Froelich, Lutz; Katayama, Sadao; Sabbagh, Marwan; Vellas, Bruno; Watson, David; Dhadda, Shobha; Irizarry, Michael; Kramer, Lynn D.; Iwatsubo, Takeshi",NEW ENGLAND JOURNAL OF MEDICINE,1002 Clinical Medicine,Article,388,1,9-21,2022,2731,https://www.webofscience.com/api/gateway?GWVersion=2&SrcAuth=InCites&SrcApp=tsm_test&DestApp=WOS_CPL&DestLinkType=FullRecord&KeyUT=ISI:000892348700001,220.034615,8.23607063293457,29.30313,12.41,331.5902,93.1982,International - Quadrilateral +,99.9986,158.5
WOS:000639319500004,10.1161/CIR.0000000000000923,n/a,2020 ACC/AHA Guideline for the Management of Patients With Valvular Heart Disease: A Report of the American College of Cardiology/American Heart Association Joint Committee on Clinical Practice Guidelines,"Otto, Catherine M.; Nishimura, Rick A.; Bonow, Robert O.; Carabello, Blase A.; Erwin, John P., III; Gentile, Federico; Jneid, Hani; Krieger, Eric V.; Mack, Michael; McLeod, Christopher; O'Gara, Patrick T.; Rigolin, Vera H.; Sundt, Thoralf M., III; Thompson, Annemarie; Toly, Christopher",CIRCULATION,1002 Clinical Medicine,Article,143,5,e72-e227,2021,2725,https://www.webofscience.com/api/gateway?GWVersion=2&SrcAuth=InCites&SrcApp=tsm_test&DestApp=WOS_CPL&DestLinkType=FullRecord&KeyUT=ISI:000639319500004,113.838235,12.310687065124512,0.0,23.94,221.3524,0.0,n/a,99.9955,39.922
WOS:000940638400002,10.1161/CIR.0000000000001123,MEDLINE:36695182,Heart Disease and Stroke Statistics-2023 Update: A Report From the American Heart Association,"Tsao, Connie W.; Aday, Aaron W.; Almarzooq, Zaid I.; Anderson, Cheryl A. M.; Arora, Pankaj; Avery, Christy L.; Baker-Smith, Carissa M.; Beaton, Andrea Z.; Boehme, Amelia K.; Buxton, Alfred E.; Commodore-Mensah, Yvonne; Elkind, Mitchell S. V.; Evenson, Kelly R.; Eze-Nliam, Chete; Fugar, Setri; Generoso, Giuliano; Heard, Debra G.; Hiremath, Swapnil; Ho, Jennifer E.; Kalani, Rizwan; Kazi, Dhruv S.; Ko, Darae; Levine, Deborah A.; Liu, Junxiu; Ma, Jun; Magnani, Jared W.; Michos, Erin D.; Mussolino, Michael E.; Navaneethan, Sankar D.; Parikh, Nisha I.; Poudel, Remy; Rezk-Hanna, Mary; Roth, Gregory A.; Shah, Nilay S.; St-Onge, Marie-Pierre; Thacker, Evan L.; Virani, Salim S.; Voeks, Jenifer H.; Wang, Nae-Yuh; Wong, Nathan D.; Wong, Sally S.; Yaffe, Kristine; Martin, Seth S.",CIRCULATION,1002 Clinical Medicine,Article,147,8,E93-E621,2023,2722,https://www.webofscience.com/api/gateway?GWVersion=2&SrcAuth=InCites&SrcApp=tsm_test&DestApp=WOS_CPL&DestLinkType=FullRecord&KeyUT=ISI:000940638400002,57.676471,5.106153964996338,0.0,47.19,533.0822,0.0,n/a,99.9991,35.6
WOS:000747792900015,10.1016/S2215-0366(21)00395-3,MEDLINE:35026139,"Global, regional, and national burden of 12 mental disorders in 204 countries and territories, 1990-2019: a systematic analysis for the Global Burden of Disease Study 2019","Ferrari, Alize J.; Santomauro, Damian F.; Herrera, Ana M. Mantilla; Shadid, Jamileh; Ashbaugh, Charlie; Erskine, Holly E.; Charlson, Fiona J.; Degenhardt, Louisa; Scott, James G.; McGrath, John J.; Allebeck, Peter; Benjet, Corina; Breitborde, Nicholas J. K.; Brugha, Traolach; Dai, Xiaochen; Dandona, Lalit; Dandona, Rakhi; Fischer, Florian; Haagsma, Juanita A.; Maria Haro, Josep; Kieling, Christian; Knudsen, Ann Kristin Skrindo; Kumar, G. Anil; Leung, Janni; Majeed, Azeem; Mitchell, Philip B.; Moitra, Modhurima; Mokdad, Ali H.; Molokhia, Mariam; Patten, Scott B.; Patton, George C.; Phillips, Michael R.; Soriano, Joan B.; Stein, Dan J.; Stein, Murray B.; Szoeke, Cassandra E., I; Naghavi, Mohsen; Hay, Simon, I; Murray, Christopher J. L.; Vos, Theo; Whiteford, Harvey A.",LANCET PSYCHIATRY,1002 Clinical Medicine,Article,9,2,137-150,2022,2721,https://www.webofscience.com/api/gateway?GWVersion=2&SrcAuth=InCites&SrcApp=tsm_test&DestApp=WOS_CPL&DestLinkType=FullRecord&KeyUT=ISI:000747792900015,85.035088,8.23607063293457,29.30313,32.0,330.376,92.857,International - Quadrilateral +,99.9984,64.3
WOS:000523764800003,10.1136/bmj.m1091,n/a,Clinical characteristics of 113 deceased patients with coronavirus disease 2019: retrospective study,"Chen, Tao; Wu, Di; Chen, Huilong; Yan, Weiming; Yang, Danlei; Chen, Guang; Ma, Ke; Xu, Dong; Yu, Haijing; Wang, Hongwu; Wang, Tao; Guo, Wei; Chen, Jia; Ding, Chen; Zhang, Xiaoping; Huang, Jiaquan; Han, Meifang; Li, Shusheng; Luo, Xiaoping; Zhao, Jianping; Ning, Qin",BMJ-BRITISH MEDICAL JOURNAL,1002 Clinical Medicine,Article,368,n/a,n/a,2020,2715,https://www.webofscience.com/api/gateway?GWVersion=2&SrcAuth=InCites&SrcApp=tsm_test&DestApp=WOS_CPL&DestLinkType=FullRecord&KeyUT=ISI:000523764800003,213.992537,17.226736068725586,11.931917,12.69,157.6039,227.541,Domestic - Single,99.9902,39.89
WOS:000760439300022,10.1016/j.jhep.2021.11.018,MEDLINE:34801630,BCLC strategy for prognosis prediction and treatment recommendation: The 2022 update,"Reig, Maria; Forner, Alejandro; Rimola, Jordi; Ferrer-Fabrega, Joana; Burrel, Marta; Garcia-Criado, Angeles; Kelley, Robin K.; Galle, Peter R.; Mazzaferro, Vincenzo; Salem, Riad; Sangro, Bruno; Singal, Amit G.; Vogel, Arndt; Fuster, Josep; Ayuso, Carmen; Bruix, Jordi",JOURNAL OF HEPATOLOGY,1002 Clinical Medicine,Review,76,3,681-693,2022,2688,https://www.webofscience.com/api/gateway?GWVersion=2&SrcAuth=InCites&SrcApp=tsm_test&DestApp=WOS_CPL&DestLinkType=FullRecord&KeyUT=ISI:000760439300022,147.333333,15.629076957702637,37.600357,18.24,171.9871,71.4887,International - Quadrilateral +,99.997,25.7
WOS:000551360100002,10.1038/s41571-020-0410-2,MEDLINE:32699309,Clinical development and potential of photothermal and photodynamic therapies for cancer,"Li, Xingshu; Lovell, Jonathan F.; Yoon, Juyoung; Chen, Xiaoyuan",NATURE REVIEWS CLINICAL ONCOLOGY,1002 Clinical Medicine,Review,17,11,657-674,2020,2680,https://www.webofscience.com/api/gateway?GWVersion=2&SrcAuth=InCites&SrcApp=tsm_test&DestApp=WOS_CPL&DestLinkType=FullRecord&KeyUT=ISI:000551360100002,400.511111,32.51534652709961,49.662792,6.69,82.4226,53.9639,International - Trilateral,99.9867,66.675
WOS:000562973000041,10.1542/peds.2020-0702,MEDLINE:32179660,Epidemiology of COVID-19 Among Children in China,"Dong, Yuanyuan; Mo, Xi; Hu, Yabin; Qi, Xin; Jiang, Fan; Jiang, Zhongyi; Tong, Shilu",PEDIATRICS,1002 Clinical Medicine,Article,145,6,n/a,2020,2659,https://www.webofscience.com/api/gateway?GWVersion=2&SrcAuth=InCites&SrcApp=tsm_test&DestApp=WOS_CPL&DestLinkType=FullRecord&KeyUT=ISI:000562973000041,36.913824,17.226736068725586,15.919159,72.03,154.3531,167.0314,Domestic - Multiple,99.9899,7.125
WOS:000531373700012,10.1001/jama.2020.4031,MEDLINE:32167538,"Critical Care Utilization for the COVID-19 Outbreak in Lombardy, Italy Early Experience and Forecast During an Emergency Response","Grasselli, Giacomo; Pesenti, Antonio; Cecconi, Maurizio",JAMA-JOURNAL OF THE AMERICAN MEDICAL ASSOCIATION,1002 Clinical Medicine,Editorial Material,323,16,1545-1546,2020,2658,https://www.webofscience.com/api/gateway?GWVersion=2&SrcAuth=InCites&SrcApp=tsm_test&DestApp=WOS_CPL&DestLinkType=FullRecord&KeyUT=ISI:000531373700012,86.842679,7.287540435791016,8.73287,30.61,364.7321,304.3673,Domestic - Multiple,99.9928,56.274
WOS:000547825600015,10.1016/S0140-6736(20)31142-9,MEDLINE:32497510,"Physical distancing, face masks, and eye protection to prevent person-to-person transmission of SARS-CoV-2 and COVID-19: a systematic review and meta-analysis","Chu, Derek K.; Akl, Elie A.; Duda, Stephanie; Solo, Karla; Yaacoub, Sally; Schunemann, Holger J.",LANCET,1002 Clinical Medicine,Review,395,10242,1973-1987,2020,2651,https://www.webofscience.com/api/gateway?GWVersion=2&SrcAuth=InCites&SrcApp=tsm_test&DestApp=WOS_CPL&DestLinkType=FullRecord&KeyUT=ISI:000547825600015,665.563636,32.51534652709961,39.426018,3.98,81.5307,67.2399,International - Bilateral,99.9853,79.323
WOS:001023362600008,10.1097/JS9.0000000000000373,MEDLINE:37013953,The SCARE 2023 guideline: updating consensus Surgical CAse REport (SCARE) guidelines,"Sohrabi, Catrin; Mathew, Ginimol; Maria, Nicola; Kerwan, Ahmed; Franchi, Thomas; Agha, Riaz A.",INTERNATIONAL JOURNAL OF SURGERY,1002 Clinical Medicine,Article,109,5,1136-1140,2023,2609,https://www.webofscience.com/api/gateway?GWVersion=2&SrcAuth=InCites&SrcApp=tsm_test&DestApp=WOS_CPL&DestLinkType=FullRecord&KeyUT=ISI:001023362600008,19.032258,5.106153964996338,4.534348,137.08,510.9521,575.3859,Domestic - Multiple,99.9988,12.5

Filter Summary:
数据集: InCites Dataset + ESCI
学科分类体系:  China SCADC Subject 97 Narrow
合作者 ID 类型分组:  WoS Researcher Profile
国内/国际合作论文:  All
"分析时间段:  [2020, 2024]"
包括在线发表论文:  true
合作者 ID 类型:  All
基金数据来源:  All Sources

"导出日期  2025年9月16日. "
"InCites 数据集更新日期  2025-08-29. 包含 Web of Science 标引内容截止 2025-07-31. "

