DOI,来源,研究方向,论文标题,CR_摘要,CR_作者和机构,CR_参考文献DOI,OpenAlex_field_list,OpenAlex_subfield_list,OpenAlex_map_subjects
10.1007/s10462-023-10562-9,ARTIFICIAL INTELLIGENCE REVIEW,0812 Computer Science and Technology,A survey of uncertainty in deep neural networks,"AbstractOver the last decade, neural networks have reached almost every field of science and become a crucial part of various real world applications. Due to the increasing spread, confidence in neural network predictions has become more and more important. However, basic neural networks do not deliver certainty estimates or suffer from over- or under-confidence, i.e. are badly calibrated. To overcome this, many researchers have been working on understanding and quantifying uncertainty in a neural network’s prediction. As a result, different types and sources of uncertainty have been identified and various approaches to measure and quantify uncertainty in neural networks have been proposed. This work gives a comprehensive overview of uncertainty estimation in neural networks, reviews recent advances in the field, highlights current challenges, and identifies potential research opportunities. It is intended to give anyone interested in uncertainty estimation in neural networks a broad overview and introduction, without presupposing prior knowledge in this field. For that, a comprehensive introduction to the most crucial sources of uncertainty is given and their separation into reducible model uncertainty and irreducible data uncertainty is presented. The modeling of these uncertainties based on deterministic neural networks, Bayesian neural networks (BNNs), ensemble of neural networks, and test-time data augmentation approaches is introduced and different branches of these fields as well as the latest developments are discussed. For a practical application, we discuss different measures of uncertainty, approaches for calibrating neural networks, and give an overview of existing baselines and available implementations. Different examples from the wide spectrum of challenges in the fields of medical image analysis, robotics, and earth observation give an idea of the needs and challenges regarding uncertainties in the practical applications of neural networks. Additionally, the practical limitations of uncertainty quantification methods in neural networks for mission- and safety-critical real world applications are discussed and an outlook on the next steps towards a broader usage of such methods is given.","[{""name"": ""Jakob Gawlikowski"", ""affiliation"": []}, {""name"": ""Cedrique Rovile Njieutcheu Tassi"", ""affiliation"": []}, {""name"": ""Mohsin Ali"", ""affiliation"": []}, {""name"": ""Jongseok Lee"", ""affiliation"": []}, {""name"": ""Matthias Humt"", ""affiliation"": []}, {""name"": ""Jianxiang Feng"", ""affiliation"": []}, {""name"": ""Anna Kruspe"", ""affiliation"": []}, {""name"": ""Rudolph Triebel"", ""affiliation"": []}, {""name"": ""Peter Jung"", ""affiliation"": []}, {""name"": ""Ribana Roscher"", ""affiliation"": []}, {""name"": ""Muhammad Shahzad"", ""affiliation"": []}, {""name"": ""Wen Yang"", ""affiliation"": []}, {""name"": ""Richard Bamler"", ""affiliation"": []}, {""name"": ""Xiao Xiang Zhu"", ""affiliation"": []}]","[""10.1016/j.inffus.2021.05.008"", ""10.1109/ACCESS.2022.3163384"", ""10.1007/978-3-030-22796-8_28"", ""10.1109/MRA.2006.1678144"", ""10.1109/5.5968"", ""10.1038/s42256-018-0004-1"", ""10.1109/CVPR.2018.00976"", ""10.1109/ICRA.2016.7487170"", ""10.1109/ICRA48506.2021.9560806"", ""10.1145/1150402.1150464"", ""10.1016/j.knosys.2018.12.030"", ""10.1038/s42256-020-0217-y"", ""10.1016/j.patrec.2016.01.029"", ""10.1016/j.neucom.2019.05.082"", ""10.1109/ICCV.2019.00059"", ""10.1613/jair.295"", ""10.1109/CVPR.2000.854761"", ""10.1109/IROS.2016.7759279"", ""10.1109/LGRS.2018.2886534"", ""10.1145/1143844.1143874"", ""10.1111/j.2517-6161.1968.tb00722.x"", ""10.1109/MSP.2012.2211477"", ""10.1109/CVPR.2009.5206848"", ""10.1016/0370-2693(87)91197-X"", ""10.3150/18-BEJ1073"", ""10.1109/MRA.2006.1638022"", ""10.1145/3368555.3384457"", ""10.1007/978-3-030-00928-1_78"", ""10.1109/ICRA.2018.8461127"", ""10.1109/ITSC.2018.8569814"", ""10.1007/978-3-030-95459-8_40"", ""10.1023/A:1008937911390"", ""10.1109/CVPR.2018.00355"", ""10.1109/TGRS.2022.3140324"", ""10.1109/ICCVW.2019.00517"", ""10.1007/978-3-319-12385-1"", ""10.1561/2200000049"", ""10.1007/978-3-030-32226-7_75"", ""10.1007/978-3-030-77211-6_41"", ""10.1001/jamainternmed.2018.3763"", ""10.1007/s11269-010-9639-3"", ""10.1177/0278364915587924"", ""10.1016/j.neucom.2017.06.052"", ""10.1007/978-3-319-50115-4_40"", ""10.1109/CVPRW50498.2020.00167"", ""10.1109/34.58871"", ""10.1109/CVPR.2019.00013"", ""10.1007/978-3-030-59851-8_14"", ""10.1145/168304.168306"", ""10.1109/CVPR42600.2020.01096"", ""10.1007/978-3-030-32245-8_16"", ""10.1609/aaai.v33i01.33013870"", ""10.1007/s10994-021-05946-3"", ""10.1007/11550907_40"", ""10.1007/978-3-642-17452-0_10"", ""10.1109/ICRA.2018.8460655"", ""10.1109/ICPR48806.2021.9412324"", ""10.1007/978-3-030-01246-5_45"", ""10.1093/bioinformatics/btab346"", ""10.1073/pnas.1611835114"", ""10.3390/s19092064"", ""10.1007/978-3-662-44851-9_2"", ""10.2172/1605518"", ""10.1109/5.726791"", ""10.1109/ICIP40778.2020.9190679"", ""10.1137/15M102318X"", ""10.1016/j.jcp.2007.02.014"", ""10.3390/s22155540"", ""10.1109/CVPR42600.2020.00276"", ""10.1609/aaai.v30i1.10200"", ""10.1109/CVPR.2016.611"", ""10.1109/TNNLS.2020.3017292"", ""10.1080/01621459.2017.1409122"", ""10.1109/MLSP49062.2020.9231703"", ""10.1007/s12530-019-09324-2"", ""10.1109/MSP.2004.1267047"", ""10.1371/journal.pdig.0000085"", ""10.1109/LRA.2020.2974682"", ""10.1109/ICRA.2019.8793611"", ""10.1109/ACCESS.2017.2706363"", ""10.1162/neco.1992.4.4.590"", ""10.1162/neco.1992.4.3.448"", ""10.1007/978-3-319-68445-1_53"", ""10.1109/ACCESS.2021.3062867"", ""10.1109/TPAMI.2008.78"", ""10.1134/S1054661820020108"", ""10.3389/fninf.2019.00067"", ""10.1109/TMI.2020.3006437"", ""10.1038/s41598-021-84854-x"", ""10.1038/s41598-020-61808-3"", ""10.1109/ICCVW.2019.00098"", ""10.1109/LGRS.2019.2921011"", ""10.1007/978-981-13-8566-7_6"", ""10.1016/j.aci.2018.06.002"", ""10.1109/ICRA.2016.7487138"", ""10.1006/jcph.1994.1054"", ""10.1007/978-1-4612-0745-0"", ""10.1080/01621459.2020.1847120"", ""10.1007/978-3-540-68009-3"", ""10.1109/CVPR.2015.7298640"", ""10.1007/978-3-030-33778-0_7"", ""10.1007/s00477-021-02168-w"", ""10.1007/978-3-319-99978-4_9"", ""10.1109/ICPR48806.2021.9413010"", ""10.15607/RSS.2020.XVI.007"", ""10.1109/ICCV.2019.00971"", ""10.1109/ICCV.2019.00302"", ""10.1007/978-3-319-59650-1_19"", ""10.1007/978-3-030-62144-5_7"", ""10.18653/v1/2020.emnlp-main.450"", ""10.1038/s41586-019-0912-1"", ""10.1109/ISBI45749.2020.9098543"", ""10.1016/j.eswa.2019.06.025"", ""10.1109/IGARSS46834.2022.9884167"", ""10.15607/RSS.2017.XIII.064"", ""10.1023/A:1023562417138"", ""10.1007/978-3-319-24574-4_28"", ""10.1613/jair.2567"", ""10.1063/1.436415"", ""10.1016/j.neuroimage.2019.03.042"", ""10.1109/IGARSS39084.2020.9323890"", ""10.1162/089976601750265045"", ""10.1021/acs.jcim.9b00975"", ""10.1109/MGRS.2016.2561021"", ""10.1109/TMI.2019.2919951"", ""10.1109/CVPR.2019.00924"", ""10.1186/s40537-019-0197-0"", ""10.1021/acscentsci.1c00546"", ""10.1007/978-3-030-50146-4_41"", ""10.1109/ICRA.2011.5979644"", ""10.1177/0278364918770733"", ""10.1109/CVPR.2016.308"", ""10.1007/978-3-030-37548-5_10"", ""10.1109/LRA.2018.2852844"", ""10.1145/504729.504754"", ""10.1016/S0004-3702(01)00069-8"", ""10.2172/1525811"", ""10.1109/IJCNN.1989.118274"", ""10.1007/978-3-319-28872-7_26"", ""10.1109/ICASSP39728.2021.9414153"", ""10.1109/ICASSP.2019.8683359"", ""10.1007/978-3-030-01237-3_34"", ""10.1109/TKDE.2016.2606428"", ""10.1109/ICRA.2017.7989236"", ""10.1007/978-3-030-11726-9_6"", ""10.1016/j.neucom.2019.01.103"", ""10.1016/j.artmed.2017.02.005"", ""10.24963/ijcai.2021/631"", ""10.1007/978-3-030-86365-4_54"", ""10.1109/ACCESS.2020.3041525"", ""10.1109/CVPR42600.2020.00136"", ""10.24963/ijcai.2018/419"", ""10.1109/ICCV.2019.00961"", ""10.1007/978-1-4899-7687-1_79"", ""10.1016/j.neucom.2020.06.060"", ""10.1109/MGRS.2017.2762307""]","['Engineering', 'Computer Science']","['Artificial Intelligence', 'Control and Systems Engineering']","[[('0802 机械工程', 0.7567), ('0811 控制科学与工程', 0.7543), ('0814 土木工程', 0.7511), ('0808 电气工程', 0.7505), ('0807 动力工程及工程热物理', 0.7487)], [('0812 计算机科学与技术', 0.7697), ('0839 网络空间安全', 0.7566), ('0811 控制科学与工程', 0.7551), ('0835 软件工程', 0.7476), ('1405 智能科学与技术', 0.7393)], [('1405 智能科学与技术', 0.7329), ('0812 计算机科学与技术', 0.7301)], [('0811 控制科学与工程', 0.8034), ('0802 机械工程', 0.7722)]]"
10.1007/s00521-020-04832-8,NEURAL COMPUTING & APPLICATIONS,0812 Computer Science and Technology,Evolutionary algorithms and their applications to engineering problems,"AbstractThe main focus of this paper is on the family of evolutionary algorithms and their real-life applications. We present the following algorithms: genetic algorithms, genetic programming, differential evolution, evolution strategies, and evolutionary programming. Each technique is presented in the pseudo-code form, which can be used for its easy implementation in any programming language. We present the main properties of each algorithm described in this paper. We also show many state-of-the-art practical applications and modifications of the early evolutionary methods. The open research issues are indicated for the family of evolutionary algorithms.","[{""name"": ""Adam Slowik"", ""affiliation"": []}, {""name"": ""Halina Kwasnicka"", ""affiliation"": []}]","[""10.1023/A:1008202821328"", ""10.1109/TII.2017.2786782"", ""10.1007/978-3-540-76288-1"", ""10.1162/evco.1994.2.3.221"", ""10.1007/3-540-59496-5_312"", ""10.1007/978-1-4613-3437-8_17"", ""10.1109/ICEC.1996.542334"", ""10.1007/3-540-45356-3_83"", ""10.1109/5.949485"", ""10.1109/IECON.2004.1431758"", ""10.1016/S1570-7946(06)80327-5"", ""10.1007/11730095_10"", ""10.1109/TEVC.2013.2281535"", ""10.1016/j.asoc.2017.04.042"", ""10.1016/j.eswa.2017.11.004"", ""10.1007/3-540-45356-3_21"", ""10.1007/s00521-011-0734-z"", ""10.1007/978-3-642-32937-1_3"", ""10.1016/j.ins.2014.10.053"", ""10.1145/2739480.2754697"", ""10.1016/j.asoc.2017.06.050"", ""10.1016/j.swevo.2018.03.015"", ""10.1109/TEVC.2006.872133"", ""10.1109/TEVC.2009.2014613"", ""10.1016/j.asoc.2010.04.024"", ""10.1109/TEVC.2010.2087271"", ""10.1145/2001576.2001724"", ""10.1155/2013/969734"", ""10.1109/CEC.2014.6900318"", ""10.1109/SDE.2014.7031537"", ""10.1016/j.asoc.2015.11.033"", ""10.1016/j.asoc.2015.10.022"", ""10.1109/CEC.2017.7969446"", ""10.1016/j.swevo.2018.10.001"", ""10.21629/JSEE.2016.04.20"", ""10.1109/TIE.2010.2062474"", ""10.1016/j.swevo.2016.01.004"", ""10.1162/106365601750190398"", ""10.1145/2576768.2598294"", ""10.1007/s00500-012-0946-x"", ""10.1162/evco.1994.2.4.369"", ""10.1007/3-540-58484-6_263"", ""10.1016/j.tcs.2006.04.003"", ""10.1007/978-3-540-74695-9_41"", ""10.1109/CEC.2008.4631255"", ""10.1145/1830483.1830557"", ""10.1162/evco_a_00182"", ""10.1109/TEVC.2017.2680320"", ""10.1016/j.tcs.2018.05.015"", ""10.1109/4235.771163"", ""10.1016/S0010-4655(02)00386-7"", ""10.1016/j.asoc.2012.02.002"", ""10.1016/j.swevo.2012.11.002"", ""10.3182/20140824-6-ZA-1003.00384"", ""10.1007/s12665-015-4372-0"", ""10.1109/CEC.2016.7744143"", ""10.1080/15325008.2017.1376234"", ""10.1109/IEA.2017.7939199"", ""10.1016/j.asoc.2017.10.002"", ""10.1002/9781119136378.ch3"", ""10.1016/j.enconman.2016.12.080"", ""10.1016/j.egypro.2017.03.1047"", ""10.1109/TIE.2016.2522382"", ""10.1016/j.asoc.2016.09.040"", ""10.1016/j.jmsy.2016.10.004"", ""10.1016/j.ejor.2017.10.050"", ""10.1016/j.tre.2017.07.001"", ""10.1016/j.enbuild.2015.11.033"", ""10.1109/ICOS.2016.7881994"", ""10.1016/j.asoc.2016.10.022"", ""10.1016/j.renene.2016.10.022"", ""10.1109/TCYB.2016.2633318"", ""10.1111/jfr3.12232"", ""10.1109/TEC.2017.2693275"", ""10.1155/2018/1253108"", ""10.1016/j.renene.2018.01.058"", ""10.1016/j.enconman.2017.01.071"", ""10.1109/TII.2017.2743761"", ""10.1109/LAWP.2018.2812816"", ""10.1109/TITS.2015.2505323"", ""10.1016/j.jcsr.2016.09.002"", ""10.1007/978-3-319-55849-3_22"", ""10.1061/(ASCE)WR.1943-5452.0000774"", ""10.1109/ACCESS.2018.2808605"", ""10.1109/LGRS.2017.2665560"", ""10.1007/s11063-016-9498-x"", ""10.1109/ICEIEC.2017.8076629"", ""10.1016/j.cag.2012.08.006"", ""10.1145/2390009.2399411"", ""10.1371/journal.pcbi.1004295"", ""10.1145/2480741.2480752"", ""10.3390/e20100781"", ""10.1007/s00521-016-2619-7"", ""10.3390/e20100756"", ""10.1007/s00521-015-1976-y"", ""10.3390/e16126263"", ""10.1007/s00521-018-3822-5"", ""10.1038/nature14544""]",['Computer Science'],"['Computational Theory and Mathematics', 'Artificial Intelligence']","[[('0812 计算机科学与技术', 0.7697), ('0839 网络空间安全', 0.7566), ('0811 控制科学与工程', 0.7551), ('0835 软件工程', 0.7476), ('1405 智能科学与技术', 0.7393)], [('0812 计算机科学与技术', 0.7469), ('0811 控制科学与工程', 0.7285)], [('1405 智能科学与技术', 0.7329), ('0812 计算机科学与技术', 0.7301)]]"
10.1093/bioinformatics/btaa1022,BIOINFORMATICS,0836 Biotechnology and Bioengineering; 0714 Statistics; 0710 Biology; 0812 Computer Science and Technology,CAFE 5 models variation in evolutionary rates among gene families,"Abstract Motivation Genome sequencing projects have revealed frequent gains and losses of genes between species. Previous versions of our software, Computational Analysis of gene Family Evolution (CAFE), have allowed researchers to estimate parameters of gene gain and loss across a phylogenetic tree. However, the underlying model assumed that all gene families had the same rate of evolution, despite evidence suggesting a large amount of variation in rates among families. Results Here, we present CAFE 5, a completely re-written software package with numerous performance and user-interface enhancements over previous versions. These include improved support for multithreading, the explicit modeling of rate variation among families using gamma-distributed rate categories, and command-line arguments that preclude the use of accessory scripts. Availability and implementation CAFE 5 source code, documentation, test data and a detailed manual with examples are freely available at https://github.com/hahnlab/CAFE5/releases. Supplementary information Supplementary data are available at Bioinformatics online.","[{""name"": ""Fábio K Mendes"", ""affiliation"": [""Department of Biology, Indiana University , Bloomington, IN 47405, USA"", ""Department of Computer Science, The University of Auckland , 1010 Auckland, New Zealand""]}, {""name"": ""Dan Vanderpool"", ""affiliation"": [""Department of Biology, Indiana University , Bloomington, IN 47405, USA""]}, {""name"": ""Ben Fulton"", ""affiliation"": [""Department of Biology, Indiana University , Bloomington, IN 47405, USA"", ""Department of Computer Science, University Information Technology Services, Indiana University , Bloomington, IN 47405, USA""]}, {""name"": ""Matthew W Hahn"", ""affiliation"": [""Department of Biology, Indiana University , Bloomington, IN 47405, USA"", ""Department of Computer Science, Indiana University , Bloomington, IN 47405, USA""]}]","[""10.1093/bioinformatics/btr592"", ""10.1002/ajb2.1211"", ""10.1093/bioinformatics/btl097"", ""10.1371/journal.pone.0000085"", ""10.1126/science.1139247"", ""10.1093/genetics/113.4.1077"", ""10.1101/gr.3567505"", ""10.1371/journal.pgen.0030197"", ""10.1093/molbev/mst100"", ""10.1093/bioinformatics/btr623"", ""10.1093/gigascience/giz003"", ""10.1093/oxfordjournals.molbev.a026369"", ""10.1126/science.287.5461.2204"", ""10.1186/s13059-019-1925-7"", ""10.1093/nar/gks1116"", ""10.1038/nature01262"", ""10.1007/BF00160154"", ""10.1016/0169-5347(96)10041-0""]","['Biochemistry, Genetics and Molecular Biology', 'Agricultural and Biological Sciences']","['Genetics', 'Plant Science', 'Molecular Biology']","[[('0710 生物学', 0.7285), ('0811 控制科学与工程', 0.7264), ('0836 生物工程', 0.7242), ('1001 基础医学', 0.717), ('0832 食品科学与工程', 0.7157)], [('0909 草学', 0.735), ('0905 畜牧学', 0.7348), ('0903 农业资源与环境', 0.7344), ('0828 农业工程', 0.7328), ('0832 食品科学与工程', 0.7301)], [('0710 生物学', 0.733), ('0905 畜牧学', 0.7315)], [('0903 农业资源与环境', 0.7532), ('0902 园艺学', 0.7513)], [('0710 生物学', 0.7379), ('1001 基础医学', 0.7336)]]"
10.1007/s00158-021-02881-8,STRUCTURAL AND MULTIDISCIPLINARY OPTIMIZATION,0801 Mechanics; 0812 Computer Science and Technology,Topology optimization of multi-scale structures: a review,"AbstractMulti-scale structures, as found in nature (e.g., bone and bamboo), hold the promise of achieving superior performance while being intrinsically lightweight, robust, and multi-functional. Recent years have seen a rapid development in topology optimization approaches for designing multi-scale structures, but the field actually dates back to the seminal paper by Bendsøe and Kikuchi from 1988 (Computer Methods in Applied Mechanics and Engineering 71(2): pp. 197–224). In this review, we intend to categorize existing approaches, explain the principles of each category, analyze their strengths and applicabilities, and discuss open research questions. The review and associated analyses will hopefully form a basis for future research and development in this exciting field.","[{""name"": ""Jun Wu"", ""affiliation"": []}, {""name"": ""Ole Sigmund"", ""affiliation"": []}, {""name"": ""Jeroen P. Groen"", ""affiliation"": []}]","[""10.1007/s00158-014-1157-0"", ""10.1016/j.cma.2015.02.028"", ""10.1007/978-1-4684-9286-6"", ""10.1007/BF01195933"", ""10.1080/12506559.1996.10511241"", ""10.1007/s002110050253"", ""10.1016/j.jcp.2003.09.032"", ""10.1016/j.camwa.2018.08.007"", ""10.1007/s00158-010-0514-x"", ""10.1007/s00158-013-1015-5"", ""10.1016/j.matdes.2020.109356"", ""10.1007/s00158-010-0597-4"", ""10.1016/j.commatsci.2013.09.006"", ""10.1007/s00158-010-0594-7"", ""10.1016/j.mechmat.2013.09.018"", ""10.1137/0147082"", ""10.3934/nhm.2014.9.433"", ""10.1016/j.cma.2017.01.009"", ""10.1016/j.engstruct.2013.10.032"", ""10.1007/978-3-662-05086-6"", ""10.1007/BF01650949"", ""10.1016/0045-7825(88)90086-2"", ""10.1007/s004190050248"", ""10.1115/1.2901581"", ""10.1016/j.jmps.2019.103851"", ""10.1007/s10853-012-6643-4"", ""10.1016/j.cad.2018.12.008"", ""10.1007/s00158-018-2066-4"", ""10.1016/j.ijsolstr.2012.07.019"", ""10.1016/0020-7683(81)90089-5"", ""10.1016/0020-7683(81)90065-2"", ""10.1007/bf01270442"", ""10.1515/nanoph-2019-0057"", ""10.1016/j.cma.2015.02.011"", ""10.1002/adma.201502485"", ""10.1016/J.ENG.2016.02.006"", ""10.1016/j.advengsoft.2010.10.003"", ""10.1007/s00158-007-0141-3"", ""10.1007/s00158-018-2045-9"", ""10.1007/s00158-015-1344-7"", ""10.1016/j.matdes.2020.108775"", ""10.1007/s00158-013-0956-z"", ""10.1007/s00158-017-1689-1"", ""10.1007/bf01198376"", ""10.1081/sme-100100619"", ""10.1016/0045-7825(94)00777-K"", ""10.1115/1.4040555"", ""10.1007/s00158-020-02539-x"", ""10.1115/1.4041176"", ""10.1145/2766984"", ""10.1007/s00158-020-02629-w"", ""10.2514/5.9781600866234.0123.0150"", ""10.1007/BF00280908"", ""10.1016/j.pmatsci.2007.06.001"", ""10.1002/nme.105"", ""10.1145/3072959.3073676"", ""10.1016/j.addma.2018.12.007"", ""10.1016/j.jcp.2019.108994"", ""10.1088/1361-651X/ab7150"", ""10.1002/nme.5575"", ""10.1016/j.cma.2019.02.031"", ""10.1016/j.cma.2020.112979"", ""10.1016/0045-7825(90)90148-F"", ""10.1007/s00158-003-0305-8"", ""10.1007/s00158-008-0250-7"", ""10.1002/nme.1064"", ""10.1115/1.4027609"", ""10.1016/j.cma.2014.10.014"", ""10.1016/s0020-7683(96)00023-6"", ""10.1016/0022-5096(63)90060-7"", ""10.1016/j.cad.2020.102854"", ""10.1007/s00158-007-0196-1"", ""10.1016/j.commatsci.2012.09.018"", ""10.1007/s00158-019-02220-y"", ""10.1145/2816795.2818078"", ""10.1007/s00158-013-1001-y"", ""10.1002/lpor.201000014"", ""10.1016/0045-7825(95)00928-0"", ""10.1002/cpa.3160390107"", ""10.1016/s0045-7949(98)00326-5"", ""10.1007/s00158-019-02422-4"", ""10.1038/361511a0"", ""10.1007/s00158-018-1948-9"", ""10.1016/j.cma.2017.02.018"", ""10.1145/566654.566590"", ""10.1016/j.cad.2018.06.003"", ""10.1016/j.cma.2017.09.008"", ""10.1016/j.cma.2020.113354"", ""10.1007/bf02193100"", ""10.1007/s00158-018-1994-3"", ""10.1016/j.compstruc.2007.04.030"", ""10.1016/j.addma.2020.101427"", ""10.1016/j.cma.2018.04.034"", ""10.1002/nme.6031"", ""10.1007/BF00934300"", ""10.1080/14786440409463229"", ""10.2140/memocs.2017.5.95"", ""10.1007/978-1-4613-8646-9_"", ""10.1017/cbo9780511613357"", ""10.1115/1.4035525"", ""10.1007/BF01744697"", ""10.1002/nme.449"", ""10.1016/0020-7683(83)90005-7"", ""10.1007/s00158-008-0334-4"", ""10.1002/nme.1044"", ""10.1016/0167-6636(85)90002-x"", ""10.1007/bf01213995"", ""10.1146/annurev-matsci-070115-031826"", ""10.1016/j.addma.2017.11.008"", ""10.1137/070688900"", ""10.1109/MMAR.2010.5587222"", ""10.1007/BF01637666"", ""10.1016/j.cma.2019.07.021"", ""10.1016/j.matdes.2019.108164"", ""10.1016/j.jmps.2019.03.018"", ""10.1016/b978-0-12-083750-2.50023-0"", ""10.1080/0305215X.2012.737781"", ""10.1007/s10853-012-6905-1"", ""10.1007/s00158-002-0209-z"", ""10.2514/3.50631"", ""10.1007/s00158-019-02275-x"", ""10.1137/110850335"", ""10.1016/0020-7683(94)90154-6"", ""10.1016/S0022-5096(99)00034-4"", ""10.1007/s001580050176"", ""10.1007/s00158-011-0638-7"", ""10.1098/rsta.2003.1177"", ""10.1007/s00158-013-0978-6"", ""10.1063/1.117961"", ""10.1007/s00158-016-1420-7"", ""10.1007/s00158-016-1519-x"", ""10.1007/bf01743510"", ""10.1002/nme.1259"", ""10.1007/s00158-010-0563-1"", ""10.1007/s00158-020-02681-6"", ""10.1016/j.matdes.2020.109155"", ""10.1016/j.cirp.2016.05.004"", ""10.1016/j.cma.2018.04.031"", ""10.1103/PhysRevLett.89.266601"", ""10.1007/s00158-018-2180-3"", ""10.1007/s00158-018-2009-0"", ""10.1007/s00158-019-02408-2"", ""10.1007/s00158-020-02525-3"", ""10.1007/s00158-010-0602-y"", ""10.1016/S0045-7825(02)00559-5"", ""10.1016/j.biomaterials.2016.01.012"", ""10.1016/j.cma.2016.12.007"", ""10.1016/j.eml.2019.03.004"", ""10.1007/s00158-019-02297-5"", ""10.1016/j.cma.2018.09.007"", ""10.1016/j.cad.2018.04.008"", ""10.1109/TVCG.2015.2502588"", ""10.1016/j.cad.2016.07.006"", ""10.1016/j.cma.2017.08.018"", ""10.1109/TVCG.2017.2655523"", ""10.1109/TVCG.2019.2938946"", ""10.1007/s00158-020-02791-1"", ""10.1016/j.cma.2018.11.003"", ""10.1016/j.cma.2014.05.022"", ""10.1007/s00158-015-1294-0"", ""10.1016/0045-7949(93)90035-C"", ""10.1007/s00158-009-0452-7"", ""10.1016/j.cma.2020.113037"", ""10.1016/j.ijheatmasstransfer.2018.01.114"", ""10.1007/BF01743977"", ""10.1080/17452759.2019.1647488"", ""10.1007/BF01742592"", ""10.1002/nme.1743"", ""10.1016/j.scriptamat.2016.10.021"", ""10.1016/j.commatsci.2018.08.030"", ""10.1038/nmat4694"", ""10.1016/0045-7825(91)90046-9"", ""10.1007/s10853-008-2722-y"", ""10.1007/s00158-019-02293-9"", ""10.1145/3095815"", ""10.1007/s11831-015-9151-2"", ""10.1016/j.jmps.2018.11.008"", ""10.1007/s00158-016-1513-3""]",['Engineering'],"['Mechanics of Materials', 'Civil and Structural Engineering']","[[('0802 机械工程', 0.7567), ('0811 控制科学与工程', 0.7543), ('0814 土木工程', 0.7511), ('0808 电气工程', 0.7505), ('0807 动力工程及工程热物理', 0.7487)], [('0805 材料科学与工程', 0.7401), ('0801 力学', 0.7332)], [('0814 土木工程', 0.7642), ('0819 矿业工程', 0.7364)]]"
