DOI,来源,研究方向,论文标题,CR_摘要,CR_作者和机构,CR_参考文献DOI,OpenAlex_field_list,OpenAlex_subfield_list,OpenAlex_map_subjects
10.3390/diagnostics10080565,DIAGNOSTICS,0812 Computer Science and Technology,Multimodal Brain Tumor Classification Using Deep Learning and Robust Feature Selection: A Machine Learning Application for Radiologists,"Manual identification of brain tumors is an error-prone and tedious process for radiologists; therefore, it is crucial to adopt an automated system. The binary classification process, such as malignant or benign is relatively trivial; whereas, the multimodal brain tumors classification (T1, T2, T1CE, and Flair) is a challenging task for radiologists. Here, we present an automated multimodal classification method using deep learning for brain tumor type classification. The proposed method consists of five core steps. In the first step, the linear contrast stretching is employed using edge-based histogram equalization and discrete cosine transform (DCT). In the second step, deep learning feature extraction is performed. By utilizing transfer learning, two pre-trained convolutional neural network (CNN) models, namely VGG16 and VGG19, were used for feature extraction. In the third step, a correntropy-based joint learning approach was implemented along with the extreme learning machine (ELM) for the selection of best features. In the fourth step, the partial least square (PLS)-based robust covariant features were fused in one matrix. The combined matrix was fed to ELM for final classification. The proposed method was validated on the BraTS datasets and an accuracy of 97.8%, 96.9%, 92.5% for BraTs2015, BraTs2017, and BraTs2018, respectively, was achieved.","[{""name"": ""Muhammad Attique Khan"", ""affiliation"": [""Department of Computer Science, HITEC University, Museum Road, Taxila 47080, Pakistan""]}, {""name"": ""Imran Ashraf"", ""affiliation"": [""Department of Computer Engineering, HITEC University, Museum Road, Taxila 47080, Pakistan""]}, {""name"": ""Majed Alhaisoni"", ""affiliation"": [""College of Computer Science and Engineering, University of Ha’il, Ha’il 81451, Saudi Arabia""]}, {""name"": ""Robertas Damaševičius"", ""affiliation"": [""Faculty of Applied Mathematics, Silesian University of Technology, 44-100 Gliwice, Poland"", ""Department of Applied Informatics, Vytautas Magnus University, 44404 Kaunas, Lithuania""]}, {""name"": ""Rafal Scherer"", ""affiliation"": [""Department of Intelligent Computer Systems, Czestochowa University of Technology, 42-200 Czestochowa, Poland""]}, {""name"": ""Amjad Rehman"", ""affiliation"": [""College of Computer and Information Sciences, Prince Sultan University, Riyadh 11586, Saudi Arabia""]}, {""name"": ""Syed Ahmad Chan Bukhari"", ""affiliation"": [""Division of Computer Science, Mathematics and Science, Collins College of Professional Studies, St. John’s University, New York, NY 11439, USA""]}]","[""10.1016/j.compbiomed.2019.103345"", ""10.1016/j.mehy.2019.109413"", ""10.1109/TMI.2016.2538465"", ""10.1016/j.patrec.2019.11.020"", ""10.1007/978-3-030-01234-2_49"", ""10.1109/3DV.2016.79"", ""10.3390/su12125037"", ""10.1016/j.patrec.2019.12.024"", ""10.1002/jemt.23447"", ""10.1109/ACCESS.2020.3002725"", ""10.1007/978-3-319-75238-9_25"", ""10.1016/j.compmedimag.2019.05.001"", ""10.1109/ACCESS.2019.2904145"", ""10.1038/s41598-020-63242-x"", ""10.1016/j.bspc.2019.101678"", ""10.1007/978-3-030-11726-9_28"", ""10.1007/978-3-030-11726-9_44"", ""10.1016/j.patrec.2019.11.016"", ""10.1016/j.jocs.2018.12.003"", ""10.1016/j.patrec.2019.11.019"", ""10.13005/bpj/1511"", ""10.1007/978-3-030-25797-2_8"", ""10.1002/cpe.4962"", ""10.1007/s00521-019-04679-8"", ""10.1016/j.artmed.2019.101779"", ""10.1007/s12652-018-1075-x"", ""10.1002/jemt.23238"", ""10.1109/ACCESS.2019.2893496"", ""10.1007/s00034-019-01246-3"", ""10.1109/ICACCP.2019.8882973"", ""10.1016/j.eswa.2020.113274"", ""10.1109/TNNLS.2020.2995800"", ""10.1002/jemt.23429"", ""10.1016/j.patrec.2019.11.034"", ""10.1007/978-3-319-59063-9_44"", ""10.1016/j.patrec.2019.11.014"", ""10.3390/app10020559"", ""10.1016/j.eswa.2019.01.060"", ""10.1186/s40537-016-0043-6""]","['Computer Science', 'Neuroscience']","['Computer Vision and Pattern Recognition', 'Neurology', 'Artificial Intelligence']","[[('0812 计算机科学与技术', 0.7697), ('0839 网络空间安全', 0.7566), ('0811 控制科学与工程', 0.7551), ('0835 软件工程', 0.7476), ('1405 智能科学与技术', 0.7393)], [('0710 生物学', 0.7369), ('0402 心理学', 0.7327), ('1405 智能科学与技术', 0.7293), ('0811 控制科学与工程', 0.7277), ('1002 临床医学', 0.7245)], [('0811 控制科学与工程', 0.7558), ('0812 计算机科学与技术', 0.7479)], [('1002 临床医学', 0.7465), ('1001 基础医学', 0.7432)], [('1405 智能科学与技术', 0.7329), ('0812 计算机科学与技术', 0.7301)]]"
10.1186/s40537-020-00318-5,JOURNAL OF BIG DATA,0812 Computer Science and Technology,Cybersecurity data science: an overview from machine learning perspective,"AbstractIn a computing context, cybersecurity is undergoing massive shifts in technology and its operations in recent days, and data science is driving the change. Extractingsecurity incident patternsor insights from cybersecurity data and building correspondingdata-driven model, is the key to make a security system automated and intelligent. To understand and analyze the actual phenomena with data, various scientific methods, machine learning techniques, processes, and systems are used, which is commonly known as data science. In this paper, we focus and briefly discuss oncybersecurity data science, where the data is being gathered from relevant cybersecurity sources, and the analytics complement thelatest data-driven patternsfor providing more effective security solutions. The concept of cybersecurity data science allows making the computing process more actionable and intelligent as compared to traditional ones in the domain of cybersecurity. We then discuss and summarize a number of associatedresearch issues and future directions. Furthermore, we provide amachine learningbasedmulti-layered frameworkfor the purpose of cybersecurity modeling. Overall, our goal is not only to discuss cybersecurity data science and relevant methods but also to focus the applicability towards data-driven intelligent decision making for protecting the systems from cyber-attacks.","[{""name"": ""Iqbal H. Sarker"", ""affiliation"": []}, {""name"": ""A. S. M. Kayes"", ""affiliation"": []}, {""name"": ""Shahriar Badsha"", ""affiliation"": []}, {""name"": ""Hamed Alqahtani"", ""affiliation"": []}, {""name"": ""Paul Watters"", ""affiliation"": []}, {""name"": ""Alex Ng"", ""affiliation"": []}]","[""10.1007/s10796-014-9492-7"", ""10.1109/COMST.2018.2885561"", ""10.1007/978-3-030-36802-9_20"", ""10.1007/s00521-016-2275-y"", ""10.1007/978-3-030-20257-6_41"", ""10.1038/547030a"", ""10.1007/978-3-642-33299-9_1"", ""10.3390/a10020039"", ""10.1109/TDSC.2013.39"", ""10.1109/TSMCC.2010.2048428"", ""10.5121/csit.2018.80401"", ""10.1016/j.jcss.2014.02.005"", ""10.1201/9781420031225.ch6"", ""10.1145/2382196.2382284"", ""10.1007/978-3-642-18178-8_30"", ""10.2298/CSIS0602083J"", ""10.1057/ejis.2009.12"", ""10.1007/978-3-540-45126-6_11"", ""10.1109/ARES.2013.32"", ""10.1007/978-3-540-24852-1_21"", ""10.1016/S1361-3723(18)30086-1"", ""10.1016/S1361-3723(19)30060-0"", ""10.1186/s42400-019-0038-7"", ""10.1016/B978-1-59749-996-5.00006-6"", ""10.1007/978-3-319-19578-0_31"", ""10.1007/s11036-019-01353-0"", ""10.1016/j.jnca.2012.09.004"", ""10.1109/ISCIT.2012.6380910"", ""10.1109/TC.2016.2560839"", ""10.1109/ACCESS.2018.2836950"", ""10.1007/978-981-10-7901-6_95"", ""10.1145/3015456"", ""10.1186/s40537-019-0280-6"", ""10.1109/DISCEX.2000.821506"", ""10.1109/CISDA.2009.5356528"", ""10.1016/j.cose.2011.12.012"", ""10.1109/MilCIS.2015.7348942"", ""10.1016/j.inffus.2018.10.013"", ""10.1007/978-3-319-11698-3_44"", ""10.1109/SPW.2013.37"", ""10.1016/j.dib.2020.105400"", ""10.1109/SP.2012.16"", ""10.1145/3194452.3194465"", ""10.1016/j.future.2019.05.041"", ""10.1007/978-3-030-04224-0_19"", ""10.1201/b10867"", ""10.1109/CSNT.2015.185"", ""10.1109/SKIMA.2014.7083539"", ""10.1007/978-3-642-18333-1_12"", ""10.1016/j.eswa.2011.07.032"", ""10.1109/ICoAC.2014.7229711"", ""10.1109/FSKD.2014.6980972"", ""10.1109/ICCSP.2014.6949927"", ""10.1002/sec.1307"", ""10.1016/j.knosys.2015.01.009"", ""10.1016/j.eswa.2012.07.009"", ""10.1007/s11227-015-1604-8"", ""10.1007/978-3-319-63645-0_23"", ""10.1007/s10586-017-0971-8"", ""10.1109/ICNTE.2015.7029925"", ""10.3390/sym12050754"", ""10.1007/978-981-10-2738-3_37"", ""10.1109/TSMCC.2008.923876"", ""10.1016/j.asoc.2008.06.001"", ""10.1109/TDSC.2014.2312327"", ""10.1109/CTC.2010.8"", ""10.1145/2988287.2989177"", ""10.1016/j.cose.2010.12.004"", ""10.1007/11856214_8"", ""10.1016/j.dss.2006.04.004"", ""10.1007/s00521-015-1964-2"", ""10.1109/ICMLA.2016.0040"", ""10.1109/ACCESS.2017.2762418"", ""10.1109/PlatCon.2016.7456805"", ""10.1016/j.simpat.2019.102031"", ""10.1007/978-3-319-50127-7_11"", ""10.1016/j.jnca.2019.102479"", ""10.1007/978-3-030-03493-1_55"", ""10.1016/j.eswa.2019.112963"", ""10.1186/s40537-018-0162-3"", ""10.1023/A:1022631118932"", ""10.1007/s11036-019-01443-z"", ""10.1162/089976601300014493"", ""10.1108/13685201211266015"", ""10.1023/A:1010933404324"", ""10.1186/s40537-019-0258-4"", ""10.1007/978-0-387-09823-4_14"", ""10.1099/00221287-17-1-184"", ""10.1093/comjnl/bxx082"", ""10.1016/j.eswa.2013.08.066"", ""10.1145/170036.170072"", ""10.1023/A:1007656703224"", ""10.1145/335191.335372"", ""10.1007/978-3-319-93034-3_36"", ""10.1145/502585.502665"", ""10.1109/69.846291"", ""10.1016/j.apenergy.2017.01.003"", ""10.1109/ISNCC.2017.8072036"", ""10.1016/j.knosys.2018.08.036"", ""10.3390/info10040122"", ""10.1613/jair.301"", ""10.1016/j.iot.2019.01.007"", ""10.1093/comjnl/bxv034"", ""10.1109/AINA.2018.00093"", ""10.1186/s42400-018-0020-9"", ""10.1007/s10115-017-1027-3"", ""10.3390/sym12040499"", ""10.1109/IPDPSW.2012.146"", ""10.1186/s40537-019-0211-6"", ""10.1016/j.jss.2019.01.051"", ""10.1109/NOMS.2014.6838304"", ""10.13052/jcsm2245-1439.414"", ""10.1007/978-90-481-3662-9_86"", ""10.1109/MSP.2013.132"", ""10.1016/S1353-4858(15)70007-3"", ""10.1109/ACCESS.2018.2890507"", ""10.1016/j.ijinfomgt.2014.10.007"", ""10.1186/s40537-019-0206-3"", ""10.1186/s40537-015-0030-3""]",['Computer Science'],"['Signal Processing', 'Computer Networks and Communications', 'Information Systems']","[[('0812 计算机科学与技术', 0.7697), ('0839 网络空间安全', 0.7566), ('0811 控制科学与工程', 0.7551), ('0835 软件工程', 0.7476), ('1405 智能科学与技术', 0.7393)], [('0810 信息与通信工程', 0.7598), ('0811 控制科学与工程', 0.7575)], [('0812 计算机科学与技术', 0.7362), ('0839 网络空间安全', 0.7268)], [('0839 网络空间安全', 0.7454), ('0812 计算机科学与技术', 0.7417)]]"
10.1017/S1351324920000601,NATURAL LANGUAGE ENGINEERING,0812 Computer Science and Technology,GPT-3: What's it good for?,"AbstractGPT-3 made the mainstream media headlines this year, generating far more interest than we’d normally expect of a technical advance in NLP. People are fascinated by its ability to produce apparently novel text that reads as if it was written by a human. But what kind of practical applications can we expect to see, and can they be trusted?","[{""name"": ""Robert Dale"", ""affiliation"": []}]",[],['Computer Science'],['Artificial Intelligence'],"[[('0812 计算机科学与技术', 0.7697), ('0839 网络空间安全', 0.7566), ('0811 控制科学与工程', 0.7551), ('0835 软件工程', 0.7476), ('1405 智能科学与技术', 0.7393)], [('1405 智能科学与技术', 0.7329), ('0812 计算机科学与技术', 0.7301)]]"
10.1108/INTR-04-2018-0177,INTERNET RESEARCH,1202 Business Administration; 0810 Information and Communication Engineering; 0812 Computer Science and Technology,Factors influencing people's continuous watching intention and consumption intention in live streaming Evidence from China,"Purpose The purpose of this paper is to investigate what factors can affect people’s continuous watching and consumption intentions in live streaming. Design/methodology/approach This research conducted a mixed-methods study. The semi-structured interview was deployed to develop a research model and a live streaming typology. A survey was then used for quantitative assessment of the research model. Survey data were analyzed using partial least squares-structural equation modeling. Findings The results suggest that sex and humor appeals, social status display and interactivity play considerable roles in the viewer’s behavioral intentions in live streaming and their effects vary across different live streaming types. Research limitations/implications This research is conducted in the Chinese context. Future research can test the research model in other cultural contexts. This study can also be extended by incorporating the roles of viewer gender and price sensitivity in the future. Practical implications This study provides managerial insights into how live streaming platforms and streamers can improve their popularity and profitability. Originality/value The paper introduces a novel form of social media and a new business model. It illustrates what will affect people’s behavioral intentions in such a new context.","[{""name"": ""Fangfang Hou"", ""affiliation"": []}, {""name"": ""Zhengzhi Guan"", ""affiliation"": []}, {""name"": ""Boying Li"", ""affiliation"": []}, {""name"": ""Alain Yee Loong Chong"", ""affiliation"": []}]","[""10.1177/002224377701400320"", ""10.1108/IMDS-07-2015-0296"", ""10.1509/jmr.13.0503"", ""10.1371/journal.pone.0063975"", ""10.1016/j.chb.2011.08.023"", ""10.1177/135910457000100301"", ""10.1177/002224298404800110"", ""10.1108/IntR-11-2013-0236"", ""10.1080/02650487.2014.997423"", ""10.25300/MISQ/2014/38.2.04"", ""10.2307/23042797"", ""10.1016/j.omega.2004.01.006"", ""10.1007/BF00411411"", ""10.1108/IMDS-04-2016-0130"", ""10.2753/MTP1069-6679190202"", ""10.1108/10662241211235644"", ""10.1108/IntR-04-2016-0091"", ""10.1287/isre.1110.0411"", ""10.2307/20650307"", ""10.1016/j.chb.2009.03.003"", ""10.1016/j.intmar.2013.12.003"", ""10.1509/jm.15.0415"", ""10.1016/0148-2963(83)90026-7"", ""10.1108/IntR-03-2016-0078"", ""10.2501/JAR-43-2-207-216"", ""10.2753/MIS0742-1222260107"", ""10.1111/jcc4.12030"", ""10.2307/2786391"", ""10.1086/314307"", ""10.1002/cb.155"", ""10.1108/03090560210422871"", ""10.25300/MISQ/2014/38.1.10"", ""10.1111/j.1470-6431.2010.00930.x"", ""10.1080/00913367.2001.10673628"", ""10.1016/j.chb.2016.10.019"", ""10.1086/208971"", ""10.1080/08961530.2011.602951"", ""10.1108/EJM-07-2012-0393"", ""10.1177/002224297303700403"", ""10.1111/j.1460-2466.1992.tb00812.x"", ""10.1177/1468794104044430"", ""10.1016/S1071-5819(03)00008-9"", ""10.1080/09652540802117124"", ""10.17705/1jais.00433"", ""10.2307/41410412"", ""10.1108/IntR-04-2013-0082"", ""10.1108/QMR-06-2013-0041"", ""10.1177/002224298805200302"", ""10.1002/(SICI)1520-6793(199609)13:6<531::AID-MAR1>3.0.CO;2-9"", ""10.1016/j.chb.2014.10.050""]","['Decision Sciences', 'Social Sciences']","['Information Systems and Management', 'Sociology and Political Science']","[[('1201 管理科学与工程', 0.7645), ('0811 控制科学与工程', 0.7569), ('0714 统计学', 0.7511), ('0711 系统科学', 0.7506), ('0812 计算机科学与技术', 0.7461)], [('0303 社会学', 0.7395), ('0714 统计学', 0.7394), ('0503 新闻传播学', 0.7379), ('0602 中国史', 0.7298), ('0304 民族学', 0.7297)], [('1201 管理科学与工程', 0.7741), ('1205 信息资源管理', 0.7676)], [('0302 政治学', 0.7685), ('0303 社会学', 0.7605)]]"
10.1007/s12599-020-00656-x,BUSINESS & INFORMATION SYSTEMS ENGINEERING,0812 Computer Science and Technology,The Energy Consumption of Blockchain Technology: Beyond Myth,"AbstractWhen talking about blockchain technology in academia, business, and society, frequently generalizations are still heared about its – supposedly inherent – enormous energy consumption. This perception inevitably raises concerns about the further adoption of blockchain technology, a fact that inhibits rapid uptake of what is widely considered to be a groundbreaking and disruptive innovation. However, blockchain technology is far from homogeneous, meaning that blanket statements about its energy consumption should be reviewed with care. The article is meant to bring clarity to the topic in a holistic fashion, looking beyond claims regarding the energy consumption of Bitcoin, which have, so far, dominated the discussion.","[{""name"": ""Johannes Sedlmeir"", ""affiliation"": []}, {""name"": ""Hans Ulrich Buhl"", ""affiliation"": []}, {""name"": ""Gilbert Fridgen"", ""affiliation"": []}, {""name"": ""Robert Keller"", ""affiliation"": []}]","[""10.1145/3190508.3190538"", ""10.1109/MC.2018.1451660"", ""10.1007/s12599-017-0505-1"", ""10.1007/978-3-030-26954-8_23"", ""10.1007/s12599-009-0058-z"", ""10.21626/innova/2016.1/01"", ""10.1016/j.joule.2018.04.016"", ""10.1038/s41558-019-0534-5"", ""10.1007/3-540-45748-8_24"", ""10.1145/3297662.3365818"", ""10.1007/978-3-662-45472-5_28"", ""10.24251/HICSS.2018.444"", ""10.17705/2msqe.00018"", ""10.24251/HICSS.2019.848"", ""10.1038/s41893-018-0152-7"", ""10.24251/HICSS.2019.552"", ""10.1109/TEM.2020.2978014"", ""10.1038/s41558-018-0321-8"", ""10.1049/cp.2014.0699"", ""10.17705/2msqe.00020"", ""10.1007/s12599-009-0067-y"", ""10.1016/j.joule.2019.05.012"", ""10.1016/j.erss.2018.06.009"", ""10.1016/j.cosust.2017.04.011""]",['Computer Science'],"['Computer Networks and Communications', 'Information Systems']","[[('0812 计算机科学与技术', 0.7697), ('0839 网络空间安全', 0.7566), ('0811 控制科学与工程', 0.7551), ('0835 软件工程', 0.7476), ('1405 智能科学与技术', 0.7393)], [('0812 计算机科学与技术', 0.7362), ('0839 网络空间安全', 0.7268)], [('0839 网络空间安全', 0.7454), ('0812 计算机科学与技术', 0.7417)]]"
10.1108/IMDS-02-2021-0082,INDUSTRIAL MANAGEMENT & DATA SYSTEMS,1201 Management Science and Engineering; 0812 Computer Science and Technology,HTMT2-an improved criterion for assessing discriminant validity in structural equation modeling,"PurposeOne popular method to assess discriminant validity in structural equation modeling is the heterotrait-monotrait ratio of correlations (HTMT). However, the HTMT assumes tau-equivalent measurement models, which are unlikely to hold for most empirical studies. To relax this assumption, the authors modify the original HTMT and introduce a new consistent measure for congeneric measurement models: the HTMT2.Design/methodology/approachThe HTMT2 is designed in analogy to the HTMT but relies on the geometric mean instead of the arithmetic mean. A Monte Carlo simulation compares the performance of the HTMT and the HTMT2. In the simulation, several design factors are varied such as loading patterns, sample sizes and inter-construct correlations in order to compare the estimation bias of the two criteria.FindingsThe HTMT2 provides less biased estimations of the correlations among the latent variables compared to the HTMT, in particular if indicators loading patterns are heterogeneous. Consequently, the HTMT2 should be preferred over the HTMT to assess discriminant validity in case of congeneric measurement models.Research limitations/implicationsHowever, the HTMT2 can only be determined if all correlations between involved observable variables are positive.Originality/valueThis paper introduces the HTMT2 as an improved version of the traditional HTMT. Compared to other approaches assessing discriminant validity, the HTMT2 provides two advantages: (1) the ease of its computation, since HTMT2 is only based on the indicator correlations, and (2) the relaxed assumption of tau-equivalence. The authors highly recommend the HTMT2 criterion over the traditional HTMT for assessing discriminant validity in empirical studies.","[{""name"": ""Ellen Roemer"", ""affiliation"": []}, {""name"": ""Florian Schuberth"", ""affiliation"": []}, {""name"": ""Jörg Henseler"", ""affiliation"": []}]","[""10.25300/MISQ/2018/13587"", ""10.2307/2392322"", ""10.1037/0033-2909.110.2.305"", ""10.1037/h0046016"", ""10.1509/jmkr.38.2.269.18845"", ""10.1007/978-3-319-64069-3_4"", ""10.1177/002224378201900406"", ""10.1177/002224378101800104"", ""10.1108/IntR-12-2017-0515"", ""10.25300/MISQ/2013/37.2.01"", ""10.1177/1094428114526928"", ""10.1007/BF02291393"", ""10.2307/2285946"", ""10.1007/BF02294860"", ""10.1037/met0000144"", ""10.1007/BF02294164"", ""10.1177/002224378602300101"", ""10.32614/CRAN.package.cSEM"", ""10.1177/1094428120968614"", ""10.3389/fpsyg.2018.02541"", ""10.1007/s11336-008-9101-0"", ""10.1007/s11747-015-0455-4""]",['Decision Sciences'],"['Information Systems and Management', 'Management Science and Operations Research']","[[('1201 管理科学与工程', 0.7645), ('0811 控制科学与工程', 0.7569), ('0714 统计学', 0.7511), ('0711 系统科学', 0.7506), ('0812 计算机科学与技术', 0.7461)], [('1201 管理科学与工程', 0.7741), ('1205 信息资源管理', 0.7676)], [('1201 管理科学与工程', 0.7957), ('1202 工商管理学', 0.7796)]]"
