DOI,来源,研究方向,论文标题,CR_摘要,CR_作者和机构,CR_参考文献DOI,OpenAlex_field_list,OpenAlex_subfield_list,OpenAlex_map_subjects
10.1093/bioinformatics/btaa880,BIOINFORMATICS,0714 Statistics; 0836 Biotechnology and Bioengineering; 0710 Biology; 0812 Computer Science and Technology,MolTrans: Molecular Interaction Transformer for drug-target interaction prediction,"Abstract Motivation Drug–target interaction (DTI) prediction is a foundational task for in-silico drug discovery, which is costly and time-consuming due to the need of experimental search over large drug compound space. Recent years have witnessed promising progress for deep learning in DTI predictions. However, the following challenges are still open: (i) existing molecular representation learning approaches ignore the sub-structural nature of DTI, thus produce results that are less accurate and difficult to explain and (ii) existing methods focus on limited labeled data while ignoring the value of massive unlabeled molecular data. Results We propose a Molecular Interaction Transformer (MolTrans) to address these limitations via: (i) knowledge inspired sub-structural pattern mining algorithm and interaction modeling module for more accurate and interpretable DTI prediction and (ii) an augmented transformer encoder to better extract and capture the semantic relations among sub-structures extracted from massive unlabeled biomedical data. We evaluate MolTrans on real-world data and show it improved DTI prediction performance compared to state-of-the-art baselines. Availability and implementation The model scripts are available at https://github.com/kexinhuang12345/moltrans. Supplementary information Supplementary data are available at Bioinformatics online.","[{""name"": ""Kexin Huang"", ""affiliation"": [""Health Data Science, Harvard University , Boston, MA 02120, USA""]}, {""name"": ""Cao Xiao"", ""affiliation"": [""Analytics Center of Excellence, IQVIA , Cambridge, MA 02139, USA""]}, {""name"": ""Lucas M Glass"", ""affiliation"": [""Analytics Center of Excellence, IQVIA , Cambridge, MA 02139, USA""]}, {""name"": ""Jimeng Sun"", ""affiliation"": [""Department of Computer Science, University of Illinois at Urbana-Champaign , Urbana, IL 61801, USA""]}]","[""10.1007/978-1-59745-535-0_4"", ""10.1093/bioinformatics/btt072"", ""10.1038/nbt.1990"", ""10.1073/pnas.92.19.8700"", ""10.1016/j.febslet.2011.10.028"", ""10.1093/nar/gkr777"", ""10.1186/s13321-017-0209-z"", ""10.4249/scholarpedia.5947"", ""10.1111/j.1476-5381.2010.01127.x"", ""10.1038/nrd2683"", ""10.1074/jbc.M113.490706"", ""10.1371/journal.pcbi.1007129"", ""10.1042/bj0630130"", ""10.1093/nar/gkl999"", ""10.1039/C8SC00148K"", ""10.1093/bioinformatics/bty593"", ""10.1093/bib/bbu010"", ""10.1021/ci100050t"", ""10.1038/nchembio.1199"", ""10.1093/bioinformatics/bty535"", ""10.1093/nar/gkp456"", ""10.1021/acs.jproteome.6b00618"", ""10.1093/nar/gkm958"", ""10.1093/bioinformatics/bty294""]","['Materials Science', 'Computer Science', 'Biochemistry, Genetics and Molecular Biology']","['Materials Chemistry', 'Computational Theory and Mathematics', 'Molecular Biology']","[[('0805 材料科学与工程', 0.7628), ('0822 轻工技术与工程', 0.7623), ('0821 纺织科学与工程', 0.7557), ('0806 冶金工程', 0.7549), ('0819 矿业工程', 0.7522)], [('0812 计算机科学与技术', 0.7697), ('0839 网络空间安全', 0.7566), ('0811 控制科学与工程', 0.7551), ('0835 软件工程', 0.7476), ('1405 智能科学与技术', 0.7393)], [('0710 生物学', 0.7285), ('0811 控制科学与工程', 0.7264), ('0836 生物工程', 0.7242), ('1001 基础医学', 0.717), ('0832 食品科学与工程', 0.7157)], [('0805 材料科学与工程', 0.7539), ('0822 轻工技术与工程', 0.7516)], [('0812 计算机科学与技术', 0.7469), ('0811 控制科学与工程', 0.7285)], [('0710 生物学', 0.7379), ('1001 基础医学', 0.7336)]]"
10.1007/s10462-023-10466-8,ARTIFICIAL INTELLIGENCE REVIEW,0812 Computer Science and Technology,"Deep learning modelling techniques: current progress, applications, advantages, and challenges","AbstractDeep learning (DL) is revolutionizing evidence-based decision-making techniques that can be applied across various sectors. Specifically, it possesses the ability to utilize two or more levels of non-linear feature transformation of the given data via representation learning in order to overcome limitations posed by large datasets. As a multidisciplinary field that is still in its nascent phase, articles that survey DL architectures encompassing the full scope of the field are rather limited. Thus, this paper comprehensively reviews the state-of-art DL modelling techniques and provides insights into their advantages and challenges. It was found that many of the models exhibit a highly domain-specific efficiency and could be trained by two or more methods. However, training DL models can be very time-consuming, expensive, and requires huge samples for better accuracy. Since DL is also susceptible to deception and misclassification and tends to get stuck on local minima, improved optimization of parameters is required to create more robust models. Regardless, DL has already been leading to groundbreaking results in the healthcare, education, security, commercial, industrial, as well as government sectors. Some models, like the convolutional neural network (CNN), generative adversarial networks (GAN), recurrent neural network (RNN), recursive neural networks, and autoencoders, are frequently used, while the potential of other models remains widely unexplored. Pertinently, hybrid conventional DL architectures have the capacity to overcome the challenges experienced by conventional models. Considering that capsule architectures may dominate future DL models, this work aimed to compile information for stakeholders involved in the development and use of DL models in the contemporary world.","[{""name"": ""Shams Forruque Ahmed"", ""affiliation"": []}, {""name"": ""Md. Sakib Bin Alam"", ""affiliation"": []}, {""name"": ""Maruf Hassan"", ""affiliation"": []}, {""name"": ""Mahtabin Rodela Rozbu"", ""affiliation"": []}, {""name"": ""Taoseef Ishtiak"", ""affiliation"": []}, {""name"": ""Nazifa Rafa"", ""affiliation"": []}, {""name"": ""M. Mofijur"", ""affiliation"": []}, {""name"": ""A. B. M. Shawkat Ali"", ""affiliation"": []}, {""name"": ""Amir H. Gandomi"", ""affiliation"": []}]","[""10.22111/IJBDS.2016.2635"", ""10.1016/j.eswa.2015.10.015"", ""10.1111/coin.12145"", ""10.1016/j.specom.2017.08.003"", ""10.1109/ICIP.2018.8451379"", ""10.1007/978-981-13-3459-7_3"", ""10.1007/s10278-017-9983-4"", ""10.1109/TMM.2016.2615524"", ""10.1609/aaai.v33i01.3301468"", ""10.1016/j.knosys.2019.02.033"", ""10.1371/journal.pone.0105766"", ""10.1016/j.cmpb.2017.01.004"", ""10.1109/MSP.2017.2743240"", ""10.1007/s11042-015-2646-x"", ""10.1007/978-3-030-01258-8_2"", ""10.1016/j.ecoinf.2017.05.005"", ""10.1016/j.future.2020.08.005"", ""10.1109/72.279181"", ""10.1109/TPAMI.2013.50"", ""10.1109/ICCV.2017.285"", ""10.1016/j.apr.2016.12.014"", ""10.3115/v1/D14-1067"", ""10.1002/dac.3259"", ""10.1109/CVPR.2018.00812"", ""10.1186/s12880-019-0349-x"", ""10.1155/2017/3296874"", ""10.1109/ACCESS.2020.2990700"", ""10.1109/TPAMI.2017.2706685"", ""10.1109/CVPR.2018.00352"", ""10.3390/s19092047"", ""10.18653/v1/d16-1053"", ""10.1145/2649387.2649442"", ""10.1109/ICCV.2017.518"", ""10.1016/j.neunet.2012.02.023"", ""10.1007/978-3-030-00018-9_15"", ""10.1007/s10462-019-09744-1"", ""10.1109/CSCITA.2017.8066548"", ""10.1017/atsip.2013.9"", ""10.1561/2000000039"", ""10.3390/s18093153"", ""10.1016/j.matpr.2020.05.450"", ""10.1162/99608f92.92fe150c"", ""10.1016/j.autcon.2017.11.002"", ""10.1109/ICACCCN.2018.8748442"", ""10.1109/LSP.2019.2915661"", ""10.1016/J.JPDC.2021.04.010"", ""10.1007/978-3-030-01424-7_45"", ""10.23915/distill.00011"", ""10.1016/0364-0213(90)90002-E"", ""10.1007/s11263-013-0669-1"", ""10.1016/j.neunet.2017.02.013"", ""10.2196/12957"", ""10.1016/j.engappai.2020.103678"", ""10.1016/j.neunet.2018.08.002"", ""10.1109/LGRS.2020.2977838"", ""10.1109/JSTARS.2015.2406339"", ""10.1109/CSE-EUC.2017.215"", ""10.5244/c.31.114"", ""10.1109/RAIT.2016.7507953"", ""10.1016/j.enpol.2013.12.049"", ""10.3156/jsoft.29.5_177_2"", ""10.4314/wsa.v33i2.49049"", ""10.1016/j.neunet.2005.06.042"", ""10.1109/ASRU.2013.6707742"", ""10.1080/17470218.2015.1038280"", ""10.1016/j.neucom.2015.09.116"", ""10.1016/j.array.2021.100057"", ""10.1007/978-3-642-21498-1_23"", ""10.1109/TPAMI.2021.3117837"", ""10.1109/CVPR.2016.86"", ""10.1109/ICISET.2018.8745615"", ""10.1109/ACCESS.2019.2924548"", ""10.1109/ACII.2013.46"", ""10.4249/scholarpedia.5947"", ""10.1109/MSP.2012.2205597"", ""10.1007/978-3-642-21735-7_6"", ""10.1109/CVPR.2018.00833"", ""10.3390/rs71114680"", ""10.1007/s10115-021-01605-0"", ""10.1109/ICCV.2017.404"", ""10.1109/ICCV.2017.167"", ""10.1145/2505515.2505665"", ""10.3233/978-1-61499-753-5-246"", ""10.18653/v1/n18-1047"", ""10.1007/978-3-030-11015-4_38"", ""10.1109/TBDATA.2020.2963982"", ""10.1109/ITSC.2018.8569661"", ""10.1109/ACCESS.2020.3029174"", ""10.1126/science.aaa8415"", ""10.1109/CVPR.2013.263"", ""10.1109/CVPR.2019.00453"", ""10.1109/JSEN.2021.3069266"", ""10.1109/MWC.2016.1600317WC"", ""10.1111/exsy.12400"", ""10.1007/s10462-020-09825-6"", ""10.1109/CVPRW.2017.207"", ""10.1016/j.cosrev.2020.100341"", ""10.1145/3183713.3196909"", ""10.1007/978-3-319-53480-0_48"", ""10.1145/3065386"", ""10.1016/j.asoc.2019.105528"", ""10.1109/79.974718"", ""10.1142/S0129065721300011"", ""10.1007/978-3-319-49409-8_7"", ""10.1007/978-3-642-35289-8_3"", ""10.1038/nature14539"", ""10.1109/CVPR.2017.19"", ""10.1109/MACISE49704.2020.00039"", ""10.1145/1553374.1553453"", ""10.1109/MCE.2016.2640698"", ""10.1016/j.neucom.2014.06.084"", ""10.1093/bioinformatics/btu277"", ""10.3390/rs14061484"", ""10.18653/v1/P17-1064"", ""10.1109/ICCVW.2017.145"", ""10.1109/CVPR.2019.00783"", ""10.1007/s10586-018-2482-7"", ""10.1007/s11063-017-9751-y"", ""10.1016/j.procs.2017.06.037"", ""10.1093/database/bay060"", ""10.1016/j.neucom.2013.09.055"", ""10.1016/j.media.2017.07.005"", ""10.1016/j.eng.2018.11.020"", ""10.1016/j.resourpol.2021.102520"", ""10.1109/CVPR.2018.00684"", ""10.1007/s11036-017-0932-8"", ""10.1016/j.cosrev.2009.03.005"", ""10.1021/ci500747n"", ""10.18653/v1/p18-1184"", ""10.1609/aaai.v33i01.33016818"", ""10.1109/MILCOM.2016.7795448"", ""10.2174/138161207780765981"", ""10.21437/Interspeech.2010-343"", ""10.1109/ICASSP.2011.5947611"", ""10.1093/bib/bbx044"", ""10.1145/3018661.3022755"", ""10.1007/978-3-030-00934-2_82"", ""10.1016/j.eswa.2019.112958"", ""10.1117/12.2582649"", ""10.1177/1461444819885334"", ""10.1109/LGRS.2020.3010504"", ""10.1001/jama.2018.11103"", ""10.1109/CVPR.2015.7298640"", ""10.1016/j.euromechsol.2019.103874"", ""10.1109/ICCV.2017.37"", ""10.1109/VIZSEC.2017.8062202"", ""10.3390/fi11050114"", ""10.1142/S0129065716500258"", ""10.1016/B978-0-12-814513-5.00019-2"", ""10.1109/RADIOELEK.2019.8733432"", ""10.1109/EuroSP.2016.36"", ""10.3115/10730831073135"", ""10.18653/v1/d16-1244"", ""10.1109/CVPR.2019.00244"", ""10.1109/ICISA.2010.5480383"", ""10.5244/C.29.41"", ""10.3390/rs12060959"", ""10.1109/ICMLA.2016.73"", ""10.1145/2623330.2623732"", ""10.1016/j.ascom.2019.03.004"", ""10.18653/v1/n18-2082"", ""10.1109/IVS.2019.8813879"", ""10.1145/3234150"", ""10.5121/ijcsea.2015.5102"", ""10.1016/j.neucom.2018.04.045"", ""10.1109/ASRU.2017.8268935"", ""10.1109/JBHI.2016.2636665"", ""10.1109/ITSC.2018.8569502"", ""10.1016/j.jbi.2019.103337"", ""10.1007/s11263-015-0816-y"", ""10.48550/arXiv.1710.09829"", ""10.1007/s11600-019-00330-1"", ""10.1109/ICASSP.2013.6639347"", ""10.1016/j.cma.2019.112790"", ""10.3389/fncom.2017.00024"", ""10.1016/j.neunet.2014.09.003"", ""10.1109/CVPR.2014.349"", ""10.1016/j.knosys.2020.105596"", ""10.1109/ACCESS.2019.2963426"", ""10.18178/ijmlc.2018.8.6.748"", ""10.1145/2661829.2661935"", ""10.1145/3178876.3186009"", ""10.1109/ACCESS.2019.2912200"", ""10.1093/jamia/ocz096"", ""10.1109/BigData47090.2019.9005997"", ""10.1126/science.268.5210.545"", ""10.3389/frobt.2018.00121"", ""10.4018/978-1-5225-8217-5"", ""10.1016/j.jneumeth.2020.108718"", ""10.1038/srep17465"", ""10.1109/ICIP.2018.8451701"", ""10.1609/aaai.v30i1.10306"", ""10.1109/CVPR.2015.7298594"", ""10.1016/j.neucom.2018.09.040"", ""10.1371/journal.pone.0203829"", ""10.1145/3219104.3229250"", ""10.1117/12.2516014"", ""10.1109/SSCI47803.2020.9308230"", ""10.1109/ICCW.2018.8403654"", ""10.1109/ACCESS.2019.2930203"", ""10.21437/Interspeech.2018-2195"", ""10.1109/TNSM.2021.3112283"", ""10.1109/TNNLS.2019.2958103"", ""10.1016/B978-0-12-417049-0.00008-0"", ""10.1016/j.inffus.2019.08.004"", ""10.1145/3196826"", ""10.20944/preprints201810.0218.v1"", ""10.1109/ICCCNT.2018.8494159"", ""10.1162/NECO_a_00142"", ""10.18653/v1/p16-2037"", ""10.1155/2016/4742515"", ""10.1093/bioinformatics/bty977"", ""10.1016/j.neucom.2019.03.073"", ""10.1109/ICCVW.2017.18"", ""10.1609/aaai.v34i04.6115"", ""10.21437/Interspeech.2018-1351"", ""10.1109/LSP.2018.2873892"", ""10.1093/jamia/ocy068"", ""10.1126/science.1254806"", ""10.1137/20M1386062"", ""10.1109/CVPR.2018.00143"", ""10.1016/j.rse.2014.11.001"", ""10.24963/ijcai.2021/449"", ""10.1007/s00521-018-3468-3"", ""10.1145/3308558.3313635"", ""10.1109/CVPR.2017.559"", ""10.1145/3343031.3350899"", ""10.1162/neco_a_01199"", ""10.1109/CVPR.2013.97"", ""10.1016/j.chaos.2020.110121"", ""10.1016/j.eswa.2014.09.011"", ""10.1145/3446776"", ""10.1007/978-3-319-46475-6_28"", ""10.1109/TASLP.2017.2751420"", ""10.1109/ICCV.2017.629"", ""10.1016/j.patcog.2016.10.032"", ""10.1145/3285029"", ""10.1021/acs.jpca.0c04473"", ""10.1609/aaai.v29i1.9492"", ""10.1016/j.patcog.2016.05.028"", ""10.3390/rs11222673"", ""10.1109/TGRS.2017.2755542"", ""10.1109/TASLP.2016.2544661"", ""10.1561/0600000018"", ""10.1016/j.neucom.2018.09.050"", ""10.11591/ijeecs.v19.i1.pp325-335""]","['Computer Science', 'Medicine']","['Radiology, Nuclear Medicine and Imaging', 'Artificial Intelligence']","[[('0812 计算机科学与技术', 0.7697), ('0839 网络空间安全', 0.7566), ('0811 控制科学与工程', 0.7551), ('0835 软件工程', 0.7476), ('1405 智能科学与技术', 0.7393)], [('1002 临床医学', 0.7333), ('1007 药学', 0.7307), ('1001 基础医学', 0.7301), ('1008 中药学', 0.7257), ('1005 中医学', 0.7236)], [('1009 特种医学', 0.7528), ('0827 核科学与技术', 0.7425)], [('1405 智能科学与技术', 0.7329), ('0812 计算机科学与技术', 0.7301)]]"
10.1093/bioinformatics/btaa524,BIOINFORMATICS,0714 Statistics; 0836 Biotechnology and Bioengineering; 0710 Biology; 0812 Computer Science and Technology,TransformerCPI: improving compound-protein interaction prediction by sequence-based deep learning with self-attention mechanism and label reversal experiments,"Abstract Motivation Identifying compound–protein interaction (CPI) is a crucial task in drug discovery and chemogenomics studies, and proteins without three-dimensional structure account for a large part of potential biological targets, which requires developing methods using only protein sequence information to predict CPI. However, sequence-based CPI models may face some specific pitfalls, including using inappropriate datasets, hidden ligand bias and splitting datasets inappropriately, resulting in overestimation of their prediction performance. Results To address these issues, we here constructed new datasets specific for CPI prediction, proposed a novel transformer neural network named TransformerCPI, and introduced a more rigorous label reversal experiment to test whether a model learns true interaction features. TransformerCPI achieved much improved performance on the new experiments, and it can be deconvolved to highlight important interacting regions of protein sequences and compound atoms, which may contribute chemical biology studies with useful guidance for further ligand structural optimization. Availability and implementation https://github.com/lifanchen-simm/transformerCPI.","[{""name"": ""Lifan Chen"", ""affiliation"": [""Shanghai Institute of Materia Medica, Chinese Academy of Sciences Drug Discovery and Design Center, State Key Laboratory of Drug Research, , Shanghai 201203, China"", ""University of Chinese Academy of Sciences , Beijing 100049, China""]}, {""name"": ""Xiaoqin Tan"", ""affiliation"": [""Shanghai Institute of Materia Medica, Chinese Academy of Sciences Drug Discovery and Design Center, State Key Laboratory of Drug Research, , Shanghai 201203, China"", ""University of Chinese Academy of Sciences , Beijing 100049, China""]}, {""name"": ""Dingyan Wang"", ""affiliation"": [""Shanghai Institute of Materia Medica, Chinese Academy of Sciences Drug Discovery and Design Center, State Key Laboratory of Drug Research, , Shanghai 201203, China"", ""University of Chinese Academy of Sciences , Beijing 100049, China""]}, {""name"": ""Feisheng Zhong"", ""affiliation"": [""Shanghai Institute of Materia Medica, Chinese Academy of Sciences Drug Discovery and Design Center, State Key Laboratory of Drug Research, , Shanghai 201203, China"", ""University of Chinese Academy of Sciences , Beijing 100049, China""]}, {""name"": ""Xiaohong Liu"", ""affiliation"": [""Shanghai Institute of Materia Medica, Chinese Academy of Sciences Drug Discovery and Design Center, State Key Laboratory of Drug Research, , Shanghai 201203, China"", ""ShanghaiTech University Shanghai Institute for Advanced Immunochemical Studies, School of Life Science and Technology, , Shanghai 200031, China""]}, {""name"": ""Tianbiao Yang"", ""affiliation"": [""Shanghai Institute of Materia Medica, Chinese Academy of Sciences Drug Discovery and Design Center, State Key Laboratory of Drug Research, , Shanghai 201203, China"", ""University of Chinese Academy of Sciences , Beijing 100049, China""]}, {""name"": ""Xiaomin Luo"", ""affiliation"": [""Shanghai Institute of Materia Medica, Chinese Academy of Sciences Drug Discovery and Design Center, State Key Laboratory of Drug Research, , Shanghai 201203, China""]}, {""name"": ""Kaixian Chen"", ""affiliation"": [""Shanghai Institute of Materia Medica, Chinese Academy of Sciences Drug Discovery and Design Center, State Key Laboratory of Drug Research, , Shanghai 201203, China"", ""ShanghaiTech University Shanghai Institute for Advanced Immunochemical Studies, School of Life Science and Technology, , Shanghai 200031, China""]}, {""name"": ""Hualiang Jiang"", ""affiliation"": [""Shanghai Institute of Materia Medica, Chinese Academy of Sciences Drug Discovery and Design Center, State Key Laboratory of Drug Research, , Shanghai 201203, China"", ""ShanghaiTech University Shanghai Institute for Advanced Immunochemical Studies, School of Life Science and Technology, , Shanghai 200031, China""]}, {""name"": ""Mingyue Zheng"", ""affiliation"": [""Shanghai Institute of Materia Medica, Chinese Academy of Sciences Drug Discovery and Design Center, State Key Laboratory of Drug Research, , Shanghai 201203, China""]}]","[""10.1038/s41592-019-0598-1"", ""10.1093/bioinformatics/btp433"", ""10.1038/nrg1317"", ""10.1371/journal.pone.0220113"", ""10.1039/c2mb25110h"", ""10.1093/nar/gkv1072"", ""10.1093/bioinformatics/bts360"", ""10.1093/nar/gkm862"", ""10.1002/minf.201600045"", ""10.1186/s13321-017-0209-z"", ""10.1093/bioinformatics/btn409"", ""10.1093/bioinformatics/btz111"", ""10.1371/journal.pone.0141287"", ""10.1371/journal.pcbi.1007129"", ""10.1093/bioinformatics/btv256"", ""10.1093/nar/gkl999"", ""10.1021/jm300687e"", ""10.1093/bioinformatics/bty593"", ""10.1038/d41586-019-02307-y"", ""10.1109/TNN.2008.2005605"", ""10.1021/acscentsci.9b00576"", ""10.1021/acs.jcim.8b00712"", ""10.1093/nar/gkv1277"", ""10.1021/ci400709d"", ""10.1016/j.ymeth.2016.06.024"", ""10.1093/bioinformatics/bty535"", ""10.1038/s41573-019-0024-5"", ""10.1093/bioinformatics/btr500"", ""10.1016/j.gpb.2019.04.003"", ""10.1021/ci200264h"", ""10.1093/bioinformatics/btt234"", ""10.1093/nar/gkm958"", ""10.1093/bioinformatics/btn162"", ""10.1093/bioinformatics/bty178"", ""10.1038/s42256-020-0152-y""]","['Computer Science', 'Biochemistry, Genetics and Molecular Biology']","['Computational Theory and Mathematics', 'Molecular Biology']","[[('0812 计算机科学与技术', 0.7697), ('0839 网络空间安全', 0.7566), ('0811 控制科学与工程', 0.7551), ('0835 软件工程', 0.7476), ('1405 智能科学与技术', 0.7393)], [('0710 生物学', 0.7285), ('0811 控制科学与工程', 0.7264), ('0836 生物工程', 0.7242), ('1001 基础医学', 0.717), ('0832 食品科学与工程', 0.7157)], [('0812 计算机科学与技术', 0.7469), ('0811 控制科学与工程', 0.7285)], [('0710 生物学', 0.7379), ('1001 基础医学', 0.7336)]]"
10.1186/s40537-020-00299-5,JOURNAL OF BIG DATA,0812 Computer Science and Technology,A comprehensive evaluation of ensemble learning for stock-market prediction,"AbstractStock-market prediction using machine-learning technique aims at developing effective and efficient models that can provide a better and higher rate of prediction accuracy. Numerous ensemble regressors and classifiers have been applied in stock market predictions, using different combination techniques. However, three precarious issues come in mind when constructing ensemble classifiers and regressors. The first concerns with the choice of base regressor or classifier technique adopted. The second concerns the combination techniques used to assemble multiple regressors or classifiers and the third concerns with the quantum of regressors or classifiers to be ensembled. Subsequently, the number of relevant studies scrutinising these previously mentioned concerns are limited. In this study, we performed an extensive comparative analysis of ensemble techniques such as boosting, bagging, blending and super learners (stacking). Using Decision Trees (DT), Support Vector Machine (SVM) and Neural Network (NN), we constructed twenty-five (25) different ensembled regressors and classifiers. We compared their execution times, accuracy, and error metrics over stock-data from Ghana Stock Exchange (GSE), Johannesburg Stock Exchange (JSE), Bombay Stock Exchange (BSE-SENSEX) and New York Stock Exchange (NYSE), from January 2012 to December 2018. The study outcome shows that stacking and blending ensemble techniques offer higher prediction accuracies (90–100%) and (85.7–100%) respectively, compared with that of bagging (53–97.78%) and boosting (52.7–96.32%). Furthermore, the root means square error (RMSE) recorded by stacking (0.0001–0.001) and blending (0.002–0.01) shows a better fit of ensemble classifiers and regressors based on these two techniques in market analyses compared with bagging (0.01–0.11) and boosting (0.01–0.443). Finally, the results undoubtedly suggest that an innovative study in the domain of stock market direction prediction ought to include ensemble techniques in their sets of algorithms.","[{""name"": ""Isaac Kofi Nti"", ""affiliation"": []}, {""name"": ""Adebayo Felix Adekoya"", ""affiliation"": []}, {""name"": ""Benjamin Asubam Weyori"", ""affiliation"": []}]","[""10.1007/s10462-019-09754-z"", ""10.1109/ACCESS.2019.2921092"", ""10.3844/ajassp.2019.200.212"", ""10.1016/j.neucom.2019.03.006"", ""10.1016/j.eswa.2014.12.049"", ""10.1016/j.eneco.2016.04.019"", ""10.1109/ICECTE.2016.7879611"", ""10.1016/j.dss.2017.10.001"", ""10.1016/j.eswa.2015.09.029"", ""10.1016/j.eswa.2015.05.013"", ""10.1109/inista.2017.8001123"", ""10.3390/en11061605"", ""10.1016/j.eneco.2017.05.023"", ""10.1016/j.asoc.2015.07.020"", ""10.24136/eq.2018.001"", ""10.1109/CEC.2015.7257276"", ""10.2139/ssrn.3310289"", ""10.1109/i2ct.2017.8226316"", ""10.1007/978-3-319-93713-7_55"", ""10.1016/j.physa.2019.122272"", ""10.1007/978-3-319-32229-2_23"", ""10.23919/chicc.2017.8027964"", ""10.1016/j.eswa.2013.12.009"", ""10.1016/j.heliyon.2019.e02310"", ""10.1007/978-981-13-2285-3"", ""10.1186/s40537-017-0111-6"", ""10.1007/978-3-319-93034-3_22"", ""10.1016/j.ejor.2016.10.031"", ""10.1007/978-981-10-6427-2_2"", ""10.1109/aike.2019.00045"", ""10.1007/978-3-319-75408-6_13"", ""10.1007/s00521-016-2304-x"", ""10.1007/978-3-030-04780-1_7"", ""10.1109/cis.2016.86"", ""10.1109/iicaiet.2018.8638452"", ""10.1007/s42786-019-00009-7"", ""10.1109/ic3.2019.8844891"", ""10.1109/ijcnn.2018.8489688"", ""10.1007/978-981-13-1819-1_38"", ""10.2139/ssrn.876544"", ""10.1016/j.asoc.2014.08.047"", ""10.1109/iceest.2018.8643327"", ""10.22452/mjcs.vol32no2.2"", ""10.1016/c2014-0-03762-8"", ""10.1137/S0895479897326432"", ""10.1109/ase.2015.88"", ""10.1016/j.rser.2015.04.081"", ""10.3414/ME13-01-0122"", ""10.1016/j.eswa.2017.02.044"", ""10.17485/ijst/2016/v9i48/107985"", ""10.1016/j.eswa.2017.04.030"", ""10.1186/s40537-019-0247-7""]","['Economics, Econometrics and Finance', 'Decision Sciences']","['Management Science and Operations Research', 'Finance']","[[('0202 应用经济学', 0.766), ('0714 统计学', 0.7639), ('0201 理论经济学', 0.7634), ('1202 工商管理学', 0.7449), ('0701 数学', 0.7423)], [('1201 管理科学与工程', 0.7645), ('0811 控制科学与工程', 0.7569), ('0714 统计学', 0.7511), ('0711 系统科学', 0.7506), ('0812 计算机科学与技术', 0.7461)], [('1201 管理科学与工程', 0.7957), ('1202 工商管理学', 0.7796)], [('0202 应用经济学', 0.7025), ('0714 统计学', 0.696)]]"
