DOI,来源,研究方向,论文标题,CR_摘要,CR_作者和机构,CR_参考文献DOI,OpenAlex_field_list,OpenAlex_subfield_list,OpenAlex_map_subjects
10.1038/s41586-020-2649-2,NATURE,0812 Computer Science and Technology,Array programming with NumPy,"AbstractArray programming provides a powerful, compact and expressive syntax for accessing, manipulating and operating on data in vectors, matrices and higher-dimensional arrays. NumPy is the primary array programming library for the Python language. It has an essential role in research analysis pipelines in fields as diverse as physics, chemistry, astronomy, geoscience, biology, psychology, materials science, engineering, finance and economics. For example, in astronomy, NumPy was an important part of the software stack used in the discovery of gravitational waves1and in the first imaging of a black hole2. Here we review how a few fundamental array concepts lead to a simple and powerful programming paradigm for organizing, exploring and analysing scientific data. NumPy is the foundation upon which the scientific Python ecosystem is constructed. It is so pervasive that several projects, targeting audiences with specialized needs, have developed their own NumPy-like interfaces and array objects. Owing to its central position in the ecosystem, NumPy increasingly acts as an interoperability layer between such array computation libraries and, together with its application programming interface (API), provides a flexible framework to support the next decade of scientific and industrial analysis.","[{""name"": ""Charles R. Harris"", ""affiliation"": []}, {""name"": ""K. Jarrod Millman"", ""affiliation"": []}, {""name"": ""Stéfan J. van der Walt"", ""affiliation"": []}, {""name"": ""Ralf Gommers"", ""affiliation"": []}, {""name"": ""Pauli Virtanen"", ""affiliation"": []}, {""name"": ""David Cournapeau"", ""affiliation"": []}, {""name"": ""Eric Wieser"", ""affiliation"": []}, {""name"": ""Julian Taylor"", ""affiliation"": []}, {""name"": ""Sebastian Berg"", ""affiliation"": []}, {""name"": ""Nathaniel J. Smith"", ""affiliation"": []}, {""name"": ""Robert Kern"", ""affiliation"": []}, {""name"": ""Matti Picus"", ""affiliation"": []}, {""name"": ""Stephan Hoyer"", ""affiliation"": []}, {""name"": ""Marten H. van Kerkwijk"", ""affiliation"": []}, {""name"": ""Matthew Brett"", ""affiliation"": []}, {""name"": ""Allan Haldane"", ""affiliation"": []}, {""name"": ""Jaime Fernández del Río"", ""affiliation"": []}, {""name"": ""Mark Wiebe"", ""affiliation"": []}, {""name"": ""Pearu Peterson"", ""affiliation"": []}, {""name"": ""Pierre Gérard-Marchant"", ""affiliation"": []}, {""name"": ""Kevin Sheppard"", ""affiliation"": []}, {""name"": ""Tyler Reddy"", ""affiliation"": []}, {""name"": ""Warren Weckesser"", ""affiliation"": []}, {""name"": ""Hameer Abbasi"", ""affiliation"": []}, {""name"": ""Christoph Gohlke"", ""affiliation"": []}, {""name"": ""Travis E. Oliphant"", ""affiliation"": []}]","[""10.1103/PhysRevLett.116.061102"", ""10.3847/0004-637X/829/1/11"", ""10.1063/1.4822400"", ""10.1109/MCSE.2007.51"", ""10.1109/MCSE.2007.58"", ""10.1109/MCSE.2011.36"", ""10.1109/MCSE.2010.119"", ""10.1038/s41592-019-0686-2"", ""10.1109/MCSE.2007.55"", ""10.25080/Majora-92bf1922-00a"", ""10.7717/peerj.453"", ""10.1109/MCSE.2011.37"", ""10.1145/2503210.2503219"", ""10.1109/ICPADS.2012.97"", ""10.1109/MCSE.2007.53"", ""10.1051/0004-6361/201322068"", ""10.3847/1538-3881/aac387"", ""10.1093/bioinformatics/btp163"", ""10.1109/MCSE.2007.46"", ""10.1088/1749-4699/8/1/014009"", ""10.1201/9781315373461-6"", ""10.1109/MCSE.2006.122"", ""10.1109/SECSE.2009.5069155"", ""10.3389/fnins.2018.00727"", ""10.5334/jors.148"", ""10.1109/MCSE.2010.118"", ""10.1145/2833157.2833162"", ""10.1088/1749-4680/8/1/014001"", ""10.1109/MAHC.2008.29"", ""10.1063/1.4823451"", ""10.1080/10618600.1996.10474713"", ""10.1145/1460833.1460872"", ""10.1117/12.2312157"", ""10.1145/2692956.2663188"", ""10.1137/141000671""]",['Computer Science'],"['Computational Theory and Mathematics', 'Artificial Intelligence']","[[('0812 计算机科学与技术', 0.7697), ('0839 网络空间安全', 0.7566), ('0811 控制科学与工程', 0.7551), ('0835 软件工程', 0.7476), ('1405 智能科学与技术', 0.7393)], [('0812 计算机科学与技术', 0.7469), ('0811 控制科学与工程', 0.7285)], [('1405 智能科学与技术', 0.7329), ('0812 计算机科学与技术', 0.7301)]]"
10.1186/s40537-021-00444-8,JOURNAL OF BIG DATA,0812 Computer Science and Technology,"Review of deep learning: concepts, CNN architectures, challenges, applications, future directions","AbstractIn the last few years, the deep learning (DL) computing paradigm has been deemed the Gold Standard in the machine learning (ML) community. Moreover, it has gradually become the most widely used computational approach in the field of ML, thus achieving outstanding results on several complex cognitive tasks, matching or even beating those provided by human performance. One of the benefits of DL is the ability to learn massive amounts of data. The DL field has grown fast in the last few years and it has been extensively used to successfully address a wide range of traditional applications. More importantly, DL has outperformed well-known ML techniques in many domains, e.g., cybersecurity, natural language processing, bioinformatics, robotics and control, and medical information processing, among many others. Despite it has been contributed several works reviewing the State-of-the-Art on DL, all of them only tackled one aspect of the DL, which leads to an overall lack of knowledge about it. Therefore, in this contribution, we propose using a more holistic approach in order to provide a more suitable starting point from which to develop a full understanding of DL. Specifically, this review attempts to provide a more comprehensive survey of the most important aspects of DL and including those enhancements recently added to the field. In particular, this paper outlines the importance of DL, presents the types of DL techniques and networks. It then presents convolutional neural networks (CNNs) which the most utilized DL network type and describes the development of CNNs architectures together with their main features, e.g., starting with the AlexNet network and closing with the High-Resolution network (HR.Net). Finally, we further present the challenges and suggested solutions to help researchers understand the existing research gaps. It is followed by a list of the major DL applications. Computational tools including FPGA, GPU, and CPU are summarized along with a description of their influence on DL. The paper ends with the evolution matrix, benchmark datasets, and summary and conclusion.","[{""name"": ""Laith Alzubaidi"", ""affiliation"": []}, {""name"": ""Jinglan Zhang"", ""affiliation"": []}, {""name"": ""Amjad J. Humaidi"", ""affiliation"": []}, {""name"": ""Ayad Al-Dujaili"", ""affiliation"": []}, {""name"": ""Ye Duan"", ""affiliation"": []}, {""name"": ""Omran Al-Shamma"", ""affiliation"": []}, {""name"": ""J. Santamaría"", ""affiliation"": []}, {""name"": ""Mohammed A. Fadhel"", ""affiliation"": []}, {""name"": ""Muthana Al-Amidie"", ""affiliation"": []}, {""name"": ""Laith Farhan"", ""affiliation"": []}]","[""10.7717/peerj-cs.307"", ""10.1016/j.eswa.2017.06.035"", ""10.1109/ACCESS.2019.2894819"", ""10.1186/s40537-015-0029-9"", ""10.1007/s13740-016-0060-9"", ""10.1016/j.patrec.2019.06.020"", ""10.1016/j.neucom.2016.12.038"", ""10.1145/3234150"", ""10.3390/electronics8030292"", ""10.1145/3178454"", ""10.1016/j.inffus.2019.08.008"", ""10.1007/s10796-020-10023-6"", ""10.1109/MCI.2018.2840738"", ""10.1038/s41386-020-0767-z"", ""10.1109/CVPR.2005.177"", ""10.1109/ICCV.1999.790410"", ""10.1109/TIP.2010.2045169"", ""10.1038/nature14539"", ""10.1016/j.patrec.2018.05.018"", ""10.1007/s13748-019-00203-0"", ""10.1007/s10462-020-09825-6"", ""10.3390/plants9101302"", ""10.1007/s11042-020-08976-6"", ""10.1109/ACCESS.2017.2788044"", ""10.1109/TKDE.2020.2981333"", ""10.1109/ACCESS.2019.2912200"", ""10.1186/s40537-014-0007-7"", ""10.1186/s40537-020-00392-9"", ""10.1145/3065386"", ""10.3390/s20216299"", ""10.1002/jcc.24764"", ""10.1016/j.jcp.2019.05.028"", ""10.1109/TMM.2019.2919431"", ""10.1016/j.patcog.2020.107623"", ""10.1109/TNNLS.2018.2876865"", ""10.1109/CVPR.2016.90"", ""10.1016/j.drudis.2018.01.039"", ""10.1016/j.neucom.2019.09.044"", ""10.1371/journal.pone.0233678"", ""10.1038/s41746-018-0076-7"", ""10.1038/nature21056"", ""10.1109/ACCESS.2020.3001973"", ""10.1016/j.patcog.2020.107700"", ""10.1016/j.sleep.2019.12.032"", ""10.1038/s41591-018-0107-6"", ""10.1038/s41591-018-0300-7"", ""10.1016/j.cell.2018.02.010"", ""10.1145/2834892.2834897"", ""10.7717/peerj-cs.321"", ""10.1038/nature14236"", ""10.1109/MSP.2017.2743240"", ""10.1109/ICNN.1996.548916"", ""10.1007/JHEP01(2019)057"", ""10.1007/s11063-019-10049-1"", ""10.1021/acs.jcim.7b00384"", ""10.1016/j.ijforecast.2020.06.008"", ""10.1109/JSAIT.2020.2988577"", ""10.1038/s41467-020-16985-0"", ""10.3390/app10041273"", ""10.18653/v1/D16-1082"", ""10.1016/j.ins.2019.06.039"", ""10.1016/j.neunet.2020.01.018"", ""10.1109/ARIS50834.2020.9205778"", ""10.1186/s12859-020-03809-7"", ""10.7717/peerj-cs.324"", ""10.1016/j.patcog.2020.107610"", ""10.1016/j.patcog.2017.10.013"", ""10.1016/j.aei.2019.100980"", ""10.1016/j.specom.2019.01.004"", ""10.3390/s20216114"", ""10.1113/jphysiol.1962.sp006837"", ""10.1007/978-3-7908-2604-3_16"", ""10.1109/IWQoS.2018.8624183"", ""10.3390/electronics9030427"", ""10.3390/app10134523"", ""10.3390/electronics9030445"", ""10.1109/ICASSP.2013.6639346"", ""10.1142/S0218488598000094"", ""10.1016/j.sysarc.2019.02.008"", ""10.1002/ima.22337"", ""10.1007/978-3-319-10590-1_53"", ""10.1109/ICASSP.2013.6639343"", ""10.1109/CVPR.2007.383157"", ""10.1109/CVPR.2015.7298594"", ""10.1109/TSG.2017.2753802"", ""10.3390/s16010115"", ""10.1016/j.neunet.2012.02.023"", ""10.1609/aaai.v31i1.11231"", ""10.1109/CVPR.2016.308"", ""10.1007/s11042-017-4440-4"", ""10.1109/CVPR.2017.243"", ""10.1016/j.jelectrocard.2018.08.008"", ""10.1007/s10489-018-1234-y"", ""10.1109/CVPR.2017.634"", ""10.1007/s11042-020-09350-2"", ""10.1016/j.algal.2020.102018"", ""10.1109/IGARSS.2018.8518290"", ""10.5244/C.30.87"", ""10.1007/978-3-319-46493-0_39"", ""10.1007/s42979-020-00294-w"", ""10.1109/TCSVT.2019.2935128"", ""10.1109/CVPR.2017.668"", ""10.1109/ACCESS.2019.2903582"", ""10.1109/CVPR.2017.195"", ""10.1109/NTMS.2019.8763852"", ""10.1016/j.imu.2020.100360"", ""10.1109/CVPR.2017.683"", ""10.1016/j.neucom.2019.10.054"", ""10.1016/j.neucom.2019.11.068"", ""10.1109/CVPR.2018.00745"", ""10.1109/TGRS.2019.2933609"", ""10.1007/978-3-030-01234-2_1"", ""10.1007/978-3-030-00928-1_48"", ""10.1109/TMI.2018.2867261"", ""10.1109/JSTARS.2019.2913097"", ""10.1016/j.neucom.2019.10.007"", ""10.1109/TPAMI.2020.2983686"", ""10.1109/CVPR42600.2020.00543"", ""10.1007/978-3-030-01424-7_27"", ""10.1186/s40537-016-0043-6"", ""10.1186/s40537-019-0197-0"", ""10.1364/OE.27.025560"", ""10.1016/j.neucom.2015.11.059"", ""10.1109/CVPR.2009.5206848"", ""10.1007/s10115-013-0665-3"", ""10.1016/j.neucom.2011.12.043"", ""10.1109/ACCESS.2020.3031914"", ""10.1186/s40537-020-00387-6"", ""10.7717/peerj-cs.312"", ""10.1109/SSCI.2018.8628917"", ""10.1186/s40537-019-0192-5"", ""10.1007/978-3-642-20847-8_28"", ""10.1109/TCYB.2013.2257480"", ""10.1007/978-3-319-46227-1_1"", ""10.1093/bioinformatics/btx680"", ""10.1016/j.ymeth.2019.04.008"", ""10.1098/rsif.2017.0387"", ""10.1038/nmeth.3547"", ""10.1038/s41524-019-0231-y"", ""10.1145/2939672.2939778"", ""10.1038/s42256-020-00244-4"", ""10.1016/j.media.2019.101557"", ""10.1016/j.media.2020.101790"", ""10.1016/j.patcog.2006.01.010"", ""10.1109/TIT.2004.839514"", ""10.1109/ICCV.2019.00040"", ""10.1109/ICCV.2017.368"", ""10.1016/j.conb.2017.03.015"", ""10.1016/j.conb.2017.06.001"", ""10.1080/08982112.2016.1183255"", ""10.1109/CVPR.2017.587"", ""10.1016/j.neunet.2019.01.012"", ""10.1016/j.neunet.2018.07.013"", ""10.1016/j.neunet.2017.09.001"", ""10.1109/MSP.2017.2765695"", ""10.1109/JSTSP.2020.2969554"", ""10.1016/j.ijmedinf.2018.03.013"", ""10.1038/s41591-018-0316-z"", ""10.1109/ACCESS.2018.2890150"", ""10.1016/j.micpro.2020.103333"", ""10.1007/978-3-030-16657-1_47"", ""10.1109/TII.2018.2789925"", ""10.1016/j.neucom.2018.03.080"", ""10.1145/3446776"", ""10.1016/j.eng.2020.04.010"", ""10.1016/j.cmpb.2020.105751"", ""10.1109/ICASSP.2016.7472159"", ""10.1109/LSP.2017.2657381"", ""10.1016/j.neucom.2019.07.017"", ""10.1109/ICSCC.2019.8843652"", ""10.1016/j.sysarc.2019.101635"", ""10.1007/s00256-019-03284-z"", ""10.1016/j.neucom.2020.01.085"", ""10.1109/TITS.2019.2962338"", ""10.1007/s12652-019-01310-5"", ""10.1109/ACCESS.2019.2939201"", ""10.1109/TNNLS.2020.2995800"", ""10.1016/j.media.2017.07.005"", ""10.1007/s11042-020-09537-7"", ""10.1038/s41467-021-20966-2"", ""10.3390/cancers13040661"", ""10.1016/j.neucom.2020.04.157"", ""10.1016/j.imu.2020.100391"", ""10.1109/CHASE.2017.59"", ""10.1007/s10278-016-9914-9"", ""10.1109/CVPR.2017.369"", ""10.1109/ACCESS.2019.2903587"", ""10.1007/978-3-319-19992-4_46"", ""10.1007/978-3-319-10443-0_39"", ""10.1016/j.media.2020.101694"", ""10.3390/brainsci10020084"", ""10.2741/4606"", ""10.1109/ISBI.2017.7950647"", ""10.1007/s11042-019-07820-w"", ""10.1109/TETCI.2018.2866254"", ""10.1016/j.compbiomed.2021.104596"", ""10.1109/ACCESS.2020.3035327"", ""10.1007/978-3-030-55340-1_14"", ""10.3390/jimaging6110121"", ""10.1016/j.patrec.2019.03.022"", ""10.1109/DeSE.2019.00057"", ""10.1016/j.compmedimag.2018.11.003"", ""10.3390/s20164373"", ""10.1109/CIBEC.2018.8641762"", ""10.1007/s11042-018-5714-1"", ""10.1109/ACCESS.2020.3003890"", ""10.1016/j.ijmedinf.2020.104284"", ""10.1007/978-3-030-69744-0_6"", ""10.1016/j.bbe.2020.08.005"", ""10.1016/j.asoc.2020.106580"", ""10.3390/cancers13040652"", ""10.1016/j.jormas.2019.06.002"", ""10.1109/TRPMS.2018.2890359"", ""10.3390/cancers12071884"", ""10.1016/j.zemedi.2018.11.002"", ""10.1186/s40537-019-0276-2"", ""10.1038/s41592-020-0853-5"", ""10.1007/s11042-019-08130-x"", ""10.1016/j.compeleceng.2019.08.004"", ""10.1016/j.ijrobp.2019.05.071"", ""10.1109/ISBI.2015.7163826"", ""10.1109/TPAMI.2012.277"", ""10.1016/j.neucom.2019.04.028"", ""10.3934/mbe.2019326"", ""10.1016/j.eswa.2020.113677"", ""10.3390/app10020559"", ""10.1007/s13246-020-00865-4"", ""10.1016/j.compbiomed.2020.103869"", ""10.1016/j.chaos.2020.110338"", ""10.1016/j.chaos.2020.110122"", ""10.1016/j.ebiom.2019.04.055"", ""10.1016/j.artmed.2019.101756"", ""10.1007/s11063-020-10364-y"", ""10.1038/s42256-020-0190-5"", ""10.1109/JBHI.2020.3027566"", ""10.1016/j.patrec.2020.03.011"", ""10.1007/s11517-020-02175-z"", ""10.1109/ACCESS.2020.2978754"", ""10.3390/jcm9030749"", ""10.1016/j.media.2020.101813"", ""10.1007/978-3-642-40763-5_51"", ""10.1109/TMI.2016.2525803"", ""10.1109/TMI.2015.2458702"", ""10.1109/TMI.2016.2528120"", ""10.1186/s13640-018-0332-4"", ""10.1007/s10916-019-1416-0"", ""10.1016/j.compmedimag.2019.101673"", ""10.1177/1352458519856843"", ""10.1016/j.patcog.2018.11.009"", ""10.1109/ACCESS.2019.2927433"", ""10.1016/j.mri.2019.05.043"", ""10.1007/s10278-017-9983-4"", ""10.1109/TMI.2016.2548501"", ""10.1109/3DV.2016.79"", ""10.1007/978-3-319-24574-4_28"", ""10.1109/TMI.2016.2538465"", ""10.1016/j.media.2016.05.004"", ""10.1109/TPAMI.2017.2699184"", ""10.1109/TMI.2020.3000314"", ""10.1109/RBME.2020.2987975"", ""10.3390/app10061928"", ""10.1016/j.cviu.2011.05.006"", ""10.1007/978-3-319-46466-4_18"", ""10.1109/CVPR.2019.00885"", ""10.1145/3208159.3208173"", ""10.1088/1361-6560/ab843e"", ""10.1007/s00138-020-01060-x"", ""10.1016/j.media.2018.11.010"", ""10.1016/j.neuroimage.2017.07.008"", ""10.1109/TMI.2016.2521800"", ""10.1109/ISBI45749.2020.9098602"", ""10.1109/TCAD.2020.3003843"", ""10.3390/s19153371"", ""10.1002/cpe.4786"", ""10.3390/electronics10030282"", ""10.3390/s19020350"", ""10.1109/TCSS.2021.3059318"", ""10.5121/ijdkp.2015.5201"", ""10.1023/A:1024099825458"", ""10.1016/j.csl.2020.101078"", ""10.1016/j.patrec.2005.10.010"", ""10.1109/TKDE.2005.50"", ""10.1023/A:1010920819831"", ""10.1016/j.eswa.2019.03.040"", ""10.1016/j.neuroimage.2020.117026""]","['Computer Science', 'Medicine']","['Radiology, Nuclear Medicine and Imaging', 'Computer Vision and Pattern Recognition', 'Artificial Intelligence']","[[('0812 计算机科学与技术', 0.7697), ('0839 网络空间安全', 0.7566), ('0811 控制科学与工程', 0.7551), ('0835 软件工程', 0.7476), ('1405 智能科学与技术', 0.7393)], [('1002 临床医学', 0.7333), ('1007 药学', 0.7307), ('1001 基础医学', 0.7301), ('1008 中药学', 0.7257), ('1005 中医学', 0.7236)], [('1009 特种医学', 0.7528), ('0827 核科学与技术', 0.7425)], [('0811 控制科学与工程', 0.7558), ('0812 计算机科学与技术', 0.7479)], [('1405 智能科学与技术', 0.7329), ('0812 计算机科学与技术', 0.7301)]]"
10.1093/bioinformatics/btz848,BIOINFORMATICS,0836 Biotechnology and Bioengineering; 0714 Statistics; 0812 Computer Science and Technology; 0710 Biology,GTDB-Tk: a toolkit to classify genomes with the Genome Taxonomy Database,Abstract Summary The Genome Taxonomy Database Toolkit (GTDB-Tk) provides objective taxonomic assignments for bacterial and archaeal genomes based on the GTDB. GTDB-Tk is computationally efficient and able to classify thousands of draft genomes in parallel. Here we demonstrate the accuracy of the GTDB-Tk taxonomic assignments by evaluating its performance on a phylogenetically diverse set of 10 156 bacterial and archaeal metagenome-assembled genomes. Availability and implementation GTDB-Tk is implemented in Python and licenced under the GNU General Public Licence v3.0. Source code and documentation are available at: https://github.com/ecogenomics/gtdbtk. Supplementary information Supplementary data are available at Bioinformatics online.,"[{""name"": ""Pierre-Alain Chaumeil"", ""affiliation"": [""Australian Centre for Ecogenomics, School of Chemistry and Molecular Biosciences, The University of Queensland , St Lucia, QLD 4072, Australia""]}, {""name"": ""Aaron J Mussig"", ""affiliation"": [""Australian Centre for Ecogenomics, School of Chemistry and Molecular Biosciences, The University of Queensland , St Lucia, QLD 4072, Australia""]}, {""name"": ""Philip Hugenholtz"", ""affiliation"": [""Australian Centre for Ecogenomics, School of Chemistry and Molecular Biosciences, The University of Queensland , St Lucia, QLD 4072, Australia""]}, {""name"": ""Donovan H Parks"", ""affiliation"": [""Australian Centre for Ecogenomics, School of Chemistry and Molecular Biosciences, The University of Queensland , St Lucia, QLD 4072, Australia""]}]","[""10.1038/ncomms13219"", ""10.1038/nbt.4163"", ""10.1038/nbt.3893"", ""10.1371/journal.pone.0214354"", ""10.1371/journal.pcbi.1002195"", ""10.1093/nar/gku1127"", ""10.1038/417017a"", ""10.1186/1471-2105-11-119"", ""10.1038/s41467-018-07641-9"", ""10.1093/nar/gkv1226"", ""10.1073/pnas.0409727102"", ""10.1186/1471-2105-11-538"", ""10.1093/bib/bbr014"", ""10.1038/s41564-017-0012-7"", ""10.1038/nbt.4229"", ""10.1016/j.cell.2019.01.001"", ""10.1093/nar/gky467"", ""10.1038/ncomms3304""]","['Biochemistry, Genetics and Molecular Biology', 'Agricultural and Biological Sciences']","['Food Science', 'Molecular Biology']","[[('0710 生物学', 0.7285), ('0811 控制科学与工程', 0.7264), ('0836 生物工程', 0.7242), ('1001 基础医学', 0.717), ('0832 食品科学与工程', 0.7157)], [('0909 草学', 0.735), ('0905 畜牧学', 0.7348), ('0903 农业资源与环境', 0.7344), ('0828 农业工程', 0.7328), ('0832 食品科学与工程', 0.7301)], [('0832 食品科学与工程', 0.7748), ('0905 畜牧学', 0.7384)], [('0710 生物学', 0.7379), ('1001 基础医学', 0.7336)]]"
10.1093/bioinformatics/btz682,BIOINFORMATICS,0836 Biotechnology and Bioengineering; 0710 Biology; 0812 Computer Science and Technology; 0714 Statistics,BioBERT: a pre-trained biomedical language representation model for biomedical text mining,"Abstract Motivation Biomedical text mining is becoming increasingly important as the number of biomedical documents rapidly grows. With the progress in natural language processing (NLP), extracting valuable information from biomedical literature has gained popularity among researchers, and deep learning has boosted the development of effective biomedical text mining models. However, directly applying the advancements in NLP to biomedical text mining often yields unsatisfactory results due to a word distribution shift from general domain corpora to biomedical corpora. In this article, we investigate how the recently introduced pre-trained language model BERT can be adapted for biomedical corpora. Results We introduce BioBERT (Bidirectional Encoder Representations from Transformers for Biomedical Text Mining), which is a domain-specific language representation model pre-trained on large-scale biomedical corpora. With almost the same architecture across tasks, BioBERT largely outperforms BERT and previous state-of-the-art models in a variety of biomedical text mining tasks when pre-trained on biomedical corpora. While BERT obtains performance comparable to that of previous state-of-the-art models, BioBERT significantly outperforms them on the following three representative biomedical text mining tasks: biomedical named entity recognition (0.62% F1 score improvement), biomedical relation extraction (2.80% F1 score improvement) and biomedical question answering (12.24% MRR improvement). Our analysis results show that pre-training BERT on biomedical corpora helps it to understand complex biomedical texts. Availability and implementation We make the pre-trained weights of BioBERT freely available at https://github.com/naver/biobert-pretrained, and the source code for fine-tuning BioBERT available at https://github.com/dmis-lab/biobert.","[{""name"": ""Jinhyuk Lee"", ""affiliation"": [""Department of Computer Science and Engineering, Korea University , Seoul 02841, Korea""]}, {""name"": ""Wonjin Yoon"", ""affiliation"": [""Department of Computer Science and Engineering, Korea University , Seoul 02841, Korea""]}, {""name"": ""Sungdong Kim"", ""affiliation"": [""Clova AI Research, Naver Corp , Seong-Nam 13561, Korea""]}, {""name"": ""Donghyeon Kim"", ""affiliation"": [""Department of Computer Science and Engineering, Korea University , Seoul 02841, Korea""]}, {""name"": ""Sunkyu Kim"", ""affiliation"": [""Department of Computer Science and Engineering, Korea University , Seoul 02841, Korea""]}, {""name"": ""Chan Ho So"", ""affiliation"": [""Interdisciplinary Graduate Program in Bioinformatics, Korea University , Seoul 02841, Korea""]}, {""name"": ""Jaewoo Kang"", ""affiliation"": [""Department of Computer Science and Engineering, Korea University , Seoul 02841, Korea"", ""Interdisciplinary Graduate Program in Bioinformatics, Korea University , Seoul 02841, Korea""]}]","[""10.18653/v1/W19-1909"", ""10.1371/journal.pone.0200699"", ""10.1186/s12859-015-0472-9"", ""10.1016/j.jbi.2013.12.006"", ""10.1186/1471-2105-11-85"", ""10.1093/bioinformatics/bty449"", ""10.1093/bioinformatics/btx228"", ""10.1186/1758-2946-7-S1-S2"", ""10.1093/database/bay060"", ""10.18653/v1/W19-1908"", ""10.1093/bioinformatics/btx172"", ""10.1093/bioinformatics/btx761"", ""10.1371/journal.pone.0065390"", ""10.3115/v1/D14-1162"", ""10.1186/gb-2008-9-s2-s2"", ""10.1186/s12859-015-0564-6"", ""10.1136/amiajnl-2011-000203"", ""10.1016/j.jbi.2012.04.004"", ""10.1016/j.compbiomed.2019.04.002"", ""10.1186/s12859-019-2813-6""]","['Computer Science', 'Biochemistry, Genetics and Molecular Biology']","['Artificial Intelligence', 'Molecular Biology']","[[('0812 计算机科学与技术', 0.7697), ('0839 网络空间安全', 0.7566), ('0811 控制科学与工程', 0.7551), ('0835 软件工程', 0.7476), ('1405 智能科学与技术', 0.7393)], [('0710 生物学', 0.7285), ('0811 控制科学与工程', 0.7264), ('0836 生物工程', 0.7242), ('1001 基础医学', 0.717), ('0832 食品科学与工程', 0.7157)], [('1405 智能科学与技术', 0.7329), ('0812 计算机科学与技术', 0.7301)], [('0710 生物学', 0.7379), ('1001 基础医学', 0.7336)]]"
