DOI,来源,研究方向,论文标题,CR_摘要,CR_作者和机构,CR_参考文献DOI,OpenAlex_field_list,OpenAlex_subfield_list,OpenAlex_map_subjects
10.1002/ett.4150,TRANSACTIONS ON EMERGING TELECOMMUNICATIONS TECHNOLOGIES,0809 Electronic Science and Technology; 0810 Information and Communication Engineering,Network intrusion detection system: A systematic study of machine learning and deep learning approaches,"AbstractThe rapid advances in the internet and communication fields have resulted in a huge increase in the network size and the corresponding data. As a result, many novel attacks are being generated and have posed challenges for network security to accurately detect intrusions. Furthermore, the presence of the intruders with the aim to launch various attacks within the network cannot be ignored. An intrusion detection system (IDS) is one such tool that prevents the network from possible intrusions by inspecting the network traffic, to ensure its confidentiality, integrity, and availability. Despite enormous efforts by the researchers, IDS still faces challenges in improving detection accuracy while reducing false alarm rates and in detecting novel intrusions. Recently, machine learning (ML) and deep learning (DL)‐based IDS systems are being deployed as potential solutions to detect intrusions across the network in an efficient manner. This article first clarifies the concept of IDS and then provides the taxonomy based on the notable ML and DL techniques adopted in designing network‐based IDS (NIDS) systems. A comprehensive review of the recent NIDS‐based articles is provided by discussing the strengths and limitations of the proposed solutions. Then, recent trends and advancements of ML and DL‐based NIDS are provided in terms of the proposed methodology, evaluation metrics, and dataset selection. Using the shortcomings of the proposed methods, we highlighted various research challenges and provided the future scope for the research in improving ML and DL‐based NIDS.","[{""name"": ""Zeeshan Ahmad"", ""affiliation"": [""Faculty of Computer Science and Information Technology Universiti Malaysia Sarawak Sarawak Malaysia"", ""Department of Electrical Engineering, College of Engineering King Khalid University Abha Kingdom of Saudi Arabia""]}, {""name"": ""Adnan Shahid Khan"", ""affiliation"": [""Faculty of Computer Science and Information Technology Universiti Malaysia Sarawak Sarawak Malaysia""]}, {""name"": ""Cheah Wai Shiang"", ""affiliation"": [""Faculty of Computer Science and Information Technology Universiti Malaysia Sarawak Sarawak Malaysia""]}, {""name"": ""Johari Abdullah"", ""affiliation"": [""Faculty of Computer Science and Information Technology Universiti Malaysia Sarawak Sarawak Malaysia""]}, {""name"": ""Farhan Ahmad"", ""affiliation"": [""Cyber Security Research Group, College of Engineering and Technology University of Derby Derby UK"", ""Institute for Future Transport and Cities Coventry University Coventry UK""]}]","[""10.1007/978-3-319-53396-4_15"", ""10.1007/978-3-319-98842-9_6"", ""10.1016/0167-4048(93)90029-5"", ""10.1016/S1389-1286(98)00017-6"", ""10.1007/978-3-030-31703-4_16"", ""10.1109/ISPASS.2019.00028"", ""10.1186/s40537-014-0007-7"", ""10.1109/ICCSN.2016.7586590"", ""10.1145/2716260"", ""10.1109/COMST.2015.2494502"", ""10.1109/CTIT.2018.8649498"", ""10.3390/app9204396"", ""10.1186/s42400-019-0038-7"", ""10.1016/j.comnet.2019.01.023"", ""10.1016/j.cose.2008.08.003"", ""10.1109/TSE.1987.232894"", ""10.1016/S0140-3664(02)00037-3"", ""10.1023/A:1024600519144"", ""10.1002/dac.3547"", ""10.1109/CEC.2000.870301"", ""10.1002/ett.3893"", ""10.1016/j.neucom.2016.06.021"", ""10.1145/1541880.1541882"", ""10.1109/MCOM.2017.1600514"", ""10.1109/ICCISci.2019.8716450"", ""10.1109/MC.2018.3011034"", ""10.1109/ACCESS.2019.2913340"", ""10.1007/978-3-319-42304-3_9"", ""10.3390/en12214174"", ""10.1109/ICCW.2010.5503946"", ""10.1016/j.simpat.2019.102041"", ""10.1109/NAS.2008.33"", ""10.1007/978-3-642-38631-2_4"", ""10.4304/jnw.6.3.521-532"", ""10.1109/AINA.2017.161"", ""10.1109/JIOT.2020.2967568"", ""10.1109/ACCESS.2019.2940699"", ""10.1109/ISCC.2017.8024697"", ""10.1109/ISCC.2017.8024586"", ""10.1109/NOMS.2008.4575276"", ""10.1089/big.2018.0023"", ""10.1109/ICCISci.2019.8716389"", ""10.1109/ACCESS.2018.2836950"", ""10.1007/978-981-10-7871-2_72"", ""10.1016/j.procs.2016.06.047"", ""10.3390/info9070149"", ""10.1109/UKCI.2013.6651315"", ""10.1016/j.patcog.2018.08.003"", ""10.1109/ACCESS.2020.2973219"", ""10.1613/jair.953"", ""10.1016/j.cor.2004.03.019"", ""10.1002/cpe.4999"", ""10.1109/ACCESS.2018.2858277"", ""10.1109/SSPD.2017.8233268"", ""10.1109/RAIT.2016.7507933"", ""10.1109/ICM.2011.184"", ""10.18201/ijisae.2019252786"", ""10.7551/mitpress/3905.001.0001"", ""10.1109/3ICT.2018.8855772"", ""10.1016/j.neucom.2005.12.126"", ""10.1007/s00521-011-0771-7"", ""10.1007/s00521-013-1398-7"", ""10.1109/ACCESS.2018.2820092"", ""10.5539/cis.v3n1p180"", ""10.1093/comjnl/bxx101"", ""10.1109/ACCESS.2019.2923640"", ""10.1109/ICASSP.2013.6638947"", ""10.1007/978-3-319-66808-6_18"", ""10.1109/ICSMC.2011.6084060"", ""10.1109/TASLP.2014.2383614"", ""10.1016/j.procs.2019.08.055"", ""10.1162/neco.1997.9.8.1735"", ""10.1109/ACCESS.2017.2762418"", ""10.1007/s00521-010-0487-0"", ""10.1109/ACCESS.2018.2867564"", ""10.1109/ACCESS.2018.2863036"", ""10.23919/ICACT.2018.8323688"", ""10.1109/TETCI.2017.2772792"", ""10.1109/ICMLA.2016.0040"", ""10.1109/ACCESS.2018.2869577"", ""10.1109/ACCESS.2019.2893871"", ""10.1145/1273496.1273592"", ""10.1109/MC.2003.1160055"", ""10.1109/ACCESS.2019.2899721"", ""10.1109/ACCESS.2019.2943249"", ""10.1145/1921168.1921179"", ""10.1109/ACCESS.2020.2977007"", ""10.1109/ACCESS.2020.2980937"", ""10.1049/iet-ifs.2018.5258"", ""10.1109/ICASSP.2013.6639346"", ""10.1109/ACCESS.2018.2854599"", ""10.1109/EuroSP.2016.36"", ""10.1109/CVPR.2016.282"", ""10.1109/SP.2017.49"", ""10.1109/ACCESS.2019.2895334"", ""10.1007/978-981-10-8476-8_6"", ""10.1007/978-3-642-35289-8_32"", ""10.1162/neco.2006.18.7.1527"", ""10.1109/ACCESS.2018.2875045"", ""10.1109/ACCESS.2019.2925828"", ""10.1109/72.554195"", ""10.1109/ACCESS.2019.2904620"", ""10.1109/ACCESS.2019.2927465"", ""10.1109/ACCESS.2020.2973730"", ""10.1109/ACCESS.2020.2980136"", ""10.1016/j.ins.2016.01.033"", ""10.1145/1978672.1978676"", ""10.1109/CISDA.2009.5356528"", ""10.1109/MilCIS.2015.7348942"", ""10.5220/0006639801080116"", ""10.1016/j.eswa.2015.07.015"", ""10.1080/19393555.2015.1125974"", ""10.3390/electronics8030322"", ""10.1109/TPWRD.2016.2603339"", ""10.1109/TIFS.2019.2959899"", ""10.1016/j.comnet.2019.107044""]",['Computer Science'],"['Computer Networks and Communications', 'Artificial Intelligence']","[[('0812 计算机科学与技术', 0.7697), ('0839 网络空间安全', 0.7566), ('0811 控制科学与工程', 0.7551), ('0835 软件工程', 0.7476), ('1405 智能科学与技术', 0.7393)], [('0812 计算机科学与技术', 0.7362), ('0839 网络空间安全', 0.7268)], [('1405 智能科学与技术', 0.7329), ('0812 计算机科学与技术', 0.7301)]]"
10.1108/INTR-03-2019-0082,INTERNET RESEARCH,1202 Business Administration; 0810 Information and Communication Engineering; 0812 Computer Science and Technology,Enhancing consumer engagement in e-commerce live streaming via relational bonds,"PurposeEnhancing consumer engagement in e-commerce live streaming is critical for e-commerce operators to build relationships and create consumer loyalty. Using the stimulus–organism–response model and theories from relationship marketing, the authors develop and test an integrative conceptual framework that combines various relational bonds, affective commitment, and consumer engagement.Design/methodology/approachUsing 327 valid responses from consumers of Taobao Live, the authors employed the software Mplus7.0 to evaluate the measurement model and the structural model.FindingsThe results empirically demonstrate that social and structural bonds positively affect consumer engagement directly and indirectly via affective commitment, while financial bonds have only an indirect effect via affective commitment on consumer engagement.Practical implicationsThe findings provide useful insights for e-commerce operators, who should invest in establishing relational bonds and stimulating affective commitment to improve consumer engagement.Originality/valueThis study adds to e-commerce research by being one of the first empirical studies on e-commerce live streaming, extends the marketing literature by integrating different relational bonds as antecedents of consumer engagement from the relational perspective, and enriches the affective commitment literature by distinguishing commitment to the online marketplace from commitment to the broadcaster.","[{""name"": ""Mingyao Hu"", ""affiliation"": []}, {""name"": ""Sohail S. Chaudhry"", ""affiliation"": []}]","[""10.1016/j.jbusres.2014.10.006"", ""10.1177/1094670511411703"", ""10.1016/j.im.2016.06.001"", ""10.1080/02642060902793326"", ""10.1016/j.jbusres.2004.11.005"", ""10.1108/10662240410530835"", ""10.1007/s11747-009-0148-y"", ""10.1016/j.jbusres.2006.02.006"", ""10.1016/S0148-2963(99)00087-9"", ""10.1016/j.jbusres.2006.08.005"", ""10.1080/10696679.2016.1270769"", ""10.2307/30036519"", ""10.1016/j.jretai.2016.12.008"", ""10.1016/j.jretai.2016.12.001"", ""10.1509/jmkg.2005.69.4.210"", ""10.1007/s11747-018-0617-2"", ""10.1007/s11747-016-0509-2"", ""10.1177/109467050141006"", ""10.1007/s11747-016-0494-5"", ""10.1016/j.jretai.2005.01.006"", ""10.1016/j.chb.2017.06.006"", ""10.1108/MSQ-04-2013-0072"", ""10.1007/s11747-018-0615-4"", ""10.1108/IntR-09-2016-0279"", ""10.1016/j.tele.2017.01.004"", ""10.1108/08876040810889120"", ""10.1108/IntR-04-2017-0161"", ""10.1016/j.chb.2016.06.025"", ""10.1016/S0148-2963(97)00062-3"", ""10.1509/jm.15.0430"", ""10.1177/1094670510375602"", ""10.1007/s11747-017-0565-2"", ""10.1177/1094428110391673"", ""10.1080/714005111"", ""10.1287/mksc.19.1.83.15183"", ""10.1016/j.jretai.2012.08.001"", ""10.1177/002224299405800302"", ""10.1057/palgrave.jibs.8490187"", ""10.1108/08876041211223979"", ""10.1016/j.im.2016.03.004"", ""10.1509/jmkg.70.4.136"", ""10.1016/j.ijresmar.2006.12.006"", ""10.1007/s11747-016-0485-6"", ""10.1016/j.jbusres.2007.11.017"", ""10.1016/j.jom.2011.10.004"", ""10.1177/009207039502300407"", ""10.3758/BRM.40.3.879"", ""10.1016/S0022-4359(99)80002-5"", ""10.1108/JRIM-01-2013-0009"", ""10.1016/j.jom.2014.01.002"", ""10.1016/S0167-8116(03)00016-8"", ""10.1002/(SICI)1520-6793(199707)14:4<361::AID-MAR4>3.0.CO;2-7"", ""10.1007/s11747-018-0621-6"", ""10.1080/15252019.2013.826549"", ""10.1108/09590551311306264"", ""10.1177/1094670510375599"", ""10.1007/s11747-015-0429-6"", ""10.2753/MTP1069-6679200201"", ""10.1016/j.im.2016.01.006"", ""10.1016/j.jbusres.2018.08.032"", ""10.1016/j.ijinfomgt.2015.11.002""]","['Business, Management and Accounting', 'Decision Sciences', 'Social Sciences']","['Organizational Behavior and Human Resource Management', 'Information Systems and Management', 'Sociology and Political Science']","[[('1202 工商管理学', 0.7094), ('1201 管理科学与工程', 0.701), ('0714 统计学', 0.6903), ('0202 应用经济学', 0.685), ('0701 数学', 0.6834)], [('1201 管理科学与工程', 0.7645), ('0811 控制科学与工程', 0.7569), ('0714 统计学', 0.7511), ('0711 系统科学', 0.7506), ('0812 计算机科学与技术', 0.7461)], [('0303 社会学', 0.7395), ('0714 统计学', 0.7394), ('0503 新闻传播学', 0.7379), ('0602 中国史', 0.7298), ('0304 民族学', 0.7297)], [('1202 工商管理学', 0.76), ('1201 管理科学与工程', 0.7394)], [('1201 管理科学与工程', 0.7741), ('1205 信息资源管理', 0.7676)], [('0302 政治学', 0.7685), ('0303 社会学', 0.7605)]]"
10.1007/s11277-021-08209-5,WIRELESS PERSONAL COMMUNICATIONS,0810 Information and Communication Engineering,A Review of Indoor Localization Techniques and Wireless Technologies,"AbstractThis paper introduces a review article on indoor localization techniques and technologies. The paper starts with current localization systems and summarizes comparisons between these systems in terms of accuracy, cost, advantages, and disadvantages. Also, the paper presents different detection techniques and compare them in terms of accuracy and cost. Finally, localization methods and algorithms, including angle of arrival (AOA), time of arrival (TOA), and recived signal strength (RSS) are introduced. The study contains concepts, requirements, and specifications for each category of methods presents pros and cons for investigated methods, and conducts comparisons between them.","[{""name"": ""Huthaifa Obeidat"", ""affiliation"": []}, {""name"": ""Wafa Shuaieb"", ""affiliation"": []}, {""name"": ""Omar Obeidat"", ""affiliation"": []}, {""name"": ""Raed Abd-Alhameed"", ""affiliation"": []}]","[""10.1109/ICICSE.2008.24"", ""10.1109/MPRV.2002.1012335"", ""10.1016/j.eswa.2014.07.042"", ""10.3390/fi12020033"", ""10.1109/WAMICON.2006.351900"", ""10.1109/PLANS.2014.6851424"", ""10.1109/ICIEV.2015.7334000"", ""10.1007/978-3-642-04385-7_16"", ""10.1109/ISMA.2015.7373469"", ""10.1145/2594368.2594378"", ""10.1016/j.proeng.2011.08.268"", ""10.3390/s150510074"", ""10.1007/978-3-319-94274-2_13"", ""10.1142/6481"", ""10.3390/s20061578"", ""10.1109/TCE.2011.6131130"", ""10.1109/TII.2016.2579265"", ""10.1109/ACCESS.2017.2726088"", ""10.1109/JSEN.2016.2604424"", ""10.1109/IPIN.2019.8911749"", ""10.1016/B978-0-12-813189-3.00016-2"", ""10.1109/JSAC.2015.2430274"", ""10.1145/2508037.2508054"", ""10.1109/COMST.2016.2637663"", ""10.1109/TIM.2011.2147690"", ""10.3390/s18051598"", ""10.1145/2632048.2632057"", ""10.1109/TMM.2016.2636750"", ""10.1109/SUTC.2008.14"", ""10.1145/2910674.2910718"", ""10.1109/UPINLBS.2016.7809975"", ""10.3390/s17112554"", ""10.1109/IPIN.2015.7346965"", ""10.1109/IPIN.2011.6071920"", ""10.1016/j.dsp.2011.12.001"", ""10.3390/s19102353"", ""10.1016/j.pmcj.2014.09.003"", ""10.1155/2013/185138"", ""10.3390/s17112518"", ""10.1109/WCNC.2018.8377063"", ""10.1364/OE.25.022923"", ""10.1109/COMST.2017.2743228"", ""10.3390/s16060783"", ""10.1145/2639108.2639109"", ""10.1109/ICCIS.2017.8274839"", ""10.1109/MWC.2007.4407221"", ""10.1109/INDIN.2006.275737"", ""10.1016/j.aeue.2014.04.004"", ""10.1109/JSEN.2015.2438193"", ""10.1109/ICEAST50382.2020.9165300"", ""10.1109/ACCESS.2020.3016832"", ""10.1145/938985.938995"", ""10.1109/VETECF.2009.5379094"", ""10.1109/WPNC.2010.5653477"", ""10.1109/LCN.2013.6761255"", ""10.1016/j.procs.2011.07.010"", ""10.1109/CIT.2017.57"", ""10.1109/TMC.2013.58"", ""10.1145/2933232"", ""10.1109/PerCom.2012.6199864"", ""10.1017/S0373463319000742"", ""10.1109/TSMCC.2007.905750"", ""10.1007/11551201_9"", ""10.1016/j.pmcj.2007.07.004"", ""10.1109/IPIN.2016.7743656"", ""10.33012/2018.16073"", ""10.33012/2019.17030"", ""10.1109/ISWCS.2015.7454387"", ""10.1186/s13638-015-0444-9"", ""10.1145/1873951.1874078"", ""10.1007/978-981-15-1842-3_7"", ""10.1002/cpe.3911"", ""10.3390/s150100715"", ""10.1109/ICASSP.2012.6288374"", ""10.1109/ICCNT.2010.33"", ""10.1109/ICWS.2016.31"", ""10.1109/MCOM.2015.7060497"", ""10.1109/IPIN.2016.7743586"", ""10.1109/TIM.2018.2851675"", ""10.1109/JSAC.2015.2430171"", ""10.1109/ICMA.2017.8015931"", ""10.3390/s19153282"", ""10.1109/ISWPC.2010.5483748"", ""10.1109/COMST.2019.2911558"", ""10.3390/s18061875"", ""10.3390/s19112578"", ""10.3390/s16050707"", ""10.3390/electronics8030334"", ""10.1145/3302506.3310389"", ""10.1109/ICUFN.2019.8806041"", ""10.1016/j.eswa.2009.05.062"", ""10.1109/TCE.2008.4560133"", ""10.1145/3263688"", ""10.1016/j.comcom.2012.06.004"", ""10.1109/CC.2015.7114062"", ""10.1109/WIMOB.2007.4390815"", ""10.5120/ijca2018918103"", ""10.1155/2017/2630413"", ""10.1016/j.cosrev.2018.09.001"", ""10.4018/978-1-60566-396-8"", ""10.1007/978-3-642-12654-3_3"", ""10.1145/941350.941354"", ""10.1002/0470092335"", ""10.1109/2.940014"", ""10.1007/978-1-4419-7371-9"", ""10.1109/PerComW.2014.6815247"", ""10.1016/S1389-1286(03)00356-6"", ""10.1016/j.dsp.2012.12.020"", ""10.1109/TCE.2010.5606338"", ""10.1109/ICRoM.2014.6990961"", ""10.1109/TVT.2007.905244"", ""10.3390/jsan3010044"", ""10.1016/j.procs.2012.06.158"", ""10.1109/IWCMC.2013.6583784"", ""10.1109/ISISS.2017.7935650"", ""10.1002/9781118104750"", ""10.1109/MSP.2005.1458287"", ""10.1109/MILCOM.2012.6415851"", ""10.1109/5.622504"", ""10.1109/79.526899"", ""10.2200/S00118ED1V01Y200805ANT008"", ""10.1109/TAP.1986.1143830"", ""10.1109/FGCT.2012.6476563"", ""10.1109/LCOMM.2016.2618789"", ""10.23919/EuRAD.2018.8546582"", ""10.1109/78.97999"", ""10.1109/78.80966"", ""10.1155/2018/7175653"", ""10.1007/978-3-030-22968-9_19"", ""10.1109/ICMCS.2018.8525905"", ""10.1109/78.143441"", ""10.11591/ijece.v9i6.pp4873-4881"", ""10.1145/381677.381693"", ""10.1121/1.1953307"", ""10.1145/2557977.2558011"", ""10.1109/7.993253"", ""10.1109/SURV.2009.090308"", ""10.1109/GLOCOM.2001.965202"", ""10.1109/PIMRC.2007.4393993"", ""10.1109/JPROC.2008.2008846"", ""10.1109/78.622944"", ""10.1109/TWC.2003.819035"", ""10.1109/WCNC.2004.1311594"", ""10.1007/s11277-014-1644-z"", ""10.1109/LSP.2019.2936292"", ""10.1109/PIMRC.2008.4699811"", ""10.1109/TRA.2004.824948"", ""10.1109/FIT.2013.54"", ""10.1109/IDT.2013.6727138"", ""10.1109/TASE.2008.2009126"", ""10.1109/ICC.2004.1313145"", ""10.1109/WCNC.2006.1696648"", ""10.1023/A:1024544032357"", ""10.1145/1435473.1435475"", ""10.1145/345910.345917"", ""10.1145/1029102.1029116"", ""10.1109/ICECCO.2013.6718277"", ""10.1109/WPNC.2013.6533273"", ""10.1109/WICOM.2010.5600847"", ""10.1109/INFCOM.2000.832252"", ""10.1109/JIOT.2015.2495229"", ""10.1109/TMC.2011.216"", ""10.1109/IranianCEE.2017.7985373"", ""10.1109/INFCOMW.2019.8845272"", ""10.1007/s11036-019-01411-7"", ""10.3390/s18092869"", ""10.1109/TSP.2017.2655480"", ""10.1109/SAHCN.2004.1381942"", ""10.1109/SAHCN.2009.5168931"", ""10.1002/9780470443521""]",['Engineering'],"['Aerospace Engineering', 'Electrical and Electronic Engineering', 'Ocean Engineering']","[[('0802 机械工程', 0.7567), ('0811 控制科学与工程', 0.7543), ('0814 土木工程', 0.7511), ('0808 电气工程', 0.7505), ('0807 动力工程及工程热物理', 0.7487)], [('0825 航空宇航科学与技术', 0.7793), ('0811 控制科学与工程', 0.7315)], [('0809 电子科学与技术', 0.7724), ('0808 电气工程', 0.7689)], [('0824 船舶与海洋工程', 0.7602), ('0707 海洋科学', 0.7281)]]"
10.1007/978-3-031-04083-2_2,XXAI - BEYOND EXPLAINABLE AI,0820 Oil and Natural Gas Engineering; 0810 Information and Communication Engineering; 0811 Control Science and Engineering; 1201 Management Science and Engineering; 0814 Civil Engineering; 0401 Education; 0831 Biomedical Engineering; 0301 Law; 0833 Urban and Rural Planning; 0836 Biotechnology and Bioengineering; 1010 Medical Technology; 1205 Library and Information Science & Archive Management; 0703 Chemistry; 1204 Public Administration; 0714 Statistics; 0303 Sociology; 1001 Basic Medicine; 1302 Music and Dance; 0712 History of Science and Technology; 0402 Psychology; 0101 Philosophy; 0812 Computer Science and Technology; 0702 Physics; 0835 Software Engineering; 0701 Mathematics; 0710 Biology,Explainable AI Methods - A Brief Overview,"AbstractExplainable Artificial Intelligence (xAI) is an established field with a vibrant community that has developed a variety of very successful approaches to explain and interpret predictions of complex machine learning models such as deep neural networks. In this article, we briefly introduce a few selected methods and discuss them in a short, clear and concise way. The goal of this article is to give beginners, especially application engineers and data scientists, a quick overview of the state of the art in this current topic. The following 17 methods are covered in this chapter: LIME, Anchors, GraphLIME, LRP, DTD, PDA, TCAV, XGNN, SHAP, ASV, Break-Down, Shapley Flow, Textual Explanations of Visual Models, Integrated Gradients, Causal Models, Meaningful Perturbations, and X-NeSyL.","[{""name"": ""Andreas Holzinger"", ""affiliation"": []}, {""name"": ""Anna Saranti"", ""affiliation"": []}, {""name"": ""Christoph Molnar"", ""affiliation"": []}, {""name"": ""Przemyslaw Biecek"", ""affiliation"": []}, {""name"": ""Wojciech Samek"", ""affiliation"": []}]","[""10.1007/978-3-030-69544-6_7"", ""10.1016/j.inffus.2021.07.015"", ""10.1007/978-3-030-28954-6_11"", ""10.18653/v1/W17-5221"", ""10.1016/j.inffus.2021.11.008"", ""10.1109/ACCESS.2021.3071274"", ""10.1371/journal.pone.0130140"", ""10.1007/978-3-031-04083-2_14"", ""10.1145/3448250"", ""10.1201/9780429027192"", ""10.1007/978-3-319-44781-0_8"", ""10.1007/978-3-030-32251-9_72"", ""10.1016/j.inffus.2021.09.022"", ""10.1109/ICCV.2017.371"", ""10.1007/978-1-4471-0211-3"", ""10.1093/bjps/axi148"", ""10.1007/978-3-319-46493-0_1"", ""10.1007/s10458-019-09421-1"", ""10.1007/s13218-020-00636-z"", ""10.1016/j.inffus.2021.01.008"", ""10.1109/MC.2021.3092610"", ""10.1007/s10489-018-1361-5"", ""10.1109/TKDE.2022.3187455"", ""10.1016/j.patcog.2020.107198"", ""10.1109/IJCNN48605.2020.9206975"", ""10.1007/978-3-031-04083-2_6"", ""10.1007/s11263-016-0981-7"", ""10.1038/s41467-019-08987-4"", ""10.1007/978-3-319-10602-1_48"", ""10.1038/s42256-019-0138-9"", ""10.1609/aaai.v34i03.5631"", ""10.1007/978-3-031-04083-2_16"", ""10.1038/s42256-019-0114-4"", ""10.1007/978-3-030-28954-6_10"", ""10.1007/978-3-031-04083-2_7"", ""10.1016/j.patcog.2016.11.008"", ""10.1016/j.dsp.2017.10.011"", ""10.1109/ICNN.1995.488997"", ""10.1002/rcs.1968"", ""10.1145/3241036"", ""10.1145/2939672.2939778"", ""10.1609/aaai.v32i1.11491"", ""10.1109/TKDE.2007.190734"", ""10.1109/JPROC.2021.3060483"", ""10.1007/978-3-030-29726-8_16"", ""10.1007/978-3-030-57321-8_12"", ""10.1016/j.clsr.2021.105587"", ""10.2307/2331554"", ""10.1016/j.jneumeth.2016.10.008"", ""10.1016/j.inffus.2021.07.008"", ""10.1109/CVPR.2015.7299087"", ""10.1145/3468218.3469046"", ""10.1016/j.patcog.2021.107899"", ""10.1145/3394486.3403085"", ""10.1007/978-3-319-10590-1_53""]",['Computer Science'],"['Computer Vision and Pattern Recognition', 'Artificial Intelligence']","[[('0812 计算机科学与技术', 0.7697), ('0839 网络空间安全', 0.7566), ('0811 控制科学与工程', 0.7551), ('0835 软件工程', 0.7476), ('1405 智能科学与技术', 0.7393)], [('0811 控制科学与工程', 0.7558), ('0812 计算机科学与技术', 0.7479)], [('1405 智能科学与技术', 0.7329), ('0812 计算机科学与技术', 0.7301)]]"
