DOI,来源,研究方向,论文标题,CR_摘要,CR_作者和机构,CR_参考文献DOI,OpenAlex_field_list,OpenAlex_subfield_list,OpenAlex_map_subjects
10.1108/INTR-10-2019-0406,INTERNET RESEARCH,1202 Business Administration; 0810 Information and Communication Engineering; 0812 Computer Science and Technology,YouTube marketing: how marketers' video optimization practices influence video views,"PurposeYouTube's vast and engaged user base makes it central to firms' digital marketing effort. With extant studies focusing on viewers' post-view engagement behavior, however, research into what motivates viewers to click on and watch YouTube videos is scarce. This study investigates the implications of marketers' video optimization practices for video views on YouTube.Design/methodology/approachThe study employed a data set of videos (N = 4,398) gathered by scraping YouTube's trending list. Using a combination of text and sentiment analysis, the study measured four video optimization practices: information content of video titles, emotional intensity of video titles, information content of video descriptions and volume of video tags. It then analyzed the effect of these video optimization practices on video views.FindingsThe study finds that greater availability of information in video titles is negatively associated with video views, whereas intensity of negative emotional sentiment in video titles is positively associated with video views. Further, greater availability of information in video descriptions is positively associated with video views. Finally, an inverted U-shaped relationship is found between volume of video tags and video views. Up to 17 video tags can contribute to more video views; however, beyond 17 tags, the relationship turns negative.Originality/valueThis study investigates the effect of marketers' video optimization practices on video views. While extant studies mainly focus on viewers' post-view engagement behavior, such as liking, commenting on and sharing videos, this study examines video views. Similarly, extant studies investigate videos' internal content, while this study investigates elements of the video metadata.","[{""name"": ""Wondwesen Tafesse"", ""affiliation"": []}]","[""10.1016/j.jbusres.2018.07.017"", ""10.1037/1089-2680.5.4.323"", ""10.1007/s11747-017-0539-4"", ""10.1509/jmr.10.0353"", ""10.1016/j.jbusres.2011.07.029"", ""10.1016/j.procs.2015.08.089"", ""10.1016/j.jbusres.2019.06.045"", ""10.1016/j.intmar.2018.07.002"", ""10.1108/IntR-05-2013-0085"", ""10.1007/s11747-016-0509-2"", ""10.1007/978-3-319-61985-9_14"", ""10.1177/1094670514529187"", ""10.1126/science.aaa8415"", ""10.1108/10662241211250980"", ""10.1080/17512786.2019.1628657"", ""10.1016/j.intmar.2019.02.004.114"", ""10.1016/j.ausmj.2013.07.003"", ""10.1108/IntR-01-2016-0005"", ""10.1007/s11747-016-0485-6"", ""10.1037/0022-3514.61.3.380"", ""10.1016/S0028-3932(02)00147-1"", ""10.1007/s11747-015-0431-z"", ""10.1108/JCM-08-2016-1905"", ""10.1177/0022242919841034"", ""10.1287/mksc.2014.0874"", ""10.1177/1094670510375599"", ""10.1007/s11042-015-3206-0""]","['Business, Management and Accounting', 'Social Sciences']","['Gender Studies', 'Marketing', 'Sociology and Political Science']","[[('1202 工商管理学', 0.7094), ('1201 管理科学与工程', 0.701), ('0714 统计学', 0.6903), ('0202 应用经济学', 0.685), ('0701 数学', 0.6834)], [('0303 社会学', 0.7395), ('0714 统计学', 0.7394), ('0503 新闻传播学', 0.7379), ('0602 中国史', 0.7298), ('0304 民族学', 0.7297)], [('0821 纺织科学与工程', 0.7467), ('0502 外国语言文学', 0.741)], [('0503 新闻传播学', 0.7309), ('1202 工商管理学', 0.7243)], [('0302 政治学', 0.7685), ('0303 社会学', 0.7605)]]"
10.1108/INTR-11-2019-0464,INTERNET RESEARCH,1202 Business Administration; 0810 Information and Communication Engineering; 0812 Computer Science and Technology,Understanding the emergence and development of online travel agencies: a dynamic evaluation and simulation approach,"PurposeWith the explosive growth of the Internet, online travel agents (OTAs) have gained an increasing market share in the online booking market. However, OTAs are facing fierce competition from hotels' direct booking channels, as well as competition among themselves. Therefore, there is a need for an understanding of the evolution of the OTA market from a dynamic perspective. The purpose of this study is to investigate the long-term effect of OTAs on the hospitality industry and to find whether an equilibrium of this effect exists in the context of e-commerce.Design/methodology/approachTo gain a better understanding of the OTA market process, a mathematical framework is constructed on the basis of four assumptions. NetLogo 5.1.0 is used to perform a series of numerical simulations.FindingsThe results indicate the following: (1) the development of the OTA market helps to improve net social welfare, but hotels (especially economy hotels) have suffered as a result; (2) clever exploitation of both online and offline channels that are based on hotels' historical data may improve hotels' performance; (3) a scale-priority strategy can be more helpful than a profit-priority strategy for enabling OTAs to maintain their long-term competitiveness; (4) the timing of participation in online-channel competition is a crucial factor in determining whether OTAs can achieve business success.Social implicationsIn this study, it is shown how consumer habits have changed since the development of OTAs. The online channels provided by OTAs create a convenient, low-cost user experience, and they consequently improve the net welfare of customers. OTAs should be encouraged appropriately, although some economy hotels may suffer from the rise of OTAs.Originality/valueIn this empirical study, a mathematical framework is developed to describe the process of evolution in the OTA market, and it uses simulations as a means to validate prior research findings. Unlike previous studies, a dynamic perspective is used in this investigation to interpret the emergence of OTAs and to analyze their enormous impact on the hospitality industry. Thus, the findings of this study capture the competitive characteristics of online and offline channels in a network context and indicate potential strategies for the development of OTAs and which hotels may use OTAs to achieve better performance. In addition, the study findings could be easily extended to explain many of the classical economic phenomena regarding firms with intangible products.","[{""name"": ""Xingyang Lv"", ""affiliation"": []}, {""name"": ""Nian Li"", ""affiliation"": []}, {""name"": ""Xiaowei Xu"", ""affiliation"": []}, {""name"": ""Yang Yang"", ""affiliation"": []}]","[""10.1016/j.cosrev.2017.03.001"", ""10.1177/002224378802500104"", ""10.1007/s10660-014-9137-4"", ""10.1108/IJCHM-07-2014-0326"", ""10.1016/j.ijhm.2018.02.006"", ""10.1177/1096348015597029"", ""10.1016/j.tourman.2008.01.005"", ""10.1016/S0010-8804(03)90257-6"", ""10.1016/j.jimonfin.2017.11.009"", ""10.1108/IntR-01-2017-0023"", ""10.1016/j.tourman.2018.08.026"", ""10.1016/j.im.2015.05.003"", ""10.1108/IntR-08-2013-0173"", ""10.1177/0010880402433002"", ""10.1108/IMCS-09-2013-0069"", ""10.1257/aer.p20161090"", ""10.1080/19368621003667010"", ""10.1086/260489"", ""10.20867/thm.23.2.3"", ""10.5367/te.2013.0189"", ""10.1108/09596110810873499"", ""10.2307/1909517"", ""10.1016/j.tourman.2018.10.028"", ""10.1057/rpm.2015.44"", ""10.1080/10548408.2015.1075457"", ""10.1007/s10887-006-9009-4"", ""10.1080/10548408.2015.1063897"", ""10.1108/IJCHM-02-2016-0075"", ""10.1108/10662241211235671"", ""10.1300/J073v13n04_07"", ""10.1504/IJTMKT.2017.083370"", ""10.1016/S0167-4870(01)00063-0"", ""10.1016/j.ejor.2015.07.051"", ""10.1177/002224378802500406"", ""10.1016/j.ijhm.2017.09.015"", ""10.1108/IJCHM-11-2013-0498"", ""10.1016/j.tourman.2014.12.012"", ""10.1177/1938965512454218"", ""10.1080/10548408.2012.703034"", ""10.1016/j.tourman.2014.05.003"", ""10.1016/j.ijhm.2015.07.005"", ""10.1177/1354816618768314"", ""10.1080/10941665.2015.1094495"", ""10.1016/j.tourman.2017.05.002"", ""10.1016/j.tourman.2019.104025"", ""10.1016/j.ijhm.2017.09.001"", ""10.1146/annurev-lawsocsci-101317-031201"", ""10.1108/IJCHM-10-2016-0566"", ""10.1177/0047287514559033"", ""10.1016/j.ijhm.2018.08.016"", ""10.1080/13683500.2016.1217831"", ""10.1016/j.ijhm.2018.01.003"", ""10.1016/j.im.2016.12.002"", ""10.1108/10662240110410363"", ""10.1016/j.ijhm.2018.02.002"", ""10.1108/IntR-12-2017-0531"", ""10.1007/978-3-319-14343-9_49"", ""10.1016/j.procs.2016.07.060"", ""10.1016/j.ijhm.2015.09.015"", ""10.1108/IntR-03-2014-0065"", ""10.1016/j.jretconser.2017.12.009"", ""10.1080/10548401003744743"", ""10.1177/1096348015584441"", ""10.1016/j.im.2008.12.001"", ""10.1016/j.dss.2005.05.020"", ""10.1109/IJCSS.2012.70"", ""10.1111/deci.12377"", ""10.1108/IntR-04-2014-0111"", ""10.1108/IntR-10-2013-0212"", ""10.1016/j.tourman.2018.03.016"", ""10.1016/j.jretai.2017.07.001"", ""10.1111/itor.12470""]","['Business, Management and Accounting', 'Social Sciences']","['Marketing', 'Sociology and Political Science']","[[('1202 工商管理学', 0.7094), ('1201 管理科学与工程', 0.701), ('0714 统计学', 0.6903), ('0202 应用经济学', 0.685), ('0701 数学', 0.6834)], [('0303 社会学', 0.7395), ('0714 统计学', 0.7394), ('0503 新闻传播学', 0.7379), ('0602 中国史', 0.7298), ('0304 民族学', 0.7297)], [('0503 新闻传播学', 0.7309), ('1202 工商管理学', 0.7243)], [('0302 政治学', 0.7685), ('0303 社会学', 0.7605)]]"
10.1108/INTR-10-2019-0416,INTERNET RESEARCH,1202 Business Administration; 0810 Information and Communication Engineering; 0812 Computer Science and Technology,Understanding individuals' engagement and continuance intention of MOOCs: the effect of interactivity and the role of gender,"PurposeThis study aims to examine how three perceived interactivity attributes of massive open online courses (MOOCs), namely, perceived active control, perceived synchronicity and perceived two-way communication, impact individuals' engagement and continuance intention of MOOCs through the stimulus-organism-response (S-O-R) lens and how that effect differs between male and female users.Design/methodology/approachDrawing upon S-O-R as an overarching theoretical framework, this study conducted an empirical study in China and collected 294 valid questionnaires from online learners. Structural equation modeling approach was used to examine the proposed research model.FindingsEmpirical results suggest that perceived active control, perceived synchronicity and perceived two-way communication are significant stimuli of individuals' continuance intention of MOOCs, and the influences of perceived active control and perceived synchronicity are partially or fully mediated by engagement on the platform. Multi-group analysis results further indicate that perceived synchronicity has a stronger influence on engagement on the platform for males, while perceived active control and perceived two-way communication are more salient in stimulating engagement on the platform for females.Practical implicationsResearch findings from the present study can serve as the foundation to guide MOOCs’ administrators to respond to the needs of participants through interactivity designed into the platform and shed light on possible key solutions of high dropout rates in MOOCs.Originality/valueThis study uncovers the mediating mechanism of affective engagement between interactivity and continuance intention in the emerging context of the latest online learning platform MOOCs and reveals the behavioral differences between females and males regarding their affective reactions to the three interactivity attributes.","[{""name"": ""Zhen Shao"", ""affiliation"": []}, {""name"": ""Kuanchin Chen"", ""affiliation"": []}]","[""10.1111/j.1468-005X.2004.00139.x"", ""10.1016/j.compedu.2014.08.006"", ""10.2307/3250921"", ""10.5944/openpraxis.9.4.637"", ""10.1016/j.chb.2015.03.013"", ""10.1016/j.ijinfomgt.2015.10.003"", ""10.1057/ejis.2013.31"", ""10.1016/j.im.2004.01.005"", ""10.1016/j.ijinfomgt.2013.08.010"", ""10.1016/j.dss.2016.07.001"", ""10.1287/isre.14.2.189.16018"", ""10.1016/j.im.2018.01.003"", ""10.1145/2436256.2436264"", ""10.2307/249008"", ""10.1080/07421222.2003.11045748"", ""10.25300/MISQ/2018/14146"", ""10.1007/978-1-4614-2018-7_5"", ""10.1037/0022-0663.96.3.403"", ""10.1080/08838159809364462"", ""10.1007/978-981-10-0539-8_51"", ""10.1080/03637750903310360"", ""10.1007/s11747-014-0403-8"", ""10.1016/j.edurev.2014.05.001"", ""10.1080/15252019.2010.10722168"", ""10.1016/j.ijinfomgt.2016.08.005"", ""10.1016/j.ijinfomgt.2016.12.002"", ""10.1207/S15327663JCP1201_05"", ""10.17705/1jais.00218"", ""10.1080/07421222.2016.1172443"", ""10.1016/j.ijinfomgt.2012.07.007"", ""10.1016/j.compedu.2016.03.002"", ""10.1108/10662241211214539"", ""10.1111/j.1467-8535.2011.01261.x"", ""10.1016/j.chb.2018.04.028"", ""10.2307/25148781"", ""10.2501/JAR-43-2-207-216"", ""10.1080/00913367.2002.10673685"", ""10.1016/j.compedu.2010.08.019"", ""10.1016/j.ijinfomgt.2018.08.005"", ""10.2753/MIS0742-1222260107"", ""10.1177/0165551510363631"", ""10.1016/j.chb.2014.08.012"", ""10.1016/j.compedu.2017.08.006"", ""10.2501/S0021849906060466"", ""10.1007/s12525-011-0074-y"", ""10.1080/15252019.2009.10722163"", ""10.1080/00913367.2002.10673674"", ""10.1016/j.compedu.2018.04.012"", ""10.1016/j.jbusres.2009.05.014"", ""10.2307/25148722"", ""10.1002/asi.20801"", ""10.1287/isre.1070.0157"", ""10.2307/25148720"", ""10.3758/BRM.40.3.879"", ""10.2501/S0021849907070158"", ""10.1126/science.1261627"", ""10.1016/j.chb.2007.06.001"", ""10.1016/j.im.2008.10.003"", ""10.1108/IntR-11-2016-0335"", ""10.1016/j.ijinfomgt.2018.10.002"", ""10.1080/0144929X.2012.671851"", ""10.1108/IntR-12-2014-0312"", ""10.2307/20650306"", ""10.1007/s11423-014-9339-4"", ""10.1111/j.1460-2466.1992.tb00812.x"", ""10.1177/0093650214534962"", ""10.1016/j.csda.2004.03.005"", ""10.2307/3250981"", ""10.2307/30036540"", ""10.2307/41410412"", ""10.1089/109493100316012"", ""10.2307/20650284"", ""10.1016/j.chb.2016.10.028"", ""10.1108/IntR-08-2016-0250"", ""10.25300/MISQ/2014/38.2.03"", ""10.1007/s11423-017-9513-6"", ""10.1016/j.im.2015.03.001"", ""10.1016/j.compedu.2016.02.003"", ""10.1016/j.im.2014.07.005"", ""10.1016/j.dss.2012.05.019"", ""10.1016/j.dss.2014.05.004""]","['Social Sciences', 'Decision Sciences', 'Computer Science']","['Computer Science Applications', 'Education', 'Information Systems and Management']","[[('0303 社会学', 0.7395), ('0714 统计学', 0.7394), ('0503 新闻传播学', 0.7379), ('0602 中国史', 0.7298), ('0304 民族学', 0.7297)], [('1201 管理科学与工程', 0.7645), ('0811 控制科学与工程', 0.7569), ('0714 统计学', 0.7511), ('0711 系统科学', 0.7506), ('0812 计算机科学与技术', 0.7461)], [('0812 计算机科学与技术', 0.7697), ('0839 网络空间安全', 0.7566), ('0811 控制科学与工程', 0.7551), ('0835 软件工程', 0.7476), ('1405 智能科学与技术', 0.7393)], [('0812 计算机科学与技术', 0.8068), ('1405 智能科学与技术', 0.7887)], [('0401 教育学', 0.765), ('0705 地理学', 0.7447)], [('1201 管理科学与工程', 0.7741), ('1205 信息资源管理', 0.7676)]]"
10.1007/s12083-021-01076-8,PEER-TO-PEER NETWORKING AND APPLICATIONS,0810 Information and Communication Engineering; 0812 Computer Science and Technology,Privacy-preserving neural networks with Homomorphic encryption: Challenges and opportunities,"AbstractClassical machine learning modeling demands considerable computing power for internal calculations and training with big data in a reasonable amount of time. In recent years, clouds provide services to facilitate this process, but it introduces new security threats of data breaches. Modern encryption techniques ensure security and are considered as the best option to protect stored data and data in transit from an unauthorized third-party. However, a decryption process is necessary when the data must be processed or analyzed, falling into the initial problem of data vulnerability. Fully Homomorphic Encryption (FHE) is considered the holy grail of cryptography. It allows a non-trustworthy third-party resource to process encrypted information without disclosing confidential data. In this paper, we analyze the fundamental concepts of FHE, practical implementations, state-of-the-art approaches, limitations, advantages, disadvantages, potential applications, and development tools focusing on neural networks. In recent years, FHE development demonstrates remarkable progress. However, current literature in the homomorphic neural networks is almost exclusively addressed by practitioners looking for suitable implementations. It still lacks comprehensive and more thorough reviews. We focus on the privacy-preserving homomorphic encryption cryptosystems targeted at neural networks identifying current solutions, open issues, challenges, opportunities, and potential research directions.","[{""name"": ""Bernardo Pulido-Gaytan"", ""affiliation"": []}, {""name"": ""Andrei Tchernykh"", ""affiliation"": []}, {""name"": ""Jorge M. Cortés-Mendoza"", ""affiliation"": []}, {""name"": ""Mikhail Babenko"", ""affiliation"": []}, {""name"": ""Gleb Radchenko"", ""affiliation"": []}, {""name"": ""Arutyun Avetisyan"", ""affiliation"": []}, {""name"": ""Alexander Yu Drozdov"", ""affiliation"": []}]","[""10.1109/FOCS.2011.98"", ""10.1007/978-3-642-20465-4_9"", ""10.1145/359340.359342"", ""10.1109/TIT.1985.1057074"", ""10.1145/800070.802212"", ""10.1145/288090.288106"", ""10.1007/BFb0054135"", ""10.1007/3-540-48910-X_16"", ""10.1007/3-540-44586-2_9"", ""10.1007/s00145-001-0015-6"", ""10.1007/978-3-540-71677-8_21"", ""10.1007/978-3-540-30576-7_18"", ""10.1109/SFCS.1982.38"", ""10.1109/SFFCS.1999.814630"", ""10.1007/978-3-540-70936-7_31"", ""10.1007/978-3-642-13190-5_2"", ""10.1007/978-3-662-53887-6_1"", ""10.1109/FOCS.2011.12"", ""10.1145/2090236.2090262"", ""10.1007/978-3-642-40041-4_5"", ""10.1145/1666420.1666444"", ""10.1007/978-3-642-32009-5_50"", ""10.1007/978-3-662-44774-1_18"", ""10.1007/978-3-662-46447-2_31"", ""10.1007/978-3-662-44371-2_17"", ""10.1007/978-3-319-70694-8_15"", ""10.1145/2046660.2046682"", ""10.1145/3214303"", ""10.1145/3124441"", ""10.5120/15902-5081"", ""10.1109/MSP.2012.2230219"", ""10.1109/MIPRO.2014.6859786"", ""10.1109/SiPS.2014.6986063"", ""10.1109/ACCESS.2017.2775038"", ""10.1109/TC.2015.2500576"", ""10.1109/TETC.2020.3014636"", ""10.1109/TC.2015.2470255"", ""10.1109/TIFS.2017.2787987"", ""10.2478/popets-2019-0035"", ""10.1134/S0361768819080115"", ""10.1016/j.jbi.2014.04.003"", ""10.1007/978-3-319-49151-6_12"", ""10.1145/2857705.2857731"", ""10.1186/s12920-018-0401-7"", ""10.1007/978-3-642-54631-0_18"", ""10.1016/j.compbiomed.2018.11.018"", ""10.4018/IJCAC.2020010105"", ""10.4018/IJCAC.2020010103"", ""10.1109/IPDPSW.2019.00099"", ""10.1109/5326.897072"", ""10.1016/j.jocs.2016.11.011"", ""10.1109/ACCESS.2020.3032655"", ""10.1038/nature06862"", ""10.1007/978-3-642-45239-0_4"", ""10.1145/2810103.2813687"", ""10.1007/978-3-030-49785-9_16"", ""10.1007/978-3-319-96878-0_17"", ""10.2307/3029750"", ""10.1145/3338469.3358944"", ""10.1109/TETC.2019.2902799"", ""10.1007/978-3-030-12612-4_5"", ""10.1007/978-3-319-69453-5_23"", ""10.1007/978-3-030-40921-0_15"", ""10.1007/978-3-030-64834-3_8"", ""10.1007/978-1-4612-5242-9"", ""10.1007/978-3-319-70278-0_1"", ""10.1007/978-3-319-29172-7_11"", ""10.1145/3310273.3323047"", ""10.1145/2647868.2654889"", ""10.1109/ACCESS.2017.2737544"", ""10.1007/978-3-030-20951-3_20"", ""10.21105/joss.00602"", ""10.3390/computers8010003"", ""10.1007/978-1-4842-2845-6"", ""10.1145/2939672.2945397"", ""10.1109/IROS40897.2019.8968515"", ""10.1504/IJHPCN.2019.099744"", ""10.1007/978-3-030-64616-5_51""]",['Computer Science'],"['Artificial Intelligence', 'Information Systems']","[[('0812 计算机科学与技术', 0.7697), ('0839 网络空间安全', 0.7566), ('0811 控制科学与工程', 0.7551), ('0835 软件工程', 0.7476), ('1405 智能科学与技术', 0.7393)], [('1405 智能科学与技术', 0.7329), ('0812 计算机科学与技术', 0.7301)], [('0839 网络空间安全', 0.7454), ('0812 计算机科学与技术', 0.7417)]]"
10.1002/ett.3978,TRANSACTIONS ON EMERGING TELECOMMUNICATIONS TECHNOLOGIES,0809 Electronic Science and Technology; 0810 Information and Communication Engineering,Precision agriculture and farming using Internet of Things based on wireless sensor network,"AbstractIn the recent past, the agriculture and farming industry has become the precision network connectivity of sensors with a new dimension of Internet of Things (IoT) technology. The cloud computing and wireless sensor network‐ (WSN) based extensive distance network in IoT can be applied to the agriculture and farming industry in a remote area. In this paper, we propose scalable wireless sensor network architecture for monitoring and control using IoT for agriculture and farming in a remote area. One of the significant managements in precision agriculture and farming (PAF) is water resource irrigation and proper utilization of water resources. Appropriate utilization of water irrigation management can be achieved by applying WSN technology using IoT. The efficient communication of various wireless sensors is processed using IoT in PAF to improve the productivity of farmers. We have analyzed the WSN structure based on throughput maximization, latency minimization, high signal‐to‐noise ratio (SNR), minimum mean square error, and improved coverage area. The experimental results have proved that the proposed methodology provides better performance than conventional IoT‐based agriculture and farming.","[{""name"": ""P. Sanjeevi"", ""affiliation"": [""Key Laboratory of Advanced Process Control for Light Industry, Ministry of Education Jiangnan University  Wuxi China""]}, {""name"": ""S. Prasanna"", ""affiliation"": [""School of Information Technology &amp; Engineering VIT  Vellore India""]}, {""name"": ""B. Siva Kumar"", ""affiliation"": [""Department of Computer Science and Engineering SRM Institute of Science and Technology  Chennai India""]}, {""name"": ""G. Gunasekaran"", ""affiliation"": [""School of Information Technology &amp; Engineering VIT  Vellore India""]}, {""name"": ""I. Alagiri"", ""affiliation"": [""School of Information Technology &amp; Engineering VIT  Vellore India""]}, {""name"": ""R. Vijay Anand"", ""affiliation"": [""School of Information Technology &amp; Engineering VIT  Vellore India""]}]","[""10.1109/ACCESS.2019.2932609"", ""10.1007/s11119-018-09624-8"", ""10.1109/ICIRCA.2018.8597264"", ""10.1016/j.ifacol.2018.08.176"", ""10.1016/j.procs.2016.02.094"", ""10.1007/s13369-018-3449-y"", ""10.1007/978-3-642-36137-1_33"", ""10.1016/j.procs.2018.04.106"", ""10.1007/s00607-017-0559-4"", ""10.1504/IJIPT.2017.085190"", ""10.1504/IJIPT.2016.081321"", ""10.1109/CoCoNet.2015.7411304"", ""10.1109/INVENTIVE.2016.7823195"", ""10.1109/INVENTIVE.2016.7823205"", ""10.1007/978-981-13-0514-6_25"", ""10.1016/j.procs.2018.10.159"", ""10.1007/s11042-019-7367-0"", ""10.1007/978-981-13-0212-1_11"", ""10.1109/TIM.2013.2276487"", ""10.1007/s11761-017-0218-9"", ""10.1007/s00271-019-00658-y"", ""10.1109/MCE.2017.2684960""]","['Agricultural and Biological Sciences', 'Engineering', 'Environmental Science']","['Electrical and Electronic Engineering', 'Water Science and Technology', 'Plant Science']","[[('0909 草学', 0.735), ('0905 畜牧学', 0.7348), ('0903 农业资源与环境', 0.7344), ('0828 农业工程', 0.7328), ('0832 食品科学与工程', 0.7301)], [('0802 机械工程', 0.7567), ('0811 控制科学与工程', 0.7543), ('0814 土木工程', 0.7511), ('0808 电气工程', 0.7505), ('0807 动力工程及工程热物理', 0.7487)], [('0830 环境科学与工程', 0.8035), ('0807 动力工程及工程热物理', 0.7866), ('0713 生态学', 0.77), ('0903 农业资源与环境', 0.7684), ('0907 林学', 0.7684)], [('0809 电子科学与技术', 0.7724), ('0808 电气工程', 0.7689)], [('0815 水利工程', 0.7539), ('0908 水产', 0.7497)], [('0903 农业资源与环境', 0.7532), ('0902 园艺学', 0.7513)]]"
