DOI,来源,研究方向,论文标题,CR_摘要,CR_作者和机构,CR_参考文献DOI,OpenAlex_field_list,OpenAlex_subfield_list,OpenAlex_map_subjects
10.1007/s12083-021-01245-9,PEER-TO-PEER NETWORKING AND APPLICATIONS,0810 Information and Communication Engineering; 0812 Computer Science and Technology,Joint computation offloading and deployment optimization in multi-UAV-enabled MEC systems,"AbstractThe combination of unmanned aerial vehicles (UAVs) and mobile edge computing (MEC) technology breaks through the limitations of traditional terrestrial communications. The effective line-of-sight channel provided by UAVs can greatly improve the communication quality between edge servers and mobile devices (MDs). To further enhance the Quality-of-Service (QoS) of MEC systems, a multi-UAV-enabled MEC system model is designed. In the proposed model, UAVs are regarded as edge servers to offer computing services for MDs, aiming to minimize the average task response time by jointly optimizing UAV deployment and computation offloading. Based on the problem definition, a two-layer joint optimization method (PSO-GA-G) is proposed. First, the outer layer utilizes a Particle Swarm Optimization algorithm combined with Genetic Algorithm operators (PSO-GA) to optimize UAV deployment. Next, the inner layer adopts a greedy algorithm to optimize computation offloading. The extensive simulation experiments verify the feasibility and effectiveness of the proposed PSO-GA-G. The results show that the PSO-GA-G can achieve a lower average task response time than the other three baselines.","[{""name"": ""Zheyi Chen"", ""affiliation"": []}, {""name"": ""Hongqiang Zheng"", ""affiliation"": []}, {""name"": ""Jianshan Zhang"", ""affiliation"": []}, {""name"": ""Xianghan Zheng"", ""affiliation"": []}, {""name"": ""Chunming Rong"", ""affiliation"": []}]","[""10.1109/JIOT.2019.2948888"", ""10.1145/3093899"", ""10.1109/COMST.2017.2745201"", ""10.1109/TPDS.2019.2953745"", ""10.1109/TVT.2020.2971520"", ""10.1109/TCOMM.2020.2973264"", ""10.1109/LCOMM.2019.2906194"", ""10.1109/MWC.001.1900072"", ""10.1109/TWC.2018.2821664"", ""10.1109/JIOT.2018.2868616"", ""10.1007/s11432-018-9749-8"", ""10.1109/TVT.2020.2978027"", ""10.1109/TWC.2018.2845360"", ""10.1109/TMC.2018.2831230"", ""10.1109/INFOCOM.2017.8057150"", ""10.1109/JSAC.2018.2864426"", ""10.1109/WCSP49889.2020.9299801"", ""10.1109/JIOT.2020.2999063"", ""10.1109/ICOIN48656.2020.9016432"", ""10.1109/IWCMC.2019.8766458"", ""10.1109/JIOT.2021.3063188"", ""10.1109/WCSP49889.2020.9299672"", ""10.1109/JIOT.2020.2971645"", ""10.1109/TETCI.2019.2939373"", ""10.1109/TVT.2020.2975031"", ""10.1109/TWC.2019.2926279"", ""10.1109/TII.2020.3024170"", ""10.1109/JSAC.2020.3036962"", ""10.1109/JIOT.2020.3005117"", ""10.1109/JIOT.2020.2980035"", ""10.1109/TWC.2018.2838134"", ""10.1109/ICTC49638.2020.9123274""]","['Engineering', 'Computer Science']","['Aerospace Engineering', 'Computer Networks and Communications', 'Computer Vision and Pattern Recognition']","[[('0802 机械工程', 0.7567), ('0811 控制科学与工程', 0.7543), ('0814 土木工程', 0.7511), ('0808 电气工程', 0.7505), ('0807 动力工程及工程热物理', 0.7487)], [('0812 计算机科学与技术', 0.7697), ('0839 网络空间安全', 0.7566), ('0811 控制科学与工程', 0.7551), ('0835 软件工程', 0.7476), ('1405 智能科学与技术', 0.7393)], [('0825 航空宇航科学与技术', 0.7793), ('0811 控制科学与工程', 0.7315)], [('0812 计算机科学与技术', 0.7362), ('0839 网络空间安全', 0.7268)], [('0811 控制科学与工程', 0.7558), ('0812 计算机科学与技术', 0.7479)]]"
10.1002/ett.3647,TRANSACTIONS ON EMERGING TELECOMMUNICATIONS TECHNOLOGIES,0809 Electronic Science and Technology; 0810 Information and Communication Engineering,Clustering-based real-time anomaly detection-A breakthrough in big data technologies,"AbstractOff late, the ever increasing usage of a connected Internet‐of‐Things devices has consequently augmented the volume of real‐time network data with high velocity. At the same time, threats on networks become inevitable; hence, identifying anomalies in real time network data has become crucial. To date, most of the existing anomaly detection approaches focus mainly on machine learning techniques for batch processing. Meanwhile, detection approaches which focus on the real‐time analytics somehow deficient in its detection accuracy while consuming higher memory and longer execution time. As such, this paper proposes a novel framework which focuses on real‐time anomaly detection based on big data technologies. In addition, this paper has also developed streaming sliding window local outlier factor coreset clustering algorithms (SSWLOFCC), which was then implemented into the framework. The proposed framework that comprises BroIDS, Flume, Kafka, Spark streaming, SparkMLlib, Matplot and HBase was evaluated to substantiate its efficacy, particularly in terms of accuracy, memory consumption, and execution time. The evaluation is done by performing critical comparative analysis using existing approaches, such as K‐means, hierarchical density‐based spatial clustering of applications with noise (HDBSCAN), isolation forest, spectral clustering and agglomerative clustering. Moreover, Adjusted Rand Index and memory profiler package were used for the evaluation of the proposed framework against the existing approaches. The outcome of the evaluation has substantially proven the efficacy of the proposed framework with a much higher accuracy rate of 96.51% when compared to other algorithms. Besides, the proposed framework also outperformed the existing algorithms in terms of lesser memory consumption and execution time. Ultimately the proposed solution enable analysts to precisely track and detect anomalies in real time.","[{""name"": ""Riyaz Ahamed Ariyaluran Habeeb"", ""affiliation"": [""Department of Information System, Faculty of Computer Science and Information Technology University of Malaya  Kuala Lumpur Malaysia""]}, {""name"": ""Fariza Nasaruddin"", ""affiliation"": [""Department of Information System, Faculty of Computer Science and Information Technology University of Malaya  Kuala Lumpur Malaysia""]}, {""name"": ""Abdullah Gani"", ""affiliation"": [""Department of Computer System &amp; Technology Faculty of Computer Science and Information Technology University of Malaya  Kuala Lumpur Malaysia""]}, {""name"": ""Mohamed Ahzam Amanullah"", ""affiliation"": [""Research &amp; Innovation Development Telekom Research &amp; Development Sdn Bhd  Cyberjaya Malaysia""]}, {""name"": ""Ibrahim Abaker Targio Hashem"", ""affiliation"": [""School of Computing &amp; Information Technology Taylor's University  Subang Jaya Malaysia""]}, {""name"": ""Ejaz Ahmed"", ""affiliation"": [""Centre for Mobile Cloud Computing Research (C4MCCR) University of Malaya  Malaysia""]}, {""name"": ""Muhammad Imran"", ""affiliation"": [""College of Applied Computer Science King Saud University  Riyadh Saudi Arabia""]}]","[""10.1109/CICYBS.2014.7013369"", ""10.1007/s11227-015-1615-5"", ""10.1002/spe.2390"", ""10.1109/ACCESS.2016.2575038"", ""10.1109/MCOM.2019.1800624"", ""10.1016/j.cose.2018.02.015"", ""10.1155/2016/1467051"", ""10.1016/j.ijinfomgt.2018.08.006"", ""10.1016/j.ijinfomgt.2017.07.008"", ""10.1109/ACCESS.2018.2874592"", ""10.1109/ACCESS.2018.2799210"", ""10.1109/DRCN.2015.7149025"", ""10.1016/j.procs.2016.04.254"", ""10.1016/j.compeleceng.2018.05.023"", ""10.1016/j.comnet.2015.07.019"", ""10.1109/IRI.2014.7051925"", ""10.1109/MECO.2017.7977130"", ""10.1109/BigData.2016.7840777"", ""10.1016/j.adhoc.2019.02.001"", ""10.1016/j.neucom.2017.04.070"", ""10.1109/LSENS.2017.2752719"", ""10.1109/ICC.2018.8422401"", ""10.1016/j.eswa.2012.07.021"", ""10.1109/TPAMI.2010.88"", ""10.1016/j.eswa.2016.09.041"", ""10.1109/ICC.2017.7997099"", ""10.1016/j.jfds.2016.03.001"", ""10.1016/j.dss.2018.04.001"", ""10.1016/j.engappai.2017.09.021"", ""10.3182/20130902-3-CN-3020.00044"", ""10.1177/1550147719825820"", ""10.1109/BigData.2015.7363865"", ""10.1109/IMIS.2016.50"", ""10.1016/j.ins.2014.03.066"", ""10.1016/j.jss.2018.05.016"", ""10.1109/TKDE.2009.187"", ""10.1109/DASC.2014.79"", ""10.1016/j.future.2017.04.017"", ""10.1016/j.cose.2016.01.006"", ""10.1016/j.comnet.2003.12.016"", ""10.1109/TBDATA.2016.2622288"", ""10.1007/s11390-014-1416-y"", ""10.1109/BigData.2015.7364101"", ""10.1145/2628194.2628251""]",['Computer Science'],"['Artificial Intelligence', 'Computer Networks and Communications']","[[('0812 计算机科学与技术', 0.7697), ('0839 网络空间安全', 0.7566), ('0811 控制科学与工程', 0.7551), ('0835 软件工程', 0.7476), ('1405 智能科学与技术', 0.7393)], [('1405 智能科学与技术', 0.7329), ('0812 计算机科学与技术', 0.7301)], [('0812 计算机科学与技术', 0.7362), ('0839 网络空间安全', 0.7268)]]"
10.1049/iet-rsn.2019.0493,IET RADAR SONAR AND NAVIGATION,0809 Electronic Science and Technology; 0810 Information and Communication Engineering,Classification of drones and birds using convolutional neural networks applied to radar micro-Doppler spectrogram images,"This study presents a convolutional neural network‐based drone classification method. The primary criterion for a high‐fidelity neural network‐based classification is a real dataset of large size and diversity for training. The first goal of the study was to create a large database of micro‐Doppler spectrogram images of in‐flight drones and birds. Two separate datasets with the same images have been created, one with RGB images and others with greyscale images. The RGB dataset was used for GoogLeNet architecture‐based training. The greyscale dataset was used for training with a series of architecture developed during this study. Each dataset was further divided into two categories, one with four classes (drone, bird, clutter and noise) and the other with two classes (drone and non‐drone). During training, 20% of the dataset has been used as a validation set. After the completion of training, the models were tested with previously unseen and unlabelled sets of data. The validation and testing accuracy for the developed series network have been found to be 99.6 and 94.4%, respectively, for four classes and 99.3 and 98.3%, respectively, for two classes. The GoogLenet based model showed both validation and testing accuracies to be around 99% for all the cases.","[{""name"": ""Samiur Rahman"", ""affiliation"": [""SUPA School of Physics and Astronomy University of St Andrews North Haugh KY16 9SS St Andrews Scotland""]}, {""name"": ""Duncan A. Robertson"", ""affiliation"": [""SUPA School of Physics and Astronomy University of St Andrews North Haugh KY16 9SS St Andrews Scotland""]}]","[""10.1109/MCOM.2018.1700455"", ""10.1049/iet-rsn.2018.0020"", ""10.1017/S1759078714000282"", ""10.1049/el.2015.3038"", ""10.1109/LGRS.2015.2491329"", ""10.1049/iet-rsn.2018.0103"", ""10.1007/s12530-017-9208-6"", ""10.1109/LGRS.2018.2806940"", ""10.1109/LGRS.2016.2624820"", ""10.1109/CVPR.2015.7298594"", ""10.1109/LGRS.2017.2771405"", ""10.1080/00401706.1970.10488634"", ""10.1109/CVPR.2016.90"", ""10.1038/s41598-018-35880-9""]",['Engineering'],['Aerospace Engineering'],"[[('0802 机械工程', 0.7567), ('0811 控制科学与工程', 0.7543), ('0814 土木工程', 0.7511), ('0808 电气工程', 0.7505), ('0807 动力工程及工程热物理', 0.7487)], [('0825 航空宇航科学与技术', 0.7793), ('0811 控制科学与工程', 0.7315)]]"
10.1088/1757-899X/863/1/012003,SYMPOSIUM ON ENERGY SYSTEMS 2019 (SES 2019),0818 Geological Resources and Geological Engineering; 0832 Food Science and Engineering; 0819 Mining Engineering; 0828 Agricultural Engineering; 1007 Pharmaceutical Science; 0817 Chemical Engineering and Technology; 0801 Mechanics; 1400 Cross-field; 0807 Power Engineering and Engineering Thermophysics; 0827 Nuclear Science and Technology; 0601 Archaeology; 0822 Light Industry Technology and Engineering; 0824 Naval Architecture and Ocean Engineering; 0806 Metallurgical Engineering; 0403 Physical Education and Sport Science; 0830 Environmental Science and Engineering; 0821 Textile Science and Engineering; 0820 Oil and Natural Gas Engineering; 0814 Civil Engineering; 0805 Materials Science and Engineering; 0825 Aerospace Science and Technology; 0703 Chemistry; 0836 Biotechnology and Bioengineering; 0813 Architecture; 0833 Urban and Rural Planning; 1201 Management Science and Engineering; 0401 Education; 1202 Business Administration; 0823 Transportation Engineering; 0804 Instrumentation Science and Technology; 0802 Mechanical Engineering; 0831 Biomedical Engineering; 0810 Information and Communication Engineering; 0811 Control Science and Engineering; 0812 Computer Science and Technology; 0702 Physics; 0701 Mathematics; 0816 Surveying and Mapping; 0835 Software Engineering,A review of ultra-high temperature materials for thermal protection system,"Abstract Ultra-High Temperature Materials (UHTMs) are at the base of entire aerospace industry; these high stable materials at temperatures exceeding 1600 °C are used to manage the heat shielding to protect vehicles and probes during the hypersonic flight through reentry trajectory against aerodynamic heating and reducing plasma surface interaction. Those materials are also recognized as Thermal Protection System Materials (TPSMs). The structural materials used during the high-temperature oxidizing environment are mainly limited to SiC, oxide ceramics, and composites. In addition to that, silicon-based ceramic has a maximum-use at 1700 °C approximately; as it is an active oxidation process over low temperature and water vapor environment condition. However, a great emphasis is required for developing structural materials in oxidation and rapid heating environment where the temperature is greater than 1700 °C. This review covers briefly all main types of Thermal Protection Systems (TPSs) and all the materials are used to fabricate them with the maximum operational temperatures. Also, it covers the promised UHTMs (SiC, ZrB2, HfB2, SiB6 and B4C) which are currently using for several aerospace applications, especially for TPS. Besides, it discusses the oxidation of SiC, B4C, SiB6, ZrB2 and HfB2. Therefore, the carbides and borides of the transition metals, Zr and Hf have a high-melting temperature and good stability in forming high-melting temperature oxides.","[{""name"": ""H K M Al-Jothery"", ""affiliation"": []}, {""name"": ""T M B Albarody"", ""affiliation"": []}, {""name"": ""P S M Yusoff"", ""affiliation"": []}, {""name"": ""M A Abdullah"", ""affiliation"": []}, {""name"": ""A R Hussein"", ""affiliation"": []}]","[""10.1016/j.actaastro.2004.05.034"", ""10.1016/j.pmatsci.2016.08.003"", ""10.1134/S0036023613140039"", ""10.1007/s10697-005-0106-4"", ""10.1016/S0921-5093(02)00520-8"", ""10.1016/S0955-2219(02)00140-1"", ""10.1063/1.5075607"", ""10.1016/S0094-5765(01)00150-3"", ""10.1016/j.actaastro.2009.01.035"", ""10.1016/j.apsusc.2004.09.106"", ""10.1111/j.1551-2916.2004.01170.x"", ""10.1016/j.jallcom.2015.10.003"", ""10.1016/j.compositesa.2017.07.012"", ""10.1016/j.corsci.2016.02.015"", ""10.1016/j.corsci.2015.08.015"", ""10.1016/j.corsci.2016.05.013"", ""10.1016/j.apsusc.2015.03.003"", ""10.1016/j.compscitech.2007.08.017"", ""10.1016/j.jeurceramsoc.2012.08.018"", ""10.2320/matertrans.44.401"", ""10.1016/S0920-3796(99)00007-1"", ""10.1016/0955-2219(90)90048-K"", ""10.1111/j.1151-2916.2000.tb01647.x"", ""10.1007/s11661-999-0230-6"", ""10.1016/S0955-2219(98)00071-5"", ""10.1006/jssc.1997.7316"", ""10.1007/BF00240800"", ""10.1111/j.1151-2916.2002.tb00260.x"", ""10.1111/j.1151-2916.2001.tb00714.x"", ""10.1063/1.347524"", ""10.1111/j.1151-2916.2003.tb03498.x"", ""10.1016/j.jeurceramsoc.2010.02.025"", ""10.2497/jjspm.41.1299"", ""10.1016/S0025-5408(01)00560-8"", ""10.1016/S0955-2219(99)00129-6"", ""10.1016/j.jeurceramsoc.2010.01.026"", ""10.1111/j.1551-2916.2007.01583.x"", ""10.1111/j.1551-2916.2006.01329.x"", ""10.1111/j.1551-2916.2005.00599.x""]","['Materials Science', 'Engineering']","['Mechanical Engineering', 'Ceramics and Composites', 'Materials Chemistry']","[[('0805 材料科学与工程', 0.7628), ('0822 轻工技术与工程', 0.7623), ('0821 纺织科学与工程', 0.7557), ('0806 冶金工程', 0.7549), ('0819 矿业工程', 0.7522)], [('0802 机械工程', 0.7567), ('0811 控制科学与工程', 0.7543), ('0814 土木工程', 0.7511), ('0808 电气工程', 0.7505), ('0807 动力工程及工程热物理', 0.7487)], [('0802 机械工程', 0.7803), ('0807 动力工程及工程热物理', 0.7598)], [('0806 冶金工程', 0.701), ('0805 材料科学与工程', 0.6991)], [('0805 材料科学与工程', 0.7539), ('0822 轻工技术与工程', 0.7516)]]"
10.1002/ett.3956,TRANSACTIONS ON EMERGING TELECOMMUNICATIONS TECHNOLOGIES,0809 Electronic Science and Technology; 0810 Information and Communication Engineering,Trust data collections via vehicles joint with unmanned aerial vehicles in the smart Internet of Things,"AbstractDue to their mobile character, ground vehicles and unmanned aerial vehicles (UAVs) are currently being considered as sensing devices that can collect data in the Internet of Things (IoT). Building and enhancing trust and security environments in data collection processes are fundamental and essential requirements. Here, we proposed a novel scheme named “Trust Data Collections via Vehicles joint with UAVs in the Smart Internet of Things” (T‐SIoTs scheme), which targets to establish a trust‐based environment for data collections by utilizing both trust vehicles and UAVs. First, to optimize security aspect, data center (DC) selected trust‐based vehicles as mobile data collectors via analyzing and digging historical datasets. To promise coverage regions of data collections, several static stations are established, which can be utilized as static data collectors. Second, UAVs are arranged by the DC to collect data stored by both trust‐based vehicles and static data collectors. In the T‐SIoTs scheme, trajectories of UAVs are designed according to shortest‐distance‐first routing scheme. Comprehensive theoretical analyses and experiments have been provided to evaluate and support the T‐SIoTs scheme. Compared with the previous studies, the T‐SIoTs scheme can improve the security ratio by 46.133% to 54.60% approximately. And with the routing scheme, the energy consumptions of UAVs can be reduced by 46.93% approximately.","[{""name"": ""Ting Li"", ""affiliation"": [""School of Computer Science and Engineering Central South University  Changsha China""]}, {""name"": ""Wei Liu"", ""affiliation"": [""School of Informatics Hunan University of Chinese Medicine  Changsha China""]}, {""name"": ""Tian Wang"", ""affiliation"": [""College of Computer Science and Technology Huaqiao University  Xiamen China""]}, {""name"": ""Zhao Ming"", ""affiliation"": [""School of Computer Science and Engineering Central South University  Changsha China""]}, {""name"": ""Xiong Li"", ""affiliation"": [""School of Computer Science and Engineering Hunan University of Science and Technology  Xiangtan China""]}, {""name"": ""Ming Ma"", ""affiliation"": [""Department of Computer Science Stony Brook University  Stony Brook New York USA""]}]","[""10.1016/j.future.2019.04.043"", ""10.1109/TII.2019.2940745"", ""10.1016/j.future.2017.08.035"", ""10.1155/2019/5298508"", ""10.1109/TII.2019.2931394"", ""10.1109/ACCESS.2019"", ""10.1109/TNET.2018.2819507"", ""10.1109/JIOT.2018.2847243"", ""10.1109/ACCESS.2019.2894172"", ""10.1109/JIOT.2019.2894257"", ""10.1109/TSMC.2019.2938790"", ""10.1109/JSEN.2019.2919508"", ""10.1016/j.comcom.2019.12.054"", ""10.1016/j.ins.2019.05.054"", ""10.1109/TII.2019.2921516"", ""10.1145/3318460"", ""10.1016/j.jpdc.2019.08.012"", ""10.1016/j.future.2018.06.004"", ""10.1016/j.future.2019.02.060"", ""10.1109/TII.2019.2962844"", ""10.1109/JIOT.2019.2952767"", ""10.1002/cpe.5109"", ""10.1016/j.comcom.2020.01.034"", ""10.1016/j.inffus.2019.06.020"", ""10.1007/s12083‐019‐00752‐0"", ""10.1016/j.jnca.2019.01.022"", ""10.1155/2020/7230565"", ""10.1186/s13638-019-1566-2"", ""10.1109/TII.2019.2955152"", ""10.1109/COMST.2017.2762345"", ""10.1109/TMC.2017.2775230"", ""10.1002/ett.3871"", ""10.1109/TC.2016.2536019"", ""10.1109/JIOT.2019.2951857"", ""10.1109/TSMC.2019.2898982"", ""10.1016/j.jpdc.2019.06.012"", ""10.1109/TWC.2015.2418316"", ""10.1016/j.future.2018.04.085"", ""10.1109/ICC.2016.7511133"", ""10.1109/TITS.2017.2657649"", ""10.1109/TMC.2018.2830359"", ""10.1109/TVT.2018.2809039"", ""10.3390/s18092913"", ""10.1109/JSEN.2017.2716380"", ""10.1109/TWC.2017.2688328""]","['Engineering', 'Computer Science']","['Aerospace Engineering', 'Electrical and Electronic Engineering', 'Artificial Intelligence']","[[('0802 机械工程', 0.7567), ('0811 控制科学与工程', 0.7543), ('0814 土木工程', 0.7511), ('0808 电气工程', 0.7505), ('0807 动力工程及工程热物理', 0.7487)], [('0812 计算机科学与技术', 0.7697), ('0839 网络空间安全', 0.7566), ('0811 控制科学与工程', 0.7551), ('0835 软件工程', 0.7476), ('1405 智能科学与技术', 0.7393)], [('0825 航空宇航科学与技术', 0.7793), ('0811 控制科学与工程', 0.7315)], [('0809 电子科学与技术', 0.7724), ('0808 电气工程', 0.7689)], [('1405 智能科学与技术', 0.7329), ('0812 计算机科学与技术', 0.7301)]]"
10.1002/dac.3953,INTERNATIONAL JOURNAL OF COMMUNICATION SYSTEMS,0810 Information and Communication Engineering,An enhanced whale optimization algorithm for vehicular communication networks,"SummaryIn the field of vehicle communication networks, vehicular ad hoc network (VANET) is established with the help of road side unit (RSU). Each vehicle in the traffic system is managed by RSU with certain mobility factor, but still, there are some issues in the mobility management. In order to avoid such expensive RSUs and to enhance the mobility management of VANET system, the paper proposes a novel algorithm for the process of organizing a cluster structure and cluster head (CH) election suitable for VANETs. The proposed adaptive weighted clustering protocol (AWCP) groups the random nodes, and then the optimal CH is attained by the optimization of network parameters. For the purpose of optimization, an innovative algorithm called the enhanced whale optimization algorithm (EWOA) is introduced. For each vehicle in a trusted clustering model, its movement is analyzed by vehicle network mobility routing protocol with identified speed and position. The distance between the trusted vehicle node and RSU is analyzed by the proposed AWCP‐EWOA model. The results demonstrate the proposed AWCP‐EWOA model outperforms compared with AWCP and AWCP‐Whale Algorithm (WA) protocols in terms of clustering efficiency and its mobility enhancement.","[{""name"": ""Senthil Ragavan Valayapalayam Kittusamy"", ""affiliation"": [""Department of Computer Science and Engineering K. Ramakrishnan College of Technology  Trichy India""]}, {""name"": ""Mohamed Elhoseny"", ""affiliation"": [""Faculty of Computers and Information Mansoura University  Mansoura Egypt""]}, {""name"": ""Shankar Kathiresan"", ""affiliation"": [""School of Computing Kalasalingam Academy of Research and Education  Krishnankoil India""]}]","[""10.1109/ATNAC.2014.7020887"", ""10.1109/WCNC.2011.5779289"", ""10.1016/j.procs.2017.12.205"", ""10.1002/dac.2525"", ""10.1109/TVT.2014.2319107"", ""10.1109/LCOMM.2014.2381226"", ""10.1016/j.jnca.2012.12.008"", ""10.1007/s11276-016-1336-6"", ""10.1109/NOMS.2016.7502988"", ""10.1186/s13638-015-0353-y"", ""10.1109/ICCNC.2018.8390297"", ""10.1109/TITS.2015.2504122"", ""10.1109/MITS.2014.2325331"", ""10.1016/j.vehcom.2016.12.003"", ""10.1016/j.compeleceng.2018.01.002"", ""10.1016/j.adhoc.2018.08.010"", ""10.1109/CEC.2015.7256998"", ""10.1016/j.vehcom.2018.04.003"", ""10.1049/iet-ifs.2018.0002"", ""10.1016/j.asoc.2016.09.003"", ""10.1002/ett.3524"", ""10.1109/INAES.2017.8068550"", ""10.1109/CC.2017.7868160"", ""10.1007/978-3-319-92807-4_2"", ""10.1007/978-3-319-92807-4_4"", ""10.1002/sec.1459"", ""10.7763/IJCTE.2017.V9.1141"", ""10.1016/j.advengsoft.2016.01.008"", ""10.1007/s12652‐018‐1161‐0"", ""10.1109/ACCESS.2018.2874026"", ""10.1007/s00521‐018‐3801‐x"", ""10.1109/WF-IoT.2014.6803167""]","['Engineering', 'Computer Science']","['Electrical and Electronic Engineering', 'Automotive Engineering', 'Computer Networks and Communications']","[[('0802 机械工程', 0.7567), ('0811 控制科学与工程', 0.7543), ('0814 土木工程', 0.7511), ('0808 电气工程', 0.7505), ('0807 动力工程及工程热物理', 0.7487)], [('0812 计算机科学与技术', 0.7697), ('0839 网络空间安全', 0.7566), ('0811 控制科学与工程', 0.7551), ('0835 软件工程', 0.7476), ('1405 智能科学与技术', 0.7393)], [('0809 电子科学与技术', 0.7724), ('0808 电气工程', 0.7689)], [('0802 机械工程', 0.7467), ('0811 控制科学与工程', 0.7348)], [('0812 计算机科学与技术', 0.7362), ('0839 网络空间安全', 0.7268)]]"
