DOI,来源,研究方向,论文标题,CR_摘要,CR_作者和机构,CR_参考文献DOI,OpenAlex_field_list,OpenAlex_subfield_list,OpenAlex_map_subjects
10.1108/INTR-08-2019-0347,INTERNET RESEARCH,1202 Business Administration; 0810 Information and Communication Engineering; 0812 Computer Science and Technology,Exploring the mechanism of social media addiction: an empirical study from WeChat users,"PurposeThe problematic use of social media progressively worsens among a large proportion of users. However, the theory-driven investigation into social media addiction behavior remains far from adequate. Among the countable information system studies on the dark side of social media, the focus lies on users' subjective feelings and perceived value. The technical features of the social media platform have been ignored. Accordingly, this study explores the formation of social media addiction considering the perspectives of users and social mediaper seon the basis of extended motivational framework and attachment theory.Design/methodology/approachThis study investigates the formation of social media addiction with particular focus on WeChat. A field survey with 505 subjects of WeChat users was conducted to investigate the research model.FindingsResults demonstrate that social media addiction is determined by individuals' emotional and functional attachment to the platform. These attachments are in turn influenced by motivational (perceived enjoyment and social interaction) and technical (informational support, system quality and personalization) factors.Originality/valueFirst, this study explains the underlying mechanism of how users develop social media addiction. Second, it highlights the importance of users' motivations and emotional dependence at this point. It also focuses on the technical system of the platform that plays a key role in the formation of addictive usage behavior. Third, it extends attachment theory to the context of social media addictive behavior.","[{""name"": ""Xiongfei Cao"", ""affiliation"": []}, {""name"": ""Mingchuan Gong"", ""affiliation"": []}, {""name"": ""Lingling Yu"", ""affiliation"": []}, {""name"": ""Bao Dai"", ""affiliation"": []}]","[""10.1016/j.chb.2016.02.098"", ""10.1108/JOSM-01-2015-0037"", ""10.1257/jep.31.2.211"", ""10.1037/0033-2909.103.3.411"", ""10.2307/23042809"", ""10.1177/002224377701400320"", ""10.1016/j.jcps.2014.05.002"", ""10.1037/0012-1649.28.5.759"", ""10.1016/j.sbspro.2016.11.059"", ""10.1016/j.chb.2017.11.035"", ""10.1016/j.ijinfomgt.2018.11.019"", ""10.1017/S1930297500006598"", ""10.1016/j.jvb.2019.103326"", ""10.1093/rfs/hhu001"", ""10.1016/j.ijinfomgt.2017.04.009"", ""10.1016/j.chb.2016.03.032"", ""10.1002/asi.22939"", ""10.1002/asi.22960"", ""10.1111/j.1559-1816.1992.tb00945.x"", ""10.1016/j.ijinfomgt.2018.01.012"", ""10.1016/j.compedu.2016.05.001"", ""10.1016/j.chb.2016.11.002"", ""10.1016/j.chb.2017.09.002"", ""10.1108/BJM-04-2017-0123"", ""10.1016/j.dss.2014.08.004"", ""10.1016/j.chb.2012.08.006"", ""10.1016/j.ijinfomgt.2015.04.004"", ""10.1016/j.tourman.2017.10.005"", ""10.1108/IntR-04-2016-0091"", ""10.1016/j.jbusres.2008.03.006"", ""10.1016/j.neucom.2016.11.075"", ""10.1016/j.ijinfomgt.2017.12.001"", ""10.1016/j.ijinfomgt.2017.10.006"", ""10.1177/0095399715587520"", ""10.1080/07421222.2019.1628921"", ""10.2307/25148760"", ""10.1287/isre.1060.0107"", ""10.3390/ijerph8093528"", ""10.1016/j.chb.2015.08.011"", ""10.1016/j.chb.2010.12.009"", ""10.4018/jec.2013070102"", ""10.1016/j.im.2014.03.010"", ""10.1016/j.tele.2016.02.002"", ""10.1016/j.chb.2017.01.020"", ""10.1016/j.jretai.2012.08.001"", ""10.1038/s41598-018-19904-y"", ""10.1509/jmkg.74.6.1"", ""10.1016/j.tele.2016.06.004"", ""10.1037/0021-9010.88.5.879"", ""10.2307/41703483"", ""10.2307/25148757"", ""10.1057/ejis.2012.1"", ""10.2307/41409972"", ""10.1108/03090561011062934"", ""10.1016/j.im.2016.12.007"", ""10.1016/j.jbusres.2014.11.024"", ""10.1016/j.dss.2015.08.008"", ""10.1108/IntR-01-2015-0010"", ""10.1111/sjop.12530"", ""10.1108/ITP-10-2016-0237"", ""10.1016/j.im.2014.07.005"", ""10.2224/sbp.6539"", ""10.1016/j.ijinfomgt.2012.02.006"", ""10.1016/j.chb.2016.08.011"", ""10.2753/MIS0742-1222290108"", ""10.1016/j.chb.2014.10.050""]","['Decision Sciences', 'Social Sciences']","['Information Systems and Management', 'Sociology and Political Science']","[[('1201 管理科学与工程', 0.7645), ('0811 控制科学与工程', 0.7569), ('0714 统计学', 0.7511), ('0711 系统科学', 0.7506), ('0812 计算机科学与技术', 0.7461)], [('0303 社会学', 0.7395), ('0714 统计学', 0.7394), ('0503 新闻传播学', 0.7379), ('0602 中国史', 0.7298), ('0304 民族学', 0.7297)], [('1201 管理科学与工程', 0.7741), ('1205 信息资源管理', 0.7676)], [('0302 政治学', 0.7685), ('0303 社会学', 0.7605)]]"
10.1007/s00779-020-01373-8,PERSONAL AND UBIQUITOUS COMPUTING,0810 Information and Communication Engineering; 0812 Computer Science and Technology,Design methodology for 360° immersive video applications: the case study of a cultural heritage virtual tour,"AbstractThree hundred sixty–degree (360°) immersive video applications for Head Mounted Display (HMD) devices offer great potential in providing engaging forms of experiential media solutions especially in Cultural Heritage education. Design challenges emerge though by this new kind of immersive media due to the 2D form of resources used for their construction, the lack of depth, the limited interaction and the need to address the sense of presence. In addition, the use of Virtual Reality (VR) headsets often causes nausea, or motion sickness effects imposing further implications in moderate motion design tasks. This paper introduces a methodological categorisation of tasks and techniques for the design of 360° immersive video applications. Following the design approach presented, a testbed application has been created as an immersive interactive virtual tour at the historical centre of the city of Rethymno in Crete, Greece, which has undergone user trials. Based on the analysis of the results of this study, a set of design guidelines for the implementation of 360° immersive video virtual tours is proposed.","[{""name"": ""Lemonia Argyriou"", ""affiliation"": []}, {""name"": ""Daphne Economou"", ""affiliation"": []}, {""name"": ""Vassiliki Bouki"", ""affiliation"": []}]","[""10.1016/j.procs.2018.10.062"", ""10.1109/IUCC-CSS.2016.028"", ""10.1109/DigitalHeritage.2018.8810127"", ""10.3390/proceedings1090932"", ""10.21236/ADA295861"", ""10.1145/2993369.2993405"", ""10.56140/JOCIS-v3-3"", ""10.1109/VRAIS.1993.380793"", ""10.1109/IS.2018.8710530"", ""10.1109/MMSP.2017.8122249""]","['Arts and Humanities', 'Computer Science']","['Computer Vision and Pattern Recognition', 'Human-Computer Interaction', 'Museology']","[[('1301 艺术学', 0.685), ('0501 中国语言文学', 0.684), ('0502 外国语言文学', 0.6758), ('1405 智能科学与技术', 0.6679), ('0503 新闻传播学', 0.667)], [('0812 计算机科学与技术', 0.7697), ('0839 网络空间安全', 0.7566), ('0811 控制科学与工程', 0.7551), ('0835 软件工程', 0.7476), ('1405 智能科学与技术', 0.7393)], [('0811 控制科学与工程', 0.7558), ('0812 计算机科学与技术', 0.7479)], [('0812 计算机科学与技术', 0.7429), ('0811 控制科学与工程', 0.7383)], [('0601 考古学', 0.7592), ('0602 中国史', 0.7377)]]"
10.1002/ett.3997,TRANSACTIONS ON EMERGING TELECOMMUNICATIONS TECHNOLOGIES,0809 Electronic Science and Technology; 0810 Information and Communication Engineering,Analysis of security and energy efficiency for shortest route discovery in low-energy adaptive clustering hierarchy protocol using Levenberg-Marquardt neural network and gated recurrent unit for intrusion detection system,"AbstractWireless sensor network (WSN) is a collection of a huge number of autonomous sensor nodes having capabilities such as sensing, processing, and manipulation. In any WSN, routing protocols are the backbone for performing all type tasks such as sensing, controlling, and transmission of packets in ubiquitous environment. In this article, a LEACH protocol with Levenberg‐Marquardt neural network (LEACH‐LMNN) is considered to analyze the overall network lifetime. The aim of LEACH‐LMNN protocol comprises two parts: selection of cluster head node using LMNN approach and the second part is to locate the shortest path from the cluster‐head node to base‐station node adopting various route discovery algorithms, that is, breadth‐first search, Bellman‐Ford, and Dijkstra. The simulation result shows that the LEACH‐LMNN protocol with the Dijkstra shortest path algorithm outperforms other route discovery algorithms. In addition to this, this work also analyzes normal and anomaly detection based on intrusion detection system in wireless sensor networks using gated mechanism, that is, long short‐term memory (LSTM) and gated recurrent unit (GRU) in deep learning models. The proposed model achieves the highest detection rate of 97.84% for GRU and 97.85% for LSTM as well as improves the false positive rate (FPR) of 5.87% and 3.88% FPR for GRU and LSTM, respectively.","[{""name"": ""Mohit Mittal"", ""affiliation"": [""Department of Information Science and Engineering Kyoto Sangyo University Kyoto Japan""]}, {""name"": ""Celestine Iwendi"", ""affiliation"": [""Bangor College Central South University of Forestry and Technology Changsha China""]}, {""name"": ""Suleman Khan"", ""affiliation"": [""Department of Computer Science Air University Islamabad Pakistan""]}, {""name"": ""Abdul Rehman Javed"", ""affiliation"": [""Department of Computer Science Air University Islamabad Pakistan""]}]","[""10.1016/S1389-1286(01)00302-4"", ""10.1109/TMC.2010.218"", ""10.1109/TWC.2010.03.090706"", ""10.1007/s11036-012-0361-7"", ""10.1016/j.jcss.2014.12.016"", ""10.1007/s10916-015-0351-y"", ""10.1016/j.future.2017.06.023"", ""10.1145/248157.248176"", ""10.1109/HICSS.2000.926982"", ""10.1109/TWC.2002.804190"", ""10.4108/eai.11-6-2019.160835"", ""10.1016/j.jnca.2018.10.020"", ""10.1007/s11276-015-0983-3"", ""10.1016/j.comnet.2008.04.002"", ""10.1109/JSEN.2016.2554462"", ""10.1504/IJAIP.2015.073699"", ""10.1109/JSEN.2014.2385734"", ""10.1109/CICN.2014.110"", ""10.1109/CICN.2013.40"", ""10.1109/ICASSP.2000.860211"", ""10.1016/j.cose.2019.05.006"", ""10.35940/ijrte.B1606.078219"", ""10.1145/1498915.1498920"", ""10.1109/TSP.2010.2045416"", ""10.1016/j.jnca.2020.102574"", ""10.1109/MNET.2018.1800101"", ""10.1109/TBC.2019.2932338"", ""10.1109/ACCESS.2020.2980942"", ""10.1109/ICC.2018.8422406"", ""10.1109/CSNT.2013.68"", ""10.1371/journal.pone.0222009"", ""10.3390/s18124278"", ""10.1109/CCAA.2016.7813718"", ""10.1109/PDGC.2012.6449787"", ""10.1109/LCOMM.2006.051982"", ""10.1109/TVT.2010.2094631"", ""10.1109/TII.2013.2261082"", ""10.3390/electronics9020219"", ""10.1109/LCOMM.2015.2434373"", ""10.1109/TC.2009.29"", ""10.1049/iet-wss.2017.0099"", ""10.3390/s20082216"", ""10.1007/978-3-319-30933-0_20"", ""10.1007/s10844-015-0388-x"", ""10.1109/SKIMA.2014.7083539"", ""10.1007/978-81-322-2695-6_45""]",['Computer Science'],['Computer Networks and Communications'],"[[('0812 计算机科学与技术', 0.7697), ('0839 网络空间安全', 0.7566), ('0811 控制科学与工程', 0.7551), ('0835 软件工程', 0.7476), ('1405 智能科学与技术', 0.7393)], [('0812 计算机科学与技术', 0.7362), ('0839 网络空间安全', 0.7268)]]"
10.1002/ett.4132,TRANSACTIONS ON EMERGING TELECOMMUNICATIONS TECHNOLOGIES,0809 Electronic Science and Technology; 0810 Information and Communication Engineering,IOTand context-aware learning-based optimal neural network model for real-time health monitoring,"AbstractRecently, numerous context‐aware approaches are established to provide physiological information regarding the wellness and healthcare of each individual. While monitoring the health condition of the patient there occur delays in transferring data to the cloud. So to overcome such types of delays, numerous IoT sensors are developed to monitor, track, and sense the activities of the elder persons. This paper proposes four‐module architecture comprises of IoT module (IoT‐M), data pre‐processing module (DP‐M), context‐aware module (CA‐M) as well as decision‐making module (DM‐M) for storing and processing numerous cumulative sensor data. Here, an IoT comprises a concrete or substantial hardware ecological unit, that is, sensors and actuators. On the other hand, the context‐aware computational approach comprises of insubstantial software ecological unit in understanding and processing the context directly into an accomplishment through various IoT devices. The initial module or the IoT‐M comprises of sensors whereas in the DP‐M phase includes data collection phase, data storage phase, and data redundancy phase. The third phase or the CA‐M comprises two different types of layers namely fog layer, cloud layer. In addition to this, a context‐aware learning phase is also enumerated. In the final phase or the DM‐P phase, the feature extraction and classification is done by Back‐Propagation Neural Network along with the Adaptive grasshopper optimization algorithm so as to obtain a best optimal solution. Thus, an alarm or a notification is sent to the medical practitioner regarding the health condition of the patient with very less response time, high accuracy, and a high scalability rate. The evaluation results and discussions are made by comparing our proposed approach with several other approaches and the evaluation results reveal that the proposed framework provides better results with high accuracy, scalability, network latency, and low response time.","[{""name"": ""D. Kavitha"", ""affiliation"": [""Department of Computer Science and Engineering SRM Valliammai Engineering College  Chengalpattu India""]}, {""name"": ""S. Ravikumar"", ""affiliation"": [""Department of Information Technology SRM Valliammai Engineering College  Chengalpattu India""]}]","[""10.1109/JIOT.2014.2360121"", ""10.1109/JIOT.2014.2366110"", ""10.1109/JIOT.2014.2364407"", ""10.1016/j.jsams.2012.11.183"", ""10.1007/s12652-020-02419-8"", ""10.1007/s12652-020-02424-x"", ""10.1166/jctn.2017.6602"", ""10.1002/cpe.5517"", ""10.1007/s11277-018-6014-9"", ""10.1016/j.cose.2018.04.009"", ""10.1007/s11042-019-7577-5"", ""10.1504/IJBET.2019.103242"", ""10.22266/ijies2016.0930.12"", ""10.1016/j.inffus.2013.04.003"", ""10.1002/ett.3637"", ""10.1016/j.pmcj.2014.09.006"", ""10.1002/ett.3646"", ""10.1007/s10916-015-0287-2"", ""10.1007/978-3-319-03176-7_20"", ""10.1109/MNET.2019.1800083"", ""10.1016/j.scs.2017.09.004"", ""10.1016/j.jbi.2019.103251"", ""10.1109/GLOCOM.2017.8255023"", ""10.1016/j.procs.2016.04.103"", ""10.1016/j.future.2019.01.008"", ""10.1109/ISQED.2019.8697739"", ""10.1109/JIOT.2017.2670022"", ""10.1007/s10916-016-0644-9"", ""10.1007/s10796-012-9374-9"", ""10.1145/2346604.2346608"", ""10.1016/j.cose.2013.09.001"", ""10.1016/j.comnet.2012.07.010"", ""10.1145/373256.373258"", ""10.1016/j.inffus.2014.01.001"", ""10.1109/ICCNC.2013.6504160"", ""10.1016/j.jnca.2020.102762"", ""10.1186/s40537-019-0219-y"", ""10.1186/s40537-019-0258-4"", ""10.1007/s11036-019-01443-z"", ""10.1016/j.future.2017.10.045"", ""10.3390/s140814070"", ""10.4018/JCIT.2017100101"", ""10.1109/JSEN.2020.2964278"", ""10.1109/ACCESS.2018.2797976"", ""10.1016/j.advengsoft.2017.01.004"", ""10.1007/978-3-030-29962-0_13""]","['Engineering', 'Computer Science']","['Computer Networks and Communications', 'Computer Vision and Pattern Recognition', 'Biomedical Engineering']","[[('0802 机械工程', 0.7567), ('0811 控制科学与工程', 0.7543), ('0814 土木工程', 0.7511), ('0808 电气工程', 0.7505), ('0807 动力工程及工程热物理', 0.7487)], [('0812 计算机科学与技术', 0.7697), ('0839 网络空间安全', 0.7566), ('0811 控制科学与工程', 0.7551), ('0835 软件工程', 0.7476), ('1405 智能科学与技术', 0.7393)], [('0812 计算机科学与技术', 0.7362), ('0839 网络空间安全', 0.7268)], [('0811 控制科学与工程', 0.7558), ('0812 计算机科学与技术', 0.7479)], [('0831 生物医学工程', 0.7587), ('0836 生物工程', 0.7385)]]"
10.1108/INTR-06-2020-0332,INTERNET RESEARCH,1202 Business Administration; 0810 Information and Communication Engineering; 0812 Computer Science and Technology,Cyberloafing and cyberslacking in the workplace: systematic literature review of past achievements and future promises,"PurposeScholars are increasingly focusing on the adverse effects of digitization on human lives in personal and professional contexts. Cyberloafing is one such effect and digitization-related workplace behavior that has garnered attention in both academic and mainstream media. However, the existing literature is fragmented and needs to be consolidated to generate a comprehensive and contemporary overview of cyberloafing research and map its current intellectual boundaries. The purpose of this paper is to shed some light on systematic literature review (SLR) in cyberloafing and cyberslacking in the workplace.Design/methodology/approachA SLR is conducted to assimilate the existing research. A total of 87 studies selected through a robust protocol are analyzed through content analysis.FindingsA total of four thematic research areas and inherent gaps are identified, including conceptualization, operationalization, antecedents and stakeholders and consequences. Results are used to assimilate thematic gaps and potential research questions (RQs) to be addressed by future scholars. To advance cyberloafing research, the authors propose a theoretically grounded comprehensive framework based on the SLR findings.Originality/valueOur study's novelty rests in its state-of-the-art synthesis of cyberloafing research, which encompasses a broader scope than prior SLRs. Furthermore, developing a theoretically grounded comprehensive framework for advancing future research is a unique contribution of this study.","[{""name"": ""Anushree Tandon"", ""affiliation"": []}, {""name"": ""Puneet Kaur"", ""affiliation"": []}, {""name"": ""Namita Ruparel"", ""affiliation"": []}, {""name"": ""Jamid Ul Islam"", ""affiliation"": []}, {""name"": ""Amandeep Dhir"", ""affiliation"": []}]","[""10.1108/INTR-05-2019-0208"", ""10.1016/j.chb.2016.03.069"", ""10.1016/j.chb.2017.02.043"", ""10.1080/08874417.2019.1571455"", ""10.1089/cpb.2006.9.325"", ""10.1016/j.chb.2019.07.013"", ""10.1111/jcc4.12085"", ""10.1007/s10551-017-3764-3"", ""10.1037/mgr0000061"", ""10.1016/j.chb.2014.04.006"", ""10.1177/1548051818813091"", ""10.1108/JICES-07-2019-0081"", ""10.1016/j.ijmedinf.2019.04.024"", ""10.4018/joeuc.2014100102"", ""10.1007/s10551-018-4026-8"", ""10.1007/s11747-014-0399-0"", ""10.1016/j.jclepro.2020.122861"", ""10.1111/j.1365-2648.2007.04569.x"", ""10.1007/s10639-021-10496-1"", ""10.1016/S1053-4822(98)90004-3"", ""10.1111/j.1083-6101.2008.00425.x"", ""10.1089/cpb.2007.0146"", ""10.1016/j.im.2014.08.001"", ""10.1080/0144929X.2019.1617350"", ""10.1089/cyber.2017.0239"", ""10.1016/j.chb.2009.03.005"", ""10.1111/emre.12407"", ""10.1080/0960085X.2020.1756701"", ""10.1177/1049732305276687"", ""10.1007/s12144-021-01690-y"", ""10.1108/IntR-12-2014-0317"", ""10.1166/asl.2017.10049"", ""10.1080/10447318.2019.1597574"", ""10.1177/1548051813488208"", ""10.1080/08824096.2012.746221"", ""10.1108/INTR-08-2019-0360"", ""10.18089/tms.2021.170103"", ""10.1108/PR-01-2020-0026"", ""10.1108/INTR-04-2020-0187"", ""10.1080/07421222.2017.1297173"", ""10.1007/s10799-017-0280-1"", ""10.1080/17517575.2020.1812005"", ""10.1080/17517575.2020.1734241"", ""10.1002/hrm.21699"", ""10.1016/j.infsof.2008.09.009"", ""10.1108/IntR-07-2017-0268"", ""10.1108/MRR-11-2016-0252"", ""10.1016/j.jebo.2016.09.008"", ""10.1016/j.chb.2013.09.021"", ""10.1016/j.chb.2016.11.021"", ""10.2307/2529310"", ""10.1177/089443930101900403"", ""10.1016/j.chb.2011.06.015"", ""10.1002/job.161"", ""10.1080/01449290903353054"", ""10.1016/j.im.2004.12.002"", ""10.1108/INTR-03-2020-0165"", ""10.1080/10447318.2020.1752475"", ""10.1016/j.chb.2016.02.078"", ""10.1108/CDI-08-2017-0142"", ""10.1007/s11192-015-1765-5"", ""10.1016/j.im.2013.04.005"", ""10.1108/INTR-04-2019-0138"", ""10.1177/0276146713481605"", ""10.1016/j.chb.2014.02.015"", ""10.1016/j.chb.2014.08.005"", ""10.1111/j.1467-9310.2011.00643.x"", ""10.1016/j.chb.2018.04.040"", ""10.1016/j.jrp.2011.01.006"", ""10.1504/JGBA.2017.091931"", ""10.1016/j.jretconser.2020.102071"", ""10.1016/j.chb.2015.04.042"", ""10.1080/0144929X.2019.1580311"", ""10.1177/1548051809350893"", ""10.1080/02678373.2017.1367736"", ""10.1016/j.ausmj.2020.06.014"", ""10.1016/j.compind.2020.103290"", ""10.1108/INTR-11-2019-0455"", ""10.1016/j.chb.2012.11.005"", ""10.1080/0144929X.2019.1683607"", ""10.1016/j.chb.2011.03.002"", ""10.1007/s10799-013-0164-y"", ""10.1016/j.jbusres.2020.02.043"", ""10.1016/j.soscij.2018.10.011"", ""10.1108/INTR-10-2018-0469"", ""10.1007/s12144-021-01505-0"", ""10.1108/02683940610684418"", ""10.1089/cpb.2006.9931"", ""10.1108/10444060910949630"", ""10.1108/02635571011069095"", ""10.1177/1548051817696877"", ""10.1108/10662240610690052"", ""10.1108/PR-12-2017-0384""]","['Economics, Econometrics and Finance', 'Social Sciences']","['Economics and Econometrics', 'Demography', 'Sociology and Political Science']","[[('0202 应用经济学', 0.766), ('0714 统计学', 0.7639), ('0201 理论经济学', 0.7634), ('1202 工商管理学', 0.7449), ('0701 数学', 0.7423)], [('0303 社会学', 0.7395), ('0714 统计学', 0.7394), ('0503 新闻传播学', 0.7379), ('0602 中国史', 0.7298), ('0304 民族学', 0.7297)], [('0202 应用经济学', 0.7539), ('0201 理论经济学', 0.7475)], [('0303 社会学', 0.7387), ('0714 统计学', 0.7288)], [('0302 政治学', 0.7685), ('0303 社会学', 0.7605)]]"
